id,created_at,text
1247248483024809985,2020-04-06 19:43:05,Newspapers across the country are helping spread the word to Americans on the importance of responding to the Census by publishing my note to their editors. Thank you to these publications for taking this action. Respond today at https://t.co/yVXNdtVvQe. https://t.co/fLrBmCn4xg
1247241902010904582,2020-04-06 19:16:56,"President Trump champions the farmers and food manufacturers who drive our country’s agricultural economy. In addition to providing current food and forestry tenants with production and storage space, the project will enable businesses to capitalize on food tourism opportunities. https://t.co/qBVpF4CWWG"
1246189694586703873,2020-04-03 21:35:50,"The Trump Administration is committed to not only retaining jobs in this country, but also to building resistance to natural disasters. This investment in #NorthCarolina will support the construction of new gravity storm drains to allow reliable access to the local biz community. https://t.co/gcBC3ofg05"
1246103640504438784,2020-04-03 15:53:54,"RT @CommerceGov: On this day in 1996, former Secretary of Commerce Ron Brown and 11 Commerce employees were killed in a plane crash near Du…"
1246101131052208128,2020-04-03 15:43:55,"The census happens just once every 10 years &amp; your response affects the allocation of congressional seats &amp; federal funds to your community — for resources such as schools, hospitals, roads, &amp; emergency services. Please take a few minutes &amp; respond today: https://t.co/Xht9vY4RW5. https://t.co/q69omyXEV9"
1245816439451398149,2020-04-02 20:52:39,The Trump Administration is working hard to fulfill our commitments to rebuild infrastructure impacted by natural disasters in #SouthCarolina. The improved infrastructure will protect established businesses from future severe weather events &amp; attract new businesses to the region. https://t.co/djZUzapFai
1245747258974441474,2020-04-02 16:17:46,"The success of the #2020Census depends on all Americans. Everyone can answer the Census from the comfort and safety of your home either online, over the phone, or through the mail. #DoYourPart https://t.co/yVXNdtVvQe #BeCounted #EveryoneCounts https://t.co/JSSdWIqWHt"
1245447298915672073,2020-04-01 20:25:50,The Trump Administration understands that investing in infrastructure creates jobs for #AmericanWorkers. This grant will enable the region to become more resilient to the economic impact of flooding &amp; mudslides by accelerating the growth of new biz &amp; strengthening the workforce. https://t.co/7AfmmzaEdk
1245416315986366466,2020-04-01 18:22:43,"Today, our nation celebrates #CensusDay. Please take a few minutes to respond to the #2020Census by visiting https://t.co/Xht9vXNh4x. You can respond online, over the phone, or through the mail. #BeCounted https://t.co/f2Uq8z8CMh"
1245063289815654400,2020-03-31 18:59:55,"The Trump Administration is committed to creating new opportunities for Americans. This new training facility will prepare students for careers in specialized industries, equipping the region’s economy to become resilient in the face of future disasters. https://t.co/uJggEmlF00"
1245057373284245504,2020-03-31 18:36:24,"These new grants contribute to President Trump's whole of-America response to the #COVID19 outbreak. These grants will be awarded with speed and agility, as the Department of Commerce aims to work at the ‘speed of business’ to meet this unprecedented health challenge. https://t.co/0Rc1HD0XXj"
1243673045610397697,2020-03-27 22:55:35,"Thank you President Trump, Secretary Mnuchin, and our Congressional leaders of both parties for your work to pass today's historic legislation to bring much needed relief to the American people and our businesses. Read my full statement at https://t.co/VJYKKj2g96 #CARESAct https://t.co/yXpQKRnlb8"
1243592556115570689,2020-03-27 17:35:44,RT @EximBankUS: #EXIM thanks Secretary of @CommerceGov Wilbur Ross for joining yesterday’s Board of Directors’ teleconference meeting to ad…
1243274723703894017,2020-03-26 20:32:47,The Trump Administration is committed to the resilience of local economies by encouraging companies to locate and expand within #OpportunityZones. I look forward to seeing the new Valdosta Area Business Incubator help a wide variety of businesses prosper in the region. https://t.co/yDb2xvgkc4
1242889387471486978,2020-03-25 19:01:36,President Trump is committed to improving our nation’s infrastructure &amp; supporting communities as they rebuild after natural disasters. The improvements made to the Highway 278 corridor will make Jasper County more economically resilient by attracting new industry to the region. https://t.co/j9VGXtgShz
1240647591139909636,2020-03-19 14:33:30,".@realDonaldTrump is working every day to empower our nation’s entrepreneurs so they can grow, thrive, and create new businesses. This project will provide the space needed for new business ventures to diversify and grow the economy in the Lake Agassiz region. https://t.co/QU2Rzx1vIr"
1240442995826135047,2020-03-19 01:00:31,We can all do our part part to slow the spread of this #coronavirus. https://t.co/aifoezfRb7
1240427790090014722,2020-03-19 00:00:05,"It has never been easier to respond to the #2020Census whether online, over the phone or by mail. Respond today at https://t.co/ZM3xJyf0RT https://t.co/LVqd4DvmUt"
1240416295599968256,2020-03-18 23:14:25,"In the fight against the #coronavirus, the Trump administration is not just taking a whole of government approach, but a whole of America approach. Read @VP OP-ED in @USAToday https://t.co/jWyEJpVCRT https://t.co/VilOCK8c0q"
1240027642029576193,2020-03-17 21:30:03,"For more information on #COVID19, please follow @CDCgov. https://t.co/Rpyw8vPs8V"
1240008766457856001,2020-03-17 20:15:02,We each have a critical role to play to stop the spread of #coronavirus. https://t.co/sPE3T3wbO9
1239969645202829312,2020-03-17 17:39:35,Efforts by companies to illicitly procure U.S. technologies in support of unsafeguarded WMD programs are unacceptable and will not be tolerated. The Department of Commerce will continue to aggressively investigate and designate parties who do so. ➡️ https://t.co/MgyJCMJ9Uo https://t.co/iOzT0RCBwq
1239951152017551360,2020-03-17 16:26:06,.@realDonaldTrump released new guidelines to help protect Americans during the global #Coronavirus outbreak. Do your part to slow the spread of #COVID19. https://t.co/7cfyWjoQ4U
1239714730446594050,2020-03-17 00:46:39,We each have a critical role role to play to stop the spread of this virus. Do your part. #CoronaVirus https://t.co/mou6ChEoNi
1239212257311105029,2020-03-15 15:30:00,".@POTUS has made the safety, security, &amp; health of the American people his top priority from day one of this Administration."
1239204712915914753,2020-03-15 15:00:01,"Since the very beginning of the Coronavirus outbreak, the President has taken an unprecedented whole-of-government approach to protect the American people. https://t.co/EEaZOm8Pgs"
1238967571266834432,2020-03-14 23:17:42,"RT @WhiteHouse: What the federal government is doing right now to protect public health, cut red tape, and empower healthcare providers: ht…"
1238965969785159680,2020-03-14 23:11:20,https://t.co/Eb5NmNvSa7
1238965967897665539,2020-03-14 23:11:20,The @uscensusbureau is carefully monitoring the coronavirus (#COVID19) situation and will fulfill our obligation to deliver the #2020Census counts to the President of the United States. https://t.co/7Y7SLnah2k
1238586585400193024,2020-03-13 22:03:48,President Trump continued his strong leadership in the face of this crisis by declaring a National Emergency today to make more resources rapidly available to continue fighting COVID-19. It is this very leadership that has saved countless lives since the outbreak began. https://t.co/x1MWbPsetu
1238149847783530496,2020-03-12 17:08:22,"Since the very beginning of the Coronavirus outbreak, the President has taken an unprecedented whole-of-government approach to protect the American people. https://t.co/EEaZOm8Pgs"
1238149846923718658,2020-03-12 17:08:21,".@POTUS has made the safety, security, &amp; health of the American people his top priority from day one of this Administration."
1237034016232046595,2020-03-09 15:14:27,"President @realDonaldTrump understands that reliable and modern infrastructure is fundamental to business development and success. This project in @Springdale_AR will widen Kendrick Avenue and connect it to Highway 265, which will allow for expedited business growth. https://t.co/t8NImBPkEt"
1236713290845339648,2020-03-08 18:00:00,The @realDonaldTrump Administration is working continuously to support natural disaster recovery efforts in Texas. This project will support revitalization of the San Angelo region and rebuilding of impacted communities. https://t.co/YFhQdc0wmV …
1236652899284869121,2020-03-08 14:00:01,"The election of Daren Tang as Director General of the @WIPO is good news for the global economy. Mr. Tang understands the importance of intellectual property rights to inventors, artists, entrepreneurs, and companies.  https://t.co/rjzQArR276 …"
1236630245140074496,2020-03-08 12:30:00,"America has answered the call &amp; is ready to answer the #2020Census. With unemployment rates at historic lows, recruiting is a big challenge. I congratulate our recruitment staff, &amp; our community partners, for recruiting more than 2.6 million applicants. https://t.co/VtfhvivNlc …"
1236366004910993409,2020-03-07 19:00:00,"On February 12, 2020, the United Nations High Commissioner for Human Rights issued a “blacklist” of companies, including several U.S. companies, that do business in Israel-controlled territories. https://t.co/s1UaMfpvZv"
1236305604525699072,2020-03-07 15:00:00,Thank you @PerformanceGov for recognizing the work of so many  Commerce employees. These hard-working public servants exemplify America's best &amp; I am proud of the work they do everyday to improve the quality of life for Americans now and in the future. https://t.co/uNvPoYJgcN …
1236018014522421250,2020-03-06 19:57:13,"America has answered the call, and is ready to answer the #2020Census. With unemployment rates at historic lows, recruiting is a big challenge. I congratulate our recruitment staff, and our community partners for recruiting more than 2.6 million applicants nationwide. https://t.co/VtfhviectE"
1236004605680640012,2020-03-06 19:03:56,"RT @IvankaTrump: 1 yr ago today we hosted the 1st American Workforce Policy Advisory Board mtg.
Our mission every day is to create jobs &amp;⬆️…"
1235953389755920389,2020-03-06 15:40:25,"RT @WhiteHouse: ""Job numbers just came out, and they're incredible."" https://t.co/43CJSIx7fF"
1235666647651766272,2020-03-05 20:41:01,The @realDonaldTrump Administration is working continuously to support natural disaster recovery efforts in Texas. This project will support revitalization of the San Angelo region and rebuilding of impacted communities. https://t.co/YFhQdbIUYl
1235361608722939904,2020-03-05 00:28:54,"The election of Daren Tang as Director General of the @WIPO is good news for the global economy. Mr. Tang understands the importance of intellectual property rights to inventors, artists, entrepreneurs, companies, and all those whose livelihoods depend on their creative genius. https://t.co/rjzQAs8DvG"
1234934420060155904,2020-03-03 20:11:24,The work of Commerce's National Institute of Standards and Technology provides U.S. companies with critical support to promote competitiveness. Thank you for 119 years of service and happy birthday @NIST! https://t.co/thDLwUCvnR
1234845400638595073,2020-03-03 14:17:40,The Government of the United States fully supports the U.S. companies identified on the list and encourages all U.S. businesses to continue to work with and invest in Israeli as well as Palestinian communities.
1234845399912996864,2020-03-03 14:17:40,"Boycotts against Israel and companies doing business with and in Israel are contrary to longstanding U.S. policy. The UN “blacklist” is anti-business, seeks to isolate Israel, has no factual basis or legal force whatsoever, and should not be adhered to in any respect."
1234845399040561152,2020-03-03 14:17:40,"On February 12, 2020, the United Nations High Commissioner for Human Rights issued a “blacklist” of companies, including several U.S. companies, that do business in Israel-controlled territories."
1234624109407035394,2020-03-02 23:38:20,Thank you @PerformanceGov for recognizing the work of so many Department of Commerce employees. These hard-working public servants exemplify America's best and I am proud of the work they do everyday to improve the quality of life for Americans now and in the future. https://t.co/uNvPoYrFlf
1234191675456729089,2020-03-01 19:00:00,"Community partners for the #2020Census are critical towards achieving an accurate count. I applaud the @uscensusbureau for gaining the support of 300,000 partners to help reach millions of households &amp; remind them the census is safe, easy, &amp; important. https://t.co/JjV0PuHEyT …"
1234146377661370374,2020-03-01 16:00:00,"The Trump Administration continues to work diligently to rebuild communities devastated by natural disasters. By providing small businesses with gap financing to recover and grow, this investment will create stronger communities within the region. https://t.co/KwNvblGhCv …"
1234131281740431361,2020-03-01 15:00:01,"The @US_EDA grant to Lycoming County, #Pennsylvania reflects the @realDonaldTrump Administration’s diligent work to rebuild our Nation’s #infrastructure, including in #OpportunityZones that have been greatly impacted by natural disasters. https://t.co/GlItgNbfsA …"
1233874585990451200,2020-02-29 22:00:00,"Thank you @ImranKhanPTI, &amp; to your government, for your hospitality. The work Pakistan has begun to do to fight terrorism &amp; promote security is affording the US &amp;  Pakistan the opportunity to strengthen trade in the region &amp; between our countries. https://t.co/YviKhQAXyb …"
1233859488517480449,2020-02-29 21:00:00,It was an honor to meet w/ US companies based in Pakistan &amp; discuss ways the US gov't can support improving prospects for their success. Protecting their interests &amp; removing tariff &amp; non-tariff barriers is a priority for the @realDonaldTrump Admin. https://t.co/hD0xXAwj55 …
1233844389056634880,2020-02-29 20:00:00,"As President Trump said in India, “our relationship with Pakistan is a very good one.” It was an honor to meet with Pakistan’s Prime Minister @ImranKhanPTI in Islamabad earlier this week on ways to boost trade and investment between the U.S. and Pakistan."
1233814187861655553,2020-02-29 18:00:00,The $65 million allocation from @NOAAFisheries will support hard-working fishing communities in key states across America and will help them recover from recent disasters and make them more resilient to future challenges. https://t.co/VXsAtkRLk5 …
1233799089344483328,2020-02-29 17:00:00,"New single-family home sales increased 7.9% in January, the highest level since July 2007. Thanks to @realDonaldTrump, more Americans are able to own a new home due to historic unemployment, higher wages, and declining interest rates. https://t.co/8DBLopZDOG …"
1233768891072966659,2020-02-29 15:00:00,"Yesterday's data from @BEA_News shows wages for all Americans, as well as consumer spending, rose in January. The @realDonaldTrump Administration continues to produce real results for #AmericanWorkers. https://t.co/4QgdqRWOCj …"
1233459404869074946,2020-02-28 18:30:13,"Today's data from @BEA_News shows wages for all Americans, as well as consumer spending, rose in January. The @realDonaldTrump Administration continues to produce real results for #AmericanWorkers. https://t.co/4QgdqSeq0T"
1233171167193767937,2020-02-27 23:24:52,This $65 million allocation from @NOAAFisheries will support hard-working fishing communities in key states across America and will help them recover from recent disasters and make them more resilient to future challenges. https://t.co/VXsAtkAasx
1233060521265500160,2020-02-27 16:05:12,"Community partners for the #2020Census are critical towards achieving an accurate count. I applaud the @uscensusbureau for soliciting the support of 300,000 partners to help reach millions of households &amp; remind them that answering the census is safe, easy, &amp; important. https://t.co/JjV0PuHEyT"
1232806070453710854,2020-02-26 23:14:06,"Thank you Prime Minister @ImranKhanPTI, and to your government, for your hospitality. The work Pakistan has begun to do to fight terrorism &amp; promote security is affording the U.S. and Pakistan the opportunity to strengthen &amp; expand trade in the region &amp; between our countries. https://t.co/YviKhQAXyb"
1232802790445023232,2020-02-26 23:01:04,"Congratulations to the @uscensusbureau on this remarkable achievement. Having been an enumerator myself, I value the importance of having an established workforce to carry out the census, the largest civilian government undertaking in America. #2020Census https://t.co/gKUqhxBoGp https://t.co/fU419iz5Z5"
1232724729817112578,2020-02-26 17:50:53,"New single-family home sales increased 7.9% in January, the highest level since July 2007. Thanks to @realDonaldTrump, more Americans are able to own a new home due to historic unemployment, higher wages, and declining interest rates. https://t.co/8DBLopI2X8"
1232717311242625026,2020-02-26 17:21:24,It was an honor to meet with U.S. companies based in Pakistan and discuss ways the U.S. government can support improving prospects for their success. Protecting their interests and removing tariff and non-tariff barriers is a priority for the @realDonaldTrump Administration. https://t.co/hD0xXAeIdx
1232690856584454145,2020-02-26 15:36:17,"RT @pid_gov: US Secretary of Commerce Mr. Wilbur Ross called on Prime Minister Imran Khan at PM Office Islamabad.
@SecretaryRoss @PakPMO ht…"
1232508079616471042,2020-02-26 03:29:59,"As President Trump said this week, “our relationship with Pakistan is a very good one.” I look forward to meeting with Pakistan’s Prime Minister @ImranKhanPTI in Islamabad today on ways to boost trade and investment between the U.S. and Pakistan."
1232366332286586880,2020-02-25 18:06:44,"The Trump Administration continues to work diligently to rebuild communities devastated by natural disasters. By providing small businesses with gap financing to recover and grow, this investment will create stronger and more economically resilient communities within the region. https://t.co/KwNvblGhCv"
1232114499680972800,2020-02-25 01:26:02,"I am proud to join President @realDonaldTrump during his first official trip to India and look forward to addressing the @USIBC today. This trip here shows just how significant the U.S.-India relationship is both strategically, and commercially. https://t.co/30qZ0pjjfi"
1232091276767567872,2020-02-24 23:53:46,"The @US_EDA grant to Lycoming County, #Pennsylvania reflects the @realDonaldTrump Administration’s diligent work to rebuild our Nation’s #infrastructure, including in #OpportunityZones that have been greatly impacted by natural disasters. https://t.co/GlItgNbfsA"
1231670061104009216,2020-02-23 20:00:00,"We are committed to putting America on course to having the world's best forecasts, powered by fast supercomputers and exceptional weather models. By employing innovation and technology, we are safeguarding our Nation. https://t.co/8RMAE5sm4O …"
1231639863495016448,2020-02-23 18:00:00,"America's fishermen and seafood industries underpin our strong blue economy. U.S. fisheries are among the world's most sustainable and support thousands of jobs, provide billions of dollars in revenue, and provide protein-rich options to dinner tables. https://t.co/9AyooguS3K …"
1231594565427134464,2020-02-23 15:00:00,"Since @realDonaldTrump was elected, GDP growth has smashed expectations, 7.1 million jobs have been created, unemployment is at a 50-year low, incomes continue to rise, and free and fair trade policies have created more opportunities for U.S. companies. https://t.co/7Hb2tibWPq"
1231307671992664065,2020-02-22 20:00:00,"This week, we celebrate our nation's #entrepreneurs. They are the backbone of the U.S. economy and their competitive spirit and commitment to excellence is what drives our country forward and continues to fuel our economic resurgence. #NatlEshipWeek https://t.co/b5EALZNt5E"
1231277474413150210,2020-02-22 18:00:00,"Congratulations @bouldercolorado for topping the U.S. &amp; being among 350 of 355 of our Nation's largest counties that experienced wage growth. Thanks to  @realDonaldTrump, unemployment is at a 50-year low, boosting incomes for the majority of Americans. https://t.co/KcUzAItnKF …"
1231232179234955264,2020-02-22 15:00:01,"Consumer spending is a fundamental driver of the U.S. economy. During the final quarter of both 2018 and 2019, retail e-commerce sales soared, producing measurable results for our Nation's booming economy. https://t.co/ALTiCv8GXZ …"
1230936421378273280,2020-02-21 19:24:47,"We are committed to putting America on course to having the world's best forecasts, powered by fast supercomputers and exceptional weather models. By employing innovation and technology, we are safeguarding our Nation. https://t.co/8RMAE5sm4O"
1230906760027918337,2020-02-21 17:26:55,"America's fishermen and seafood industries underpin our strong blue economy. U.S. fisheries are among the world's most sustainable and support thousands of jobs, provide billions of dollars in revenue, and provide protein-rich options to dinner tables. https://t.co/9AyoogMtsk"
1230897372814811136,2020-02-21 16:49:37,"Since @realDonaldTrump was elected, GDP growth has smashed expectations, 7.1 million jobs have been created, unemployment is at a 50-year low, incomes continue to rise, and free and fair trade policies have created more opportunities for U.S. companies. https://t.co/7Hb2tibWPq"
1230871148373696514,2020-02-21 15:05:24,"This week, we celebrate our nation's #entrepreneurs. They are the backbone of the U.S. economy and their competitive spirit and commitment to excellence is what drives our country forward and continues to fuel our economic resurgence. #NatlEshipWeek https://t.co/b5EALZNt5E"
1230532776803340289,2020-02-20 16:40:50,"Congratulations @bouldercolorado for topping the U.S. and being among 350 of 355 of our Nation's largest counties that experienced wage growth. Thanks to the policies of @realDonaldTrump, unemployment is at a 50-year low, boosting incomes for the majority of Americans. https://t.co/KcUzAItnKF"
1230201328770670593,2020-02-19 18:43:47,"Consumer spending is a fundamental driver of the U.S. economy. During the final quarter of both 2018 and 2019, retail e-commerce sales soared, producing measurable results for our Nation's booming economy. https://t.co/ALTiCvqimz"
1229193743649169408,2020-02-17 00:00:00,Congratulations to the 2020 class of @InventorsHOF inductees. Your contributions to American innovation ensures that we continue our proud legacy of ingenuity and innovation. #NIHF2020 @uspto https://t.co/f6LlnoVCHD …
1229140895435546624,2020-02-16 20:30:00,"Poland is an ally, strategic partner, &amp; longtime friend of the U.S. It was an honor to meet w/ Minister of Finance Tadeusz #Kościński &amp; Adam Guibourgé Czetwertyński of Poland's Ministry of Climate &amp; address ways to further increase our trade relationship. https://t.co/RGnc9gvy7H"
1229125795555225607,2020-02-16 19:30:00,Poland is a strategic partner and longtime friend of the United States. It was an honor to meet with the Poland Minister of Development @JEmilewicz and I look forward to expanding commercial ties between our two countries. https://t.co/im4h3cAF81 …
1229118248488034304,2020-02-16 19:00:01,It was my pleasure to meet with the @AMChamPoland. They are instrumental in generating economic growth in Poland. https://t.co/Ry3dNUFlLt …
1229072950009221120,2020-02-16 16:00:01,Thank you @IvankaTrump for your leadership on #WGDP. @CommerceGov is committed to greater economic participation by women in developing countries by working to reduce legal and regulatory barriers to entry around the world. https://t.co/fSstdYuwTQ …
1228801155834138625,2020-02-15 22:00:00,.@realDonaldTrump's commitment to making America safe &amp; resilient is put into action by this Executive Order that will make PNT services more reliable &amp; help protect against costly disruptions in services that can put Americans in harm’s way. https://t.co/8mxdkvsA6C …
1228770958552502272,2020-02-15 20:00:00,It was an honor to meet w/ Austrian Minister of Environment @lgewessler &amp; Finance Minister @Gernot_Bluemel this week. Austria is a leader in foreign direct investment in the U.S. &amp; I look forward to deepening the connections between the U.S. and Austria. https://t.co/pJRumiNSbJ
1228740760234795013,2020-02-15 18:00:00,"America’s science, technology, engineering, and math workforce is crucial to our innovation and global competitiveness. I am proud that the Commerce Department is home to so many #WomenInScience who make a difference in the lives of Americans. #WomenInSTEM"
1228710564269920256,2020-02-15 16:00:01,"Our Nation’s governors are instrumental in furthering the President's economic agenda by increasing rural broadband connectivity, creating more opportunities for American workers, revitalizing underserved communities, and achieving an accurate #2020Census. https://t.co/xrd3366iDj"
1228695465295843328,2020-02-15 15:00:01,President @realDonaldTrump's dedication to the success of all Americans has fostered an unprecedented period of growth for our economy and created the biggest economic boom in our nation’s history. https://t.co/I3I76oGUFY …
