id,created_at,text
1247306335433170944,2020-04-06 23:32:58,Glad to hear you’re feeling better! Thank you for applying for @RedCross plasma donation &amp; helping combat this invisible enemy. https://t.co/IU5K6WJ8eM
1247205220276490242,2020-04-06 16:51:11,"RT @SBAJovita: Faith-based organizations are eligible to participate without restrictions based on their religious identity or activities,…"
1247204506539974658,2020-04-06 16:48:20,"RT @SBAJovita: Faith-based organizations have always provided critical social services for people in need, and @SBAgov will make clear that…"
1246579555676164101,2020-04-04 23:25:01,RT @FHFA: Director Mark Calabria talked w/ @EricShawnTV about helping homeowners and renters impacted by COVID-19 on @FoxNews. Urges those…
1246097038082801664,2020-04-03 15:27:39,RT @CFPB: Here’s how mortgage forbearance works under the CARES Act: https://t.co/0YV38mFS7l
1245786494847143938,2020-04-02 18:53:40,"Nearly $64 million of @HUDgov #CARESAct funding will help Americans with compromised immune systems by increasing the level of safe, stable housing for persons living with HIV/AIDS and their household members by providing short-term lodging assistance to address isolation needs."
1245786493991387138,2020-04-02 18:53:40,"$1 billion of @HUDgov #CARESAct funding will keep America’s homeless citizens safe by building more emergency shelters, providing hotel/motel vouchers for homeless families, and provide essential service to people experiencing homelessness including education and childcare."
1245786493098082315,2020-04-02 18:53:40,"$2 billion of @HUDgov #CARESAct funding will help states, communities and non-profits to construct medical facilities for testing and treatment, expand the capacity of hospitals, and support businesses manufacturing medical supplies."
1245786492083015686,2020-04-02 18:53:39,"Less than a week after @realDonaldTrump signed the #CARESAct coronavirus relief bill, I’m pleased @HUDgov is today announcing the allocations of more than $3 billion to help America’s low-income families and most vulnerable citizens. Read the release here: https://t.co/pHUx3BTzDM"
1245744614717431808,2020-04-02 16:07:15,"RT @HUDgov: To assist local communities in their response to #COVID19, we’re providing guidance to local homeless service providers on how…"
1245744601547386885,2020-04-02 16:07:12,"RT @HUDgov: During this unprecedented time, we’re providing waivers to certain requirements for Community Planning &amp; Development programs t…"
1245721638576013314,2020-04-02 14:35:57,Read more to learn about the steps we’re taking to assist @FHAgov insured single-family borrowers during this unprecedented time in our country. https://t.co/9df14xMLru
1245721637439385602,2020-04-02 14:35:57,"If you have an @FHAgov insured single-family home mortgage, here are some key steps to take if you’re facing financial hardships because of the #coronavirus. https://t.co/ZnnNSNOkf4"
1245391950154530816,2020-04-01 16:45:53,"RT @WhiteHouse: ""America’s households are playing a vital role in our fight against the coronavirus,"" @SecretaryCarson writes. 

@HUDgov st…"
1245115090183041026,2020-03-31 22:25:45,"Great talking to you too, @SenRickScott. I look forward to continued communication to ensure we are doing all we can to help Floridians and keep families safe. We are all #InItTogether. https://t.co/bYoDu6s4PE"
1244990750217117697,2020-03-31 14:11:40,RT @SecWilkie: VA deploys Mobile Vet Center units to increase outreach during COVID-19 outbreak: https://t.co/67uF8gD1iS
1243679038792663046,2020-03-27 23:19:23,"During #Coronavirus outbreak, @THEPLAYERSChamp &amp; @TPCSawgrass came together @ Sulzbacher Center, an #EnVisionCenter, to serve meals to the community after Players Championship event was cut short. More @Jaxdotcom https://t.co/53CZmmpq3Z. #InThisTogether #NeighborsHelpingNeighbors https://t.co/DW1cKjNONV"
1243640952255918083,2020-03-27 20:48:03,My statement on the #CARESAct: https://t.co/MxLedLX56S
1243202580387332096,2020-03-26 15:46:07,"Preparation is key, particularly when caring for our nation’s most vulnerable citizens. Great joining @marthamaccallum on #TheStory to share the steps @realDonaldTrump and the Coronavirus Task Force are taking to protect our communities from #COVID-19. https://t.co/R2xivxae0f"
1242877312439386112,2020-03-25 18:13:37,RT @USICHgov: Download the USICH webinar RECORDING; the COVID-19 Planning and Response: Isolation and Quarantine: Lessons Learned from Seat…
1242836038390857728,2020-03-25 15:29:36,RT @HUDgov: ICYMI: HUD has created a #coronavirus resource page with information and best practices for our most vulnerable communities➡️ht…
1242826111014391813,2020-03-25 14:50:10,"Now more than ever, it is important to know the #COVID-19  information you are receiving is accurate. @fema has launched a Coronavirus Rumor Control page to dispel rumors and give you the facts. Stay informed, stay safe.

https://t.co/gOVEbjpLSB"
1242535540400033793,2020-03-24 19:35:32,"It’s inspiring to see @HopeCenterLex continue to run one of the state’s largest emergency homeless shelters amid the #coronavirus pandemic. During this trying time, #EnVisionCenters are serving those who lack the protection that shelter affords to others.  #InThisTogether https://t.co/oGOdyt48Au"
1242438376445349890,2020-03-24 13:09:26,https://t.co/vPCSxTHOl3
1242184034328944648,2020-03-23 20:18:47,"After schools closed due to #COVID19, the @hahenderson turned their #EnVisionCenter into a meal distribution point for youth who rely on school meals. #InThisTogether #NeighborsHelpingNeighbors https://t.co/k7PF4DYLE5"
1241547245918605326,2020-03-22 02:08:24,"Thank you, @JudgeJeanine for having me on this evening to talk about everything @realDonaldTrump's #coronavirus task force is doing to keep Americans safe. #Inthistogether https://t.co/xeItK4wWAE"
1241441318401867777,2020-03-21 19:07:29,My remarks at today’s Coronavirus Task Force Press Briefing: https://t.co/fB6bXfaHoh
1241114808407265281,2020-03-20 21:30:03,This afternoon I joined @realDonaldTrump and @Mike_Pence in praying with Pastors from around the country. America is and always will be one nation under God. During this time I’m reminded by Psalms 46:10 “Be still and know that I am God.” #TogetherApart
1241106852911423490,2020-03-20 20:58:27,The Housing Authority of Bowling Green is using its #EnVisionCenter to serve members of the community during the #Coronavirus outbreak. Their mobile grocery store is making deliveries so folks can practice safe social distancing. #NeighborsHelpingNeighbors #Inthistogether https://t.co/Y1TZz4Lk1s
1241105241250107392,2020-03-20 20:52:02,"As communities combat the #Coronavirus outbreak, @hudgov is highlighting stories of communities coming together to help their neighbors in need. #InThisTogether #NeighborsHelpingNeighbors"
1240772107711188994,2020-03-19 22:48:17,Glad to see Gov. Newsom taking action to protect our most vulnerable against #coronavirus by providing emergency housing options for the homeless. We must use all available resources to combat #COVID-19. HUD action plans &amp; toolkits➡️https://t.co/WvyHK6EtNA
1240361313748029440,2020-03-18 19:35:56,America is a resilient nation and we will get through this. Please encourage your friends and family to practice the health tips outlined by @CDC and follow @RealDonaldTrump guidelines: https://t.co/QztIgVW9HE
1240361312221364224,2020-03-18 19:35:56,We are also working with Congress to give HUD the authority to prevent evictions in Public Housing programs.
1240361311118245888,2020-03-18 19:35:56,HUD has been in contact with every Public Housing Agency in the country to ensure the millions of low-income Americans we serve continue to have a roof over their head.
1240361309700587522,2020-03-18 19:35:55,"Today, HUD is authorizing FHA to provide immediate relief for homeowners amid the national #coronavirus response by suspending all foreclosures and evictions for the next 60 days: https://t.co/5d8eGOolh5"
1240361308647817220,2020-03-18 19:35:55,No one should fear losing their home because of the #coronavirus.
1240287075439726600,2020-03-18 14:40:56,Read @VP Op-Ed on fighting the #coronavirus here: https://t.co/vwFYfziW8W
1240004677518966793,2020-03-17 19:58:47,"Thank you to our homeless service providers for caring for our nation’s most vulnerable citizens every day—especially during this outbreak. You all are experts in what you do and to help assist, HUD has posted a toolkit and additional resources. 

https://t.co/5ZTFwfx5Ag"
1239947468508446725,2020-03-17 16:11:28,"RT @HUDgov: We have a webpage dedicated to important #coronavirus information which includes toolkits, messages, and fact sheets our tenant…"
1239941393407238144,2020-03-17 15:47:19,The real power in overcoming adversity are the people and the American people working together is inspiring. Great joining @seanhannity to discuss the bold actions @realDonaldTrump and the Coronavirus Task Force are taking to ensure America’s safety. https://t.co/qzHpltvy0o
1239700633227268096,2020-03-16 23:50:38,"Today, @RealDonaldTrump released new guidelines for Americans to help slow the spread of #coronavirus. Please review them &amp; share with your friends and family. By following these guidelines, together, we can help save lives. ➡️https://t.co/QztIgVW9HE"
1239660882440921089,2020-03-16 21:12:40,RT @realDonaldTrump: https://t.co/tit0HdkE4e
1239660855706386432,2020-03-16 21:12:34,RT @realDonaldTrump: https://t.co/ZLmk41FA3H
1239241890735820803,2020-03-15 17:27:45,"We are a compassionate, innovative, and resilient nation that was built on these principles, and they will continue to guide us through these trying times."
1239241889972391939,2020-03-15 17:27:45,"Thank you @realdonaldtrump for designating this National Day of Prayer. Now more than ever, we must lean into our faith by loving our neighbors and caring for those around us."
1238522916402278402,2020-03-13 17:50:48,"The path to self-sufficiency begins with a safe place to sleep &amp; ultimately, an affordable place to call home. I’m pleased to announce @HUDgov will award over $118M to about 630 local homeless assistance programs on the front lines fighting homelessness. 
https://t.co/32TGSkKkGK"
1238505531611938816,2020-03-13 16:41:43,.@HUDgov's #FosterYouth to Independence initiative is already resulting in positive outcomes for some of our most vulnerable young people. https://t.co/rDqXT9cNEh
1238480555840278528,2020-03-13 15:02:29,"Solving the housing affordability challenge will require a team effort. This morning, I was delighted to speak to @NAAhq membership about the ways we can work together to help millions of Americans across the country secure quality, affordable housing. #AptAdvocate https://t.co/JnxWodNZXW"
1238479963453632514,2020-03-13 15:00:07,RT @NAAhq: HUD Secretary Dr. Ben Carson addressing the NAA Board of Directors at #AptAdvocate https://t.co/sim8Se6QKY
1237929101165461505,2020-03-12 02:31:11,https://t.co/Z5Nwv1Z32c
1235932693600309249,2020-03-06 14:18:11,"RT @EPAcommunities: As part of EPA's effort to help promote agriculture &amp; rural prosperity in America, the agency worked with residents in…"
1235692485327745024,2020-03-05 22:23:41,"HUD wants to lend a helping hand to young people by ensuring they have a roof over their head when leaving foster care, and that’s the purpose of the FYI initiative. Pleasure speaking with @AnnaEWiernicki about $1.1 million in FYI grants announced today: https://t.co/a1KHLjzzN3 https://t.co/UmVvEcFhGM"
1235620600556720128,2020-03-05 17:38:02,Great work being done with #OpportunityZones by Dr. Fleming and the team at @US_EDA. https://t.co/7DLW1Uv2XR
1235284648386842625,2020-03-04 19:23:05,RT @realDonaldTrump: Prayers for all of those affected by the devastating tornadoes in Tennessee. We will continue to monitor the developme…
1234983989892378624,2020-03-03 23:28:22,"@realDonaldTrump and @Mike_Pence are taking all steps to ensure the health and well-being of the American people, and we are well prepared. Thank you @cvpayne for having me on the show to provide an update from the White House Task Force. https://t.co/wf8LRkXmDA"
1234933077123706880,2020-03-03 20:06:04,RT @FHAgov: Today we eliminated a barrier to affordable and workforce rental housing by allowing newly constructed or substantially rehabil…
1234842163101519873,2020-03-03 14:04:48,"America is a great and resilient nation. When we work together, nothing can stop us. Great joining @seanhannity to discuss @realDonaldTrump incredible leadership ensuring every American is safe. https://t.co/aedgGu899p"
1234593173365809152,2020-03-02 21:35:24,"Prosperous counties lay the foundation for a prosperous nation. This morning I had the pleasure to speak to over 1,500 local officials and employees at @NACoTweets 2020 Legislative Conference. Thank you for the important work you do each and every day! #NACoLeg https://t.co/ERATm6ByhX"
1234531600429469702,2020-03-02 17:30:44,"Books opened more doors for me than I could have imagined. Education begins with reading. I’m proud HUD’s Book Rich Environment initiative has provided over 1 million books to kids in low income communities. 

Today, let’s put the power of reading to work. #ReadAcrossAmericaDay https://t.co/BZxFJqyFJd"
1233165638773956609,2020-02-27 23:02:54,"RT @MGIC: .@SecretaryCarson shares his vision for improving #housing in America, explores lessons he learned from his career in neurosurger…"
1233124388993687552,2020-02-27 20:18:59,"We believe that faith-based institutions can play a prominent role in helping to lift up our most vulnerable citizens. It was a pleasure to sit down and chat with @DavidBrodyCBN on the importance of this issue. 

https://t.co/FwOVVpGnQC"
1233077899063894016,2020-02-27 17:14:15,"Today, I’m pleased to announce @HUDgov is awarding $36 million to promote employment and self-sufficiency for public housing residents. Read more here: https://t.co/k687JacoUW https://t.co/YTpKeC5kUJ"
1232795023005143041,2020-02-26 22:30:12,Wishing a very happy birthday to @ScottTurner45 ! Thanks for all the great work you do to uplift communities across America.
1232713337483546625,2020-02-26 17:05:37,Pleased to work with @RepChipRoy toward results for America's most vulnerable. https://t.co/HukFkWkIKm
1232414789235826693,2020-02-25 21:19:17,"The Innovative @HousingShowcase is headed back to the National Mall, September 12-14, 2020. Interested in becoming an exhibitor for #IHS2020? Visit our website https://t.co/KZgZ0rQQp4 for more information. https://t.co/dicvITvXLR"
1232120689152397312,2020-02-25 01:50:38,"If we look at the facts and not focus on ideology, there is no question we can solve the homelessness problem.

Great joining @DavidAsmanfox on @FoxBusiness tonight to discuss how we can work together to come up with solutions to this crisis. https://t.co/RwNle2Uq1Z"
1230970023381999617,2020-02-21 21:38:18,"Thanks to @POTUS our nation is experiencing a historic economic boom &amp; the results of @WhiteHouseCEA's annual report confirms this. We must continue to remove regulatory barriers &amp; ensure hardworking Americans stay on the pathway of success. At HUD, this remains our mission. https://t.co/TWCvgeYNcZ"
1230260511717150725,2020-02-19 22:38:57,Great progress being made with #OpportunityZones. https://t.co/ewE7vdu05Q
1228733102257733632,2020-02-15 17:29:34,"RT @realDonaldTrump: Thank you Arnold, very nice."
1228431715581992961,2020-02-14 21:31:58,"Today, I announced $20 million in Jobs Plus grants to help public housing residents secure higher paying jobs, including more than $13 million in designated #OpportunityZones. Read the release here: https://t.co/BWYnN7FvqE https://t.co/y7dUQAbntq"
1228210181458153472,2020-02-14 06:51:40,"At @uniteddwelling , they’re making more affordable housing by converting garages into beautiful Accessory Dwelling Units. It’s this type of innovative thinking that will help to solve our affordable housing challenges. #DrivingAffordableHousing https://t.co/mBYPbE7cVk"
1228209178952396800,2020-02-14 06:47:41,Next stop on the bus: a visit to @uniteddwelling to see how they are using innovative solutions to create more affordable housing. #drivingaffordablehousing https://t.co/7UodMBK61G
1228199356622196737,2020-02-14 06:08:40,"I was pleased to speak at the “Unhoused” conference in LA. Everyone here cares deeply about housing the unhoused. And while there may be several schools of thought about the best way to make that happen, we all agree the best solutions minimize division &amp; maximize compassion. https://t.co/7GsHsIB4uv"
1228017794488254464,2020-02-13 18:07:12,RT @Elex_Michaelson: .@Schwarzenegger hosts @SecretaryCarson at a @USC @GovArnoldUSC conference on homelessness in California. https://t.co…
1228017703476060162,2020-02-13 18:06:50,"RT @USCPrice: The @GovArnoldUSC &amp; @USCPriceCSI summit on #homelessness, ""Unhoused: Addressing Homelessness in California,"" starts now. Watc…"
1228017253553061888,2020-02-13 18:05:03,"In Los Angeles, the #DrivingAffordableHousing Bus Tour is starting off with some ⭐️ power! I’m delighted to welcome @Schwarzenegger, @drdrew, and @kathrynbarger aboard the bus for a discussion about regulatory barriers to affordable housing. https://t.co/R2xHXlUzR6"
1227835220335845377,2020-02-13 06:01:43,"This new rule will facilitate greater cooperation between the Federal government and the faith community, so that together, we can work to serve those in need across America.#DrivingAffordableHousing"
1227834854332489729,2020-02-13 06:00:15,"Today I am pleased to announce that @HUDgov is issuing a new rule regarding religious freedom, which represents an opportunity for faith-based entities to receive equal consideration as applicants for HUD support. https://t.co/A5y96NfZHK"
1227833292818239489,2020-02-13 05:54:03,Today I had the opportunity to meet w/ faith leaders &amp; local gov’t officials about the affordable housing issues that are impacting our communities. I’m grateful for their insight—we can make a difference for our neighbors in need when we work together. #DrivingAffordableHousing https://t.co/rfScfNjBYh
1227830523810082816,2020-02-13 05:43:03,"The Grove Community Church in Riverside, CA worked with the city of Riverside to develop some of their unused land into housing for their neighbors in need. I was delighted to see these homes firsthand as part of our #DrivingAffordableHousing bus tour. https://t.co/DTYlS6Os1y"
1227829789689438210,2020-02-13 05:40:08,"Next stop on the #DrivingAfforableHousing Bus Tour: Riverside, CA ✅ I’m delighted to visit the Grove Community Church for a discussion about the role the faith community can play in answering the call for more affordable housing. https://t.co/xQBaHSLmv3"
1227716512561033217,2020-02-12 22:10:01,"During today’s  #DrivingAffordableHousing visit, we are talking with with community leaders in San Diego about how we can work together among federal, state, and local partners to eliminate regulatory barriers to affordable housing. https://t.co/UyiZt4dRRv"
1227685099572871168,2020-02-12 20:05:11,"During today’s #DrivingAffordableHousing Bus Tour,  we are joining Mayor @Kevin_Faulconer to visit an affordable housing complex and hear about how the city was able to streamline regulatory requirements for its timely construction. https://t.co/c2QIVcNyEF"
1227684699251757056,2020-02-12 20:03:36,Hello from San Diego! The #DrivingAffordable Housing 🚌 Tour is in CA this week for events with community leaders focused on the need to eliminate regulatory barriers to affordable housing. Mayor @Kevin_Faulconer is hopping on the bus for today’s events. https://t.co/yJRoZZxVcE
1227349356505894912,2020-02-11 21:51:04,No young person who grows up in foster care should experience homelessness once they set out on their own. I’m thrilled @HUDgov could play a role in making a difference in the lives of former foster youth. https://t.co/AIVYGLzFLZ
1227299538223935489,2020-02-11 18:33:06,"Tune in at 4pm ET to learn how HUD is working to put an end to foster youth homelessness through our new Foster Youth to Independence Initiative.
https://t.co/m9veuVNOWB https://t.co/o6YPf9JZW0"
1226995696466825216,2020-02-10 22:25:45,Today I joined our Nation’s governors at the @WhiteHouse to discuss how we can transform America’s communities through broadband connectivity and the advancement of #OpportunityZones. Thanks to this group for their collaboration and valuable input. https://t.co/iXKJCEERaR
1226938186519261187,2020-02-10 18:37:13,"Read the stories of more individuals impacted by @HUDgov programs here: https://t.co/sSZwpJyCdt

#HumansOfHUD"
1226938184485031937,2020-02-10 18:37:13,"Metropolitan Fair Housing Council of Oklahoma, a Fair Housing Initiative Program participant, assisted Raquel in her fight to stop the sexual harassment she was experiencing from her landlord. #HumansOfHUD https://t.co/LYn78ypvQq"
1226938173223292928,2020-02-10 18:37:10,"Kelly and Souny’s limited income and student loans made it impossible for them to get approved for an apartment. They found an apartment at @CVCLongBeach, a campus that provides permanent supportive housing and benefits from millions in HUD capital investment. #HumansOfHUD https://t.co/palDbvRnIB"
1226938158035677184,2020-02-10 18:37:06,"HUD’s Section 184 Loan Guarantee program made Sharon’s dream of homeownership a reality by ensuring a low down payment. Section 184 is a home mortgage program for American Indian, Alaskan Native, and Tribal families to spur investment in Native communities. #HumansOfHUD https://t.co/qSkD2g00au"
1226938144051867650,2020-02-10 18:37:03,"After a car accident spiraled into homelessness, @7HillsCenter helped Michelle with rental assistance for an apartment. The HOPE program helps people like Michelle secure a stable place to call home.  #HumansOfHUD https://t.co/5TnbksMVVq"
1226938130462396416,2020-02-10 18:37:00,After leaving the @USArmy Theo lived on the streets for 14 years. @HomelessOKC connected him with a Section 8 voucher for an apartment of his own after being homeless for so long. #HumansOfHUD https://t.co/qXUqcOUkvq
1226938116663107586,2020-02-10 18:36:57,"Growing up homeless, Jeanie dreamed of becoming a homeowner. Through the HOME program, Jeanie received down payment assistance and first-time homeownership classes. Her family is now enjoying their forever home. #HumansOfHUD https://t.co/NGE3ICmNMM"
1226938104503730177,2020-02-10 18:36:54,"Kristy was a public housing resident who wanted to end the cycle of dependency in her family. She enrolled herself in the Family Self-Sufficiency program. After working with a financial coach, Kristy is now a homeowner. #HumansOfHUD https://t.co/5q9X7zpXtx"
1226938093728665600,2020-02-10 18:36:51,"Charles never had a place of his own and lacked stability most of his life. After being approved for a Section 8 Housing Choice Voucher, he can now provide his two boys with the stable life he never had. #HumansOfHUD https://t.co/76PYLoubI5"
1226938080524951568,2020-02-10 18:36:48,"Every day, @HUDgov programs provide opportunities that uplift our fellow Americans and put them on the path to self-sufficiency. In our proposed FY21 budget, meet the people we serve and learn how we will continue making a difference. #HumansOfHUD https://t.co/bsyCh3k70Z"
1226900763273842689,2020-02-10 16:08:31,Friday I joined @realDonaldTrump to reinforce our commitment of revitalizing communities all across America.  #OpportunityZones have a powerful role to play in bringing new businesses and jobs to those who need it most.  #OpportunityNow https://t.co/WeLhUkb9LQ
1226168367075282945,2020-02-08 15:38:14,"“Homelessness isn’t a look or a stigma. Homelessness is a state of being."" 

Ben shares his journey in foster care, experiencing homelessness and how he overcame it all with help from a local HUD-funded homeless program. #HumansofHUD https://t.co/KmqV42MrvN"
1225804163050823682,2020-02-07 15:31:01,"Nearly 35 million people across the nation live in areas marked as an Opportunity Zone. Today, this Administration is reinforcing its commitment to revitalize neighborhoods by bringing economic freedom to the forgotten men and women of this country. #OpportunityNow https://t.co/Ot5MKrnqpY"
1225390485000409088,2020-02-06 12:07:12,"I am thankful to God we have a President that supports the faith based community, and I will continue to work with communities of faith across America to help our most vulnerable citizens. https://t.co/pLgaIrv11m"
1225390473164050432,2020-02-06 12:07:10,We will always be the land of the free so long as we continue to be one Nation under God. Yesterday I prayed with pastors from around the country.
1225080921994530816,2020-02-05 15:37:07,Last night's State of the Union was a celebration of the incredible accomplishments by this Administration. Thanks to @Varneyco for having me on to discuss. https://t.co/mMhe9t23Xt
1224897296929902592,2020-02-05 03:27:27,https://t.co/sqcFKe3zOl
1224850036082794502,2020-02-05 00:19:39,RT @realDonaldTrump: https://t.co/QeFYDg9jZ0
1224725017784737795,2020-02-04 16:02:53,"“I don’t know what the path to homeless looks like, but I didn’t think I was ever going to be on that path.” The Raysor family shares how they experienced homelessness. Fortunately, a HUD-supported program helped them get back on their feet. https://t.co/tvf7lAT2Le #HumansofHUD https://t.co/GK1ZlBseUK"
1223020098585333760,2020-01-30 23:08:08,Thank you @GovernorKayIvey for welcoming us to Alabama! #DrivingAffordableHousing https://t.co/Vyy4UTRBu2
