id,created_at,text
1223012415899607040,2020-01-30 22:37:37,Manufactured housing plays an increasingly vital role in meeting the nations’s affordable housing needs. As part of the #DrivingAffordableHousing tour I visited ⁦@claytonhomes⁩ in Russellville and saw their manufacturing process firsthand. https://t.co/f5irU0o2f4
1222992539885744147,2020-01-30 21:18:38,"While visiting @ClaytonHomes today in Russellville, Alabama, I announced several updates to manufactured housing construction and safety standards. Learn more➡️https://t.co/Vf4Boj8K10. https://t.co/AwpdlfQzQK"
1222919029867892736,2020-01-30 16:26:32,"Yesterday, I kicked off our #DrivingAffordableHousing Bus Tour in Louisville, Kentucky &amp; @MetroNashville, Tennessee to meet with state &amp; local leaders about affordable housing challenges. Here’s a recap: https://t.co/e98vFslTJ3"
1222894979346911233,2020-01-30 14:50:58,Hope you’ll tune in to hear all about the #DrivingAffordableHousing bus tour! https://t.co/GwvNth43Td
1222758107832602625,2020-01-30 05:47:05,"RT @GovBillLee: As our state continues to grow, we must ensure that all Tennesseans have safe &amp; affordable housing options. Thanks to @HUDg…"
1222757695096262657,2020-01-30 05:45:26,"At the Tennessee State Capitol today, ⁦@GovBillLee⁩ and I talked with State and local officials about affordable housing challenges in the community. Thank you for your important insight! #DrivingAffordableHousing https://t.co/unQVKZIBLn"
1222755707168096256,2020-01-30 05:37:32,"In Louisville today it was great to meet with some of the elderly residents who are enjoying home at St. Cecelia’s. When the public and private sectors come together to solve issues like affordable housing, lives can be changed. #DrivingAffordableHousing https://t.co/XfSaeUMWV2"
1222652787906969600,2020-01-29 22:48:35,In Louisville today I talked about how the ⁦@WhiteHouse⁩ Council on Eliminating Regulatory Barriers to Affordable Housing is working with State and local leaders to examine the regulations that drive up the cost of housing. #DrivingAffordableHousing https://t.co/WRPOmFX53g
1222633697528160262,2020-01-29 21:32:43,"Today I visited St. Cecelia Senior Housing, which is a @hudgov-supported provider of affordable housing in Louisville. It was interesting to hear about how the innovative restoration of this former school created more affordable housing in the community. #DrivingAffordableHousing https://t.co/xIZz9JE6Kf"
1222632378788720646,2020-01-29 21:27:29,The #DrivingAffordableHousing tour is on the road! Follow along as we engage communities across the country on a discussion about regulatory barriers to affordable housing. Learn more at https://t.co/JsZH8iQAzn . https://t.co/wL8t7Wrytq
1222565362157477889,2020-01-29 17:01:11,@RealDonaldTrump new trade agreement puts workers at the heart of America on the best path forward.
1222565359972208643,2020-01-29 17:01:10,"President Donald Trump continues to deliver tremendous results for the hardworking people of our country. When American manufacturers, farmers and agricultural workers are at their best, they can compete against anyone in the world."
1222298065492680706,2020-01-28 23:19:02,"RT @WhiteHouse: On Sunday, President @realDonaldTrump delivered to Prime Minister Netanyahu his new, comprehensive vision for peace between…"
1222231602257977345,2020-01-28 18:54:56,"Affordable housing is an important piece of economic growth, so I'm continuing the conversation with the #DrivingAffordableHousing Across America tour. (2/2) Learn more: https://t.co/Eyk0Hhawr3"
1222231535602098176,2020-01-28 18:54:40,Last week I talked with mayors gathered at the @WhiteHouse about the important work they’re doing to uplift American communities. (1/2) https://t.co/7uDeQODlfE
1222173372487958530,2020-01-28 15:03:33,"Great joining @foxandfriends with @LynnePattonHUD to discuss last night's homelessness count in NYC and HUD's increased support for local organizations across the country that provide services, a safe place to sleep, and food for our most vulnerable Americans. https://t.co/MOEw6piOh7"
1222027902079905792,2020-01-28 05:25:30,Serving your community is about being a part of something greater than yourself. Tonight I joined many volunteers on the streets of New York to take part in the annual homelessness HOPE count. https://t.co/wGbb4Y6OO3
1220773179322437632,2020-01-24 18:19:41,"Life is our most basic human right. As a surgeon, I operated on unborn babies at weeks old despite the fact that so many do not recognize their right to survive. 

Today, thousands #MarchForLife to remind us that it’s our duty to fight for those who can’t fight for themselves."
1220772924451446784,2020-01-24 18:18:40,"RT @realDonaldTrump: #MarchForLife 
https://t.co/5Yg09dOoJd"
1220732751499927558,2020-01-24 15:39:02,"I spoke with leading innovators, builders, &amp; architects at @NAHB. Quality and affordable homes should be a tangible reality for hardworking Americans. I was pleased to see so many creative solutions presented on the floor of #IBS2020. https://t.co/W2Gdq76hKO"
1220440147180900352,2020-01-23 20:16:20,"RT @NAHBhome: After addressing the NAHB Leadership Council, including an announcement on an #opportunityzones pilot for small businesses, @…"
1220137728202985475,2020-01-23 00:14:38,RT @US_EDA: EDA updates CEDS Content Guidelines to help American communities maximize their ability to attract investment to #OpportunityZo…
1219988916272496641,2020-01-22 14:23:18,"In case you missed it, @hudgov has extended the comment period on our Request for Information (RFI) related to #affordablehousing to January 31. We want to hear from you! Share your comments here: https://t.co/QDTUC5snVL"
1219300471669698561,2020-01-20 16:47:40,"Today, we honor the life and legacy of Dr. Martin Luther King, Jr. His dream of equality for all inspires us to carry the torch of liberty and love across each generation. #MLKDay https://t.co/0FOEiBxlkt"
1219070724222136320,2020-01-20 01:34:44,"The news out of Puerto Rico is disturbing, to say the least. In order for healing to begin, the corruption must end. This further underscores the importance of the reforms and financial controls we put in place to ensure these resources reach those who need them most."
1217550440251957249,2020-01-15 20:53:40,HUD's EnVision Centers provide promise and potential through services and resources. It was my pleasure to participate in the opening for the #EnVisionCenter at Taino Towers in NYC today. I’m excited to see what the future holds for this community. https://t.co/JINnl3D600
1217529180520316928,2020-01-15 19:29:11,Thank you @SenCoryGardner for your leadership on this issue. I’m glad we both agree that one homeless person is one too many and the CoC grant is an important tool for helping this country’s most vulnerable regain their independence. https://t.co/CuyWg0s438
1217510390122323974,2020-01-15 18:14:31,"RT @RepSteveStivers: Every child deserves a safe place to call home, and I’m grateful to have partners at the local, state and federal leve…"
1217510359277457409,2020-01-15 18:14:24,"RT @GovMikeDeWine: Today, @RepSteveStivers and I joined @HUDgov @SecretaryCarson to announce federal grants to help #EndHomelessness.  We v…"
1217495579611291649,2020-01-15 17:15:40,My statement on the U.S. - China Trade Deal: https://t.co/17hAYIcn1z
1217173461673697280,2020-01-14 19:55:41,"Today, @GovMikeDewine, @RepSteveStivers and I toured @Huck_House and Marsh Brook Place to see the important work our Continuum of Care grantees are planning for homeless youth.  

When federal, state, and local leaders work together, we will succeed in ending homelessness. https://t.co/uLUP2ScKaX"
1217129908960403456,2020-01-14 17:02:38,"@HUDGOV we are committed to empowering local communities with the tools they need to help individuals and families experiencing homelessness. 

Today, HUD awarded more than $2 billion to support thousands of local homeless assistance programs through the Continuum of Care program https://t.co/ZrOoDimGsO"
1216823739813449728,2020-01-13 20:46:01,"UPDATE: @HUDgov is extending the public comment
period on the White House Council on Eliminating Regulatory Barriers to Affordable Housing;
Request for Information. Submit your comments here: https://t.co/QDTUC5snVL"
1216772553802383360,2020-01-13 17:22:38,"@HUDgov we are proud to support the Foster Youth to Independence program, which helps young adults who are at risk of experiencing homelessness find a stable home so they can build the foundation to succeed in life. 

https://t.co/BK3fTxXqED"
1215377253166714881,2020-01-09 20:58:12,RT @FirstLadyTeresa: It was such a pleasure to have @SecretaryCarson join @GovParsonMO and I for this years Governor’s Prayer Breakfast! We…
1215333454835015680,2020-01-09 18:04:10,"What a wonderful morning with @GovParsonMO and @FirstLadyTeresa at the Missouri Governor’s Prayer Breakfast. The great people of Missouri have a firm grasp on the importance of unity. If we work together, there is nothing our nation can’t achieve. https://t.co/IIMWDKPadU"
1215103937705119745,2020-01-09 02:52:08,The homelessness crisis in California has been an entrenched problem for a longtime. Per the request of @MayorOfLA &amp; @kathrynbarger we look forward to a new partnership that will benefit our fellow citizens.
1215101268403855360,2020-01-09 02:41:32,We must alleviate the suffering of our most vulnerable Californians in the most compassionate way possible. It is with that goal in mind that I have entered into discussions with @MayorOfLA @kathrynbarger in an effort to ensure those vulnerable receive the compassion they deserve
1214574233633853443,2020-01-07 15:47:17,RT @USDOT: USDOT today announced a new interactive map highlighting federal investment in major #infrastructure projects located in and aro…
1213166356197236738,2020-01-03 18:32:53,Helping people find jobs that will put them on the path to self-sufficiency is at the core of @HUDgov mission. HUD is committed to working with our local partners to connect families with the opportunities and support they need to succeed at every level. https://t.co/5fEa3nd1DD
1212894727584067585,2020-01-03 00:33:32,"CNN spewing out more FAKE NEWS on homelessness. In CA, homelessness increased by 21,306 people, that’s more than the entire national increase. No matter how hard @CNN tries to deny it, California is driving this crisis. 

As @realdonaldtrump said, we are just a phone call away."
1212487390708809730,2020-01-01 21:34:55,"Wishing everyone a happy, healthy, and prosperous 2020. Happy New Year! https://t.co/cEMi55RDki"
