id,created_at,text
1222013127648112640,2020-01-28 04:26:48,One initiative will allow individuals to exchange their PFD for a land certificate to leverage the purchase of land. These certificates will be issued at twice the value of the historic statutory calculation of the PFD. #akleg #akgov
1222013002200711168,2020-01-28 04:26:18,We are going to put in place a number of initiatives that will enable Alaskans to own a piece of the Last Frontier; easier and cheaper than ever before. #akleg #akgov
1222012763267981313,2020-01-28 04:25:21,"One resource Alaska has in abundance is its land. Unfortunately, only 1% of that land is held privately by individuals. No other state has less land in private hands than Alaska. #akleg #akgov"
1222012605725675520,2020-01-28 04:24:43,"Our compassion must also extend to our homeless population. Too many Alaskans often suffering from addiction and mental health issues find themselves on the streets. Last year, I included over $43 million in funding for programs to address homelessness. #akleg #akgov"
1222012538239348737,2020-01-28 04:24:27,"Recidivism must be addressed. It’s a fact that over 95% of offenders may one day be our neighbors again. We must work together to reduce and prevent future crime. For those offenders who truly want a second chance, it’s imperative upon us to provide it. #akleg #akgov"
1222012162140303360,2020-01-28 04:22:57,My administration will continue to protect Alaska’s most vulnerable by introducing legislation to combat sex trafficking. Individuals engaged in this awful practice will face longer stays in prison. #akleg #akgov
1222011949564620800,2020-01-28 04:22:07,"On Alaska Hire, I’m proposing an incentive for contractors that do business with the state to hire as many Alaskans as possible. #akleg #akgov"
1222011810263388160,2020-01-28 04:21:34,I will also be proposing legislation creating an Alaska Inspector General to promote accountability and efficiency by investigating waste and fraud. #akleg #akgov
1222011656349220864,2020-01-28 04:20:57,I’ll soon be introducing legislation to create a statewide lottery. Forty-five states have lotteries in place. #akleg #akgov
1222011419991756801,2020-01-28 04:20:01,"We must include the people in these decisions.  They must be allowed to vote on a spending cap, any proposed PFD changes, and any new broad-based taxes. #akleg #akgov"
1222011347098955777,2020-01-28 04:19:43,"Solutions need to be taken up this year. That’s why this year I introduced a flat budget, which should allow us to focus on a sustainable long term plan, including controlling our spending and deciding the future of the permanent fund and the PFD. #akleg #akgov"
1222011129603321856,2020-01-28 04:18:51,Last year’s budget was not crafted with the intent to hurt Alaskans. But pulling back the reins on spending certainly caused many Alaskans discomfort -- I recognize that. I didn’t run for governor to hurt the state that I love and the people I care about.  #akleg #akgov
1222010788799365120,2020-01-28 04:17:30,"As you know, last year’s budget contained significant reductions. This came in response to the plummeting price of oil, which lost one-third of its value upon taking office. Together, we took a solid first step by reducing spending. #akleg #akgov"
1222010269078962176,2020-01-28 04:15:26,"Over this last year, it has become clear that @realDonaldTrump has done more for Alaska than any other president in recent history. #akleg #akgov"
1222010068217913344,2020-01-28 04:14:38,"Outsiders love to present a false choice between resource development and the environment. From their perspective, it’s a win-lose, but from our perspective, it should be a win-win. No one cares more about protecting Alaska than Alaskans.  #akgov #akleg"
1222009862281842693,2020-01-28 04:13:49,One-seventh of our nation’s timber is located in Alaska. My administration is advancing a proposal to finally allow our timber industry to compete globally. #akgov #akleg
1222009861228990464,2020-01-28 04:13:49,"While I believe oil will continue to play a key role in our future, we must look beyond this industry to diversify our economy and grow our great state. #akleg #akgov"
1222009274202652672,2020-01-28 04:11:29,We now have the lowest unemployment rate in the state’s history and wages are at a 10-year high. Our state’s GDP has grown every quarter since I took office. #akgov #akleg
1222009226614063105,2020-01-28 04:11:18,"Second, we worked together to grow Alaska’s economy, and the longest recession in Alaska’s history is now over. #akleg #akgov"
1222009132904878080,2020-01-28 04:10:55,"We eliminated dangerous policies in Alaska’s prisons, increased funding for prosecutors and public defenders, and are addressing a decades-old backlog of untested sexual assault kits. #akleg #akgov"
1222009132011573248,2020-01-28 04:10:55,"First, we addressed the crime wave that held our communities hostage by enacting comprehensive criminal justice reform. #akleg #akgov"
1222008903317127170,2020-01-28 04:10:01,"As we begin 2020, I’m proud to report that the state of our state is STRONG. #akgov #akleg"
1222008612400222209,2020-01-28 04:08:51,"Last summer, we suffered through one of the worst fire seasons in the state’s history, and we’re thankful for the brave firefighters who protected life and property. Together, they fought 742 fires that burned 2.6 million acres of land -- all without a single loss of life. #akleg"
1222008134631223296,2020-01-28 04:06:57,"Tonight, you’ll hear about initiatives important to all of us, such as putting Alaska’s lands in Alaskan’s hands, preparing kids to succeed, innovative new approaches to revenue, and addressing our fiscal future.  #akgov #akleg"
1222008045741334529,2020-01-28 04:06:36,I’m here tonight to talk about my vision for our great state and to share with Alaskans the progress we’ve made together over the past year. #akleg #akgov
1221898684817739776,2020-01-27 20:52:02,"Tune in tonight at 7pm to watch my 2020 State of the State address. 

Stream it at:  https://t.co/LR87Pu171y
Or watch on TV on 360 North. #akgov #akleg"
1221133588353015809,2020-01-25 18:11:49,"Alaska's unemployment rate remains at a record low for December 2019. I will keep fighting to remove barriers to employment and doing business in our state. 

Read more in the Mat-Su Valley Frontiersman ➡ https://t.co/ytmQNN2Q9W"
1220876303303241728,2020-01-25 01:09:28,I'll be joining @TuckerCarlson today at 4:30 pm. Be sure to tune into to @FoxNews 📺
1220511113642561536,2020-01-24 00:58:20,"The largest and most powerful land-based oil and gas drilling rig on the continent will now call Alaska home. Congratulations to ConocoPhillips and Doyon Drilling on this major accomplishment.

https://t.co/5YStrZOimJ https://t.co/0HcXmWpakC"
1220407509371895808,2020-01-23 18:06:38,"""Gov. Mike Dunleavy brought forward bills to the Senate on Wednesday to keep his promise of ""making Alaska open for business.""

The bills would remove roadblocks and promote resource development.""

Read more from @ktva ➡ https://t.co/7nPtHIop9C"
1220158438442881024,2020-01-23 01:36:55,"Today I announced four pieces of legislation that will help continue to open Alaska for business. #akleg 

Read more: https://t.co/L2sqL4Ky0z https://t.co/5lKfr6I0y1"
1220141352152784897,2020-01-23 00:29:02,"Today is a somber reminder of the countless lives that have been denied as a result of abortion. As Governor, I remain committed to upholding the principles our nation was founded on by protecting life, liberty, &amp; the pursuit of happiness of all Alaskans. https://t.co/oIF92BVodr"
1220039059994578944,2020-01-22 17:42:33,"Mariculture a growing opportunity for Alaska industry

""Gov. Dunleavy shares the vision of what this new industry could mean to the state: jobs and opportunities."" 

Read more from Julie Decker in the @adndotcom: https://t.co/zSgLJ4I6Ig"
1219750049757851648,2020-01-21 22:34:08,Today marks the first day of the 2020 legislative session here in Juneau. I look forward to continued discussions with the Legislature and the people of Alaska through the coming months as we work together to create a bright future for all of #Alaska. #akleg
1219315769105776642,2020-01-20 17:48:27,"Today, as we celebrate Dr. Martin Luther King’s birthday, we remember his legacy as a selfless activist who called upon leaders to ensure equal justice under the law, to uphold our nation’s founding principles of life, liberty, and the pursuit of happiness for all people. https://t.co/89v3i5eDxO"
1218346968407166976,2020-01-18 01:38:47,"Earlier this week I announced the Alaska Reads Act, legislation to create a comprehensive statewide K-3 reading program designed to improve reading outcomes. #akreads 

Learn more ➡ https://t.co/5TScUNGrvV https://t.co/qhiWKNSxBx"
1218286243991060480,2020-01-17 21:37:29,My administration continues to work with @realDonaldTrump’s administration to open Alaska for business. The federal government will streamline the permit process for AK projects while continuing to protect the environment. https://t.co/nd3fE5tfvh
1218248965692379136,2020-01-17 19:09:22,Watch live as Governor Dunleavy joins leadership from the U.S. Census Bureau to kick off the 2020 Census. https://t.co/c85IwFmMC0
1217939015631925248,2020-01-16 22:37:44,"Read more from the @newsminer  about the Alaska Reads Act https://t.co/LPIAavdEeH

#akreads #akleg #akgov https://t.co/PZ8jiGQ0VP"
1217909901298503681,2020-01-16 20:42:02,RT @Rep_LancePruitt: #akreads That is the goal with this piece of legislation I am excited for us to start working on next week in Juneau.…
1217890510011895808,2020-01-16 19:24:59,"The senate has passed @realDonaldTrump’s historic #USMCA trade agreement. This is a major win for workers, Alaskans, and all Americans."
1217641563699859464,2020-01-16 02:55:46,More information on the Alaska Reads Act ➡ https://t.co/5TScUNGrvV
1217641394153517058,2020-01-16 02:55:05,"AK is facing a reading crisis &amp; we must insist on better educational outcomes for our children. Today marks a concerted effort, with bipartisan support, to provide our children with the best possible education by offering every opportunity to succeed in reading.
#akreads https://t.co/vhUdFzOQit"
1217563357269512192,2020-01-15 21:45:00,"In 2019, only 37% of Alaska’s grade three students were proficient in reading. Alaska is facing a reading crisis. Today at 2:30 I will be announcing legislation that is aimed at fixing this. #akreads #akleg #akgov"
1217528887996862464,2020-01-15 19:28:02,"Congratulations to @realDonaldTrump on signing the historic Phase One Trade Agreement with China. Leveling the trade playing field is of national importance, it will boost our economy and help grow #Alaska businesses."
1217216720189833216,2020-01-14 22:47:35,"Today I traveled to Point Hope to visit with leaders from across the North Slope gathered for a @VOICE_Arctic meeting where we discussed Alaska’s future, and the important role of Alaska’s Arctic region to the state and our country as a whole. https://t.co/zoGr5lJoKD"
1216157645737873409,2020-01-12 00:39:12,Today I spoke with members of the Alaska Chapter of AMAC about the the Alaska we all want to see in the future and how we can work together to get there. https://t.co/vTcxhCBfJC
1215696694488100865,2020-01-10 18:07:33,"Earlier this week I spent time in the Mat-Su visiting local businesses and touring the Mat-Su Career and Tech High School. I was happy to speak to community members about the #Alaska we all want to see in the future.

📷: https://t.co/oIgiVJDqBX https://t.co/qXn5KgpHcZ"
1215439807221911553,2020-01-10 01:06:46,"Today I invited law enforcement officers to join me as I signed a proclamation declaring today, January 9th, Law Enforcement Appreciation Day in Alaska. I encourage all Alaskans to recognize and express appreciation for our law enforcement personnel. https://t.co/LQFv68XJUs https://t.co/1UFtjmYSbl"
1215397355484106752,2020-01-09 22:18:05,"Thank you, @realDonaldTrump, for working to modernize the 40-year-old NEPA regulations. Your efforts will lift bureaucracy on projects of all types, allowing construction projects to move forward, and create a more prosperous Alaska for all. #NEPAModernization https://t.co/kIEbR0ND1A"
1215056847033360385,2020-01-08 23:45:01,Outsiders will never stop trying to shut Alaska down. I’ll never stop fighting them. https://t.co/qoByL9N3f1
1214974181210591234,2020-01-08 18:16:32,"🎥 Video News Update: Learn more about the Division of Oil and Gas and its new director, Tom Stokes. #akgov #akleg https://t.co/vvwAEjvH5i"
1214712090197258240,2020-01-08 00:55:05,"Nobody does resource development and extraction safer than #Alaska. My goal is to keep jobs here in Alaska, where we can ensure environmental protections while providing jobs and wealth for Alaskans. https://t.co/wpBsjYhdwC"
1214245543141990401,2020-01-06 18:01:11,"""Our present budget woes are not simply a math exercise. The long-term solutions will come from people like you — Alaskans with ingenious ideas and a commitment to delivering better government services with fewer resources.""

Read more in the @newsminer ➡ https://t.co/4kFCxCuuNc"
1213236403179360256,2020-01-03 23:11:14,"""After only one year, we’re pleased to share that tremendous progress has been made addressing some of Alaska’s most pressing issues."" - Commissioners Anderson, Dahlstrom, Feige, Ledbetter, Price, and Tshibaka 

Read more in the @pclarion ➡ https://t.co/FbHi4QPG4o"
1213227395181760512,2020-01-03 22:35:26,"Congratulations to Alaskan Joshua Kindred. Today @realDonaldTrump forwarded his name to the US Senate for confirmation to the United States District Court for #Alaska. His demeanor, fairness and knowledge of our state make him perfectly suited for the court."
1213184095733157888,2020-01-03 19:43:22,"Happy 61st birthday to the greatest state, in the greatest country on the face of the Earth, #Alaska. https://t.co/oDrqAAmIZ5"
1212797148820992001,2020-01-02 18:05:47,"Outside environmentalists love to use the courts to stop Alaskans from managing our resources, but the latest attempt by the Center for Biological Diversity couldn’t even convince the 9th Circuit Court of Appeals. https://t.co/KQ4Sb6F1E5"
1212546473532874754,2020-01-02 01:29:41,"I ran for Governor to help put Alaska on the right track for a better tomorrow. In 2019, I am happy to report we are made tremendous headway.

2019 Accomplishments ➡ https://t.co/9InKL1uW8Y"
1212479357576515585,2020-01-01 21:03:00,We have to work together to create the best possible future for Alaskans. https://t.co/cZLHJdNQBO
1212297953253003266,2020-01-01 09:02:10,Happy New Year Alaska!
1212177367566700544,2020-01-01 01:03:00,"I am optimistic about the future of Alaska. 

Watch my entire address to the @AnchChamber at: https://t.co/XIcfvNLAfa https://t.co/hzh5RBx33h"
