id,created_at,text
1239571099630702594,2020-03-16 15:15:54,"2/3 We’re glad to finally have our folks back home in Wisconsin. These individuals have gone through a harrowing experience full of uncertainty and fear over the past several weeks. But as I’ve said repeatedly, here in Wisconsin, we take care of one another."
1239571098213052419,2020-03-16 15:15:54,"1/3 Early this morning, the @WI_Guard helped 29 Wisconsinites who were aboard the Grand Princess cruise ship arrive home safely. As of today, none of the 29 have tested positive for COVID-19 and are not showing symptoms."
1239553289999417346,2020-03-16 14:05:08,.@WisconsinDPI is working diligently to ensure our kids have nutritious meals while schools are closed due to COVID-19 by applying for a waiver that allows them to send meals home to kids. More at: https://t.co/KIEJZP8p9S
1239546208563200002,2020-03-16 13:37:00,RT @WisconsinDOT: Continued concerns over #COVID19 are keeping people home. DMV online services allow you to take care of all vehicle trans…
1239349442173493254,2020-03-16 00:35:07,You can help them do their jobs by following these tips: https://t.co/uN6igmYimr
1239349440542056449,2020-03-16 00:35:07,"Thank you to all the healthcare workers, direct care workers, public employees, and those on the frontlines for rising to the need of our communities during COVID-19. Your service to our state and communities is greatly appreciated."
1239342495298772993,2020-03-16 00:07:31,Yesterday I sent a letter to @SenatorBaldwin and @SenRonJohnson asking for them to support bipartisan legislation to address the COVID-19 public health emergency. https://t.co/bkQKsUz17b
1239329435834183680,2020-03-15 23:15:37,"RT @WIWorkforce: Facing a business slowdown due to #COVID19? Work share can help businesses keep skilled workers, who otherwise would have…"
1239310396344938496,2020-03-15 21:59:58,"RT @DHSWI: If all the talk about #COVID19 is making you feel overwhelmed or frightened, support is available. Call @distressline at 1-800-9…"
1239308370609344516,2020-03-15 21:51:55,"RT @DHSWI: Get the latest information on #COVID19 in Wisconsin, along with guidance on gatherings and travel, and the best way to keep you…"
1239275649740591104,2020-03-15 19:41:54,"Closing schools is not a decision I take lightly, but ensuring the health and safety of our kids, educators, and school staff is of utmost importance. If you have questions about the school closures, please see the FAQ below ⬇️ https://t.co/1cek54kAQR"
1239219883163947009,2020-03-15 16:00:18,"RT @DHSWI: Did you watch? @GovEvers and #DHSWI Secretary-designee Andrea Palm appeared on @WKOW and #CapitalCitySunday this morning, talkin…"
1239209328143486976,2020-03-15 15:18:21,"On Thursday, I declared a public health emergency in Wisconsin relating to COVID-19 to make sure Wisconsin is proactive in slowing and preventing the spread of the virus. 

Watch here: https://t.co/Qm6Fp979fd."
1238976048991285253,2020-03-14 23:51:23,"RT @WisconsinDOT: At the direction of Governor Evers, the Wisconsin Department of Transportation may issue permits for the transportation o…"
1238958201606934529,2020-03-14 22:40:28,"Being mindful about using best practices, like washing your hands frequently and avoiding direct contact with others will help protect not only you, but your friends, family, and neighbors from the spread of COVID-19. #COVID19 https://t.co/eK9FDH2ThT"
1238892146280759296,2020-03-14 18:17:59,"RT @DHSWI: We know the #COVID19 situation is evolving quickly. Check out our guidance on gatherings and advice for social distancing, then…"
1238834522717913088,2020-03-14 14:29:01,Our state agencies are working diligently to ensure Wisconsinites are safe. @PSCWisconsin issued directives that no utility service is to be disconnected for nonpayment during the COVID-19 public health emergency. https://t.co/ylD2lL1PQB
1238594617643327492,2020-03-13 22:35:43,Here's a copy of today's order: https://t.co/KDhZzqDQET
1238577767400255488,2020-03-13 21:28:46,Please continue to find the most accurate and up-to-date information on the status of COVID-19 in Wisconsin at https://t.co/PqpXVWR3UR
1238577766129434630,2020-03-13 21:28:45,"The mandated closure will begin on Wednesday, March 18th, to give school districts ample time to make plans for kids, families, educators, and staff, but school districts may choose to close earlier than Wednesday."
1238577764783001601,2020-03-13 21:28:45,Kids and families across Wisconsin often depend on our schools to access food and care. We are going to continue working to do everything we can to ensure kids and families have the resources and support they need while schools are closed.
1238577763973505024,2020-03-13 21:28:45,"Closing our schools is not a decision I made lightly, but keeping our kids, our educators, our families, and our communities safe is a top priority as we continue to work to respond to and prevent further spread of COVID-19 in Wisconsin."
1238577763050754055,2020-03-13 21:28:45,"Today, I directed @DHSWI to issue an agency order mandating the closure of all K-12 Wisconsin schools, public and private, as part of our efforts to respond to and contain the spread of COVID-19 in Wisconsin."
1238545667124953089,2020-03-13 19:21:12,"2/2 We can all do our part to help prevent the spread of the illness to others. With the good work of folks at @DHSWI and your mindfulness, we can help reduce and slow the spread of COVID-19. We are all in this together."
1238545664440754181,2020-03-13 19:21:12,"1/2 On March 12th, I declared a public health emergency to address the outbreak of COVID-19. This allows us to access state resources to deal with this pandemic head on, care for those who need it, and limit the spread of this virus. https://t.co/zxOrSErBSc"
1238515872467214338,2020-03-13 17:22:49,"Each one of us has a role to play in reducing and slowing the spread of #COVID19. Do your part. Be mindful, be prepared, and stay informed by following @DHSWI. https://t.co/1HR3ZIiBs2"
1238247947260891139,2020-03-12 23:38:10,"Things you can do to help prevent illness and avoid being exposed to #COVID19:

➡️ Wash your hands
➡️ Avoid touching your face
➡️ Cover your mouth when you cough or sneeze
➡️ Stay home if you’re sick
➡️ Stay informed by visiting https://t.co/PqpXVWR3UR"
1238235411635417092,2020-03-12 22:48:22,"While the Wisconsin State Capitol remains open for public business, effective tomorrow, March 13, @WisconsinDOA is suspending public tours of the Wisconsin State Capitol for the time being. Any groups who are currently scheduled for tours over the next few weeks will be contacted"
1238150450727325698,2020-03-12 17:10:45,6/6 This is a continually evolving situation. We are advising folks to continue to follow best practices and guidelines from the @CDCgov and @DHSWI. More information is available here: https://t.co/PqpXVWR3UR.
1238150449825484803,2020-03-12 17:10:45,"5/ The @DHSWI has been on the frontline in responding quickly and addressing concerns as they arise, and in preparing for the potential of a pandemic. I want to thank Secretary-designee Andrea Palm for her leadership and diligence."
1238150448755990528,2020-03-12 17:10:45,4/ Our state agencies are doing good work to ensure that Wisconsin is prepared to prevent the spread of coronavirus. Last week the @wisconsinoci requested insurers to waive co-pays for COVID-19 testing.
1238150447917084673,2020-03-12 17:10:45,"3/ We also worked with our federal partners to receive $10.2 million in federal funding, and we will continue to work together to ensure that Wisconsin is capitalizing on the federal assistance available to us."
1238150447157911553,2020-03-12 17:10:44,2/ We have been working diligently to get the most accurate and current information as this situation has developed. From calls with Vice President Pence as he updated the nation's governors on the federal response to our briefing with state officials and legislators last week.
1238150446063247362,2020-03-12 17:10:44,1/ This morning I declared a public health emergency in the state of Wisconsin related to COVID-19. This will allow @DHSWI and other state agencies to utilize every tool available to them to prevent the spread of coronavirus and protect public health. https://t.co/EOOEqxAKpI
1237908377461821440,2020-03-12 01:08:51,RT @DHSWI: An additional 3 cases of #COVID19 just confirmed in our state. We're working w/@fdlcounty &amp; @WaukeshaCoHHS to determine who may…
1237791299295686656,2020-03-11 17:23:37,RT @WisDOTnorthwest: HAPPENING NOW: WisDOT Secretary-designee Craig Thompson is meeting with media to discuss the upcoming reconstruction o…
1237777180232482818,2020-03-11 16:27:31,RT @DHSWI: Happening now. What do you want to know about #COVID-19? We're answering your questions in a #Facebook live. Log on: https://t.c…
1237753047914360834,2020-03-11 14:51:37,"RT @DHSWI: More labs across the country are able to test for #COVID-19. And now, Wisconsin clinicians can order tests without public health…"
1237486013565501440,2020-03-10 21:10:31,"From prevention efforts to investments in rebuilding and recovery efforts, the state needs to lead on this issue. I hope the Legislature will take swift action on these bills. 

Learn more here: https://t.co/ezQjt4en6Y"
1237486012709974016,2020-03-10 21:10:31,Last year I met with folks in Trempealeau County as they were recovering from devastating floods and I listened to their needs as a community. Today I announced bipartisan legislation inspired by those conversations and took it back to the community to get folks' thoughts.
1237477732008767489,2020-03-10 20:37:37,"We must do more to address the health disparities that continue to plague communities of color in Wisconsin, especially in infant and maternal health. Thank you @StateSenLaTonya for highlighting this important issue! 

https://t.co/pFjWTwCrM7"
1237437252327874560,2020-03-10 17:56:46,"RT @DHSWI: We're planning a #FacebookLive to answer your #COVID-19 questions. Send them to us by replying to this tweet, or posting on our…"
1237130911549927424,2020-03-09 21:39:28,Kathy and I joined @DHSWI Secretary-designee Andrea Palm today in La Crosse for a roundtable on caregiving to hear from local professionals and family members who are caring for loved ones about the unique challenges they face caring for folks across our state every day. https://t.co/KYisW4yL3v
1237120793554948097,2020-03-09 20:59:16,"RT @SenatorBaldwin: As businesses work to develop plans to respond to #coronavirus, we must ensure they are taking the best interests of wo…"
1237096802563895297,2020-03-09 19:23:56,"Today Kathy and I visited the Wisconsin Alzheimer's Disease Research Center. With more than 100,000 Wisconsinites living with Alzheimer's or dementia, we must continue to support the good work of folks like the @WisconsinADRC and @WAI_Alzheimers. https://t.co/yJyfabQ0sd"
1237020522791272448,2020-03-09 14:20:50,"This weekend Kathy and I celebrated the first maple tree tapping of the season at Inthewoods Sugar Bush! Maple syrup producers are an integral part of our state's economy and culture, which is why I declared March 15 through April 15 as Maple Syrup Month in Wisconsin. https://t.co/C3s2r5XT4c"
1236707115412131840,2020-03-08 17:35:27,RT @WITreasurer: Happy International Women’s Day!  This year’s International Women’s Day theme is focused on fighting for gender equality i…
1236675914857172993,2020-03-08 15:31:29,"We cannot accept this as the future for Wisconsin dairy farmers. This is America's Dairyland and in our state you never have to go it alone. 
We are in this fight together. 

https://t.co/bq99qgZn4e"
1236482397975216128,2020-03-08 02:42:31,#OnWisconsin 🚨 https://t.co/SWxsFk2UdW
1236326907064520704,2020-03-07 16:24:39,"ICYMI: This week @WisconsinDOT and I announced a $75 million investment in Wisconsin roads. Marathon County will be using the funds for a new roundabout, improving safety, and addressing traffic congestion. More here: https://t.co/rG0y1EnbBE"
1236048102823530496,2020-03-06 21:56:47,"It’s National Employee Appreciation Day! I want to thank all the state employees who spend day in and day out serving the people of Wisconsin from health services to corrections, to transportation. Thank you! #EmployeeAppreciationDay https://t.co/mLAOrXVh9P"
1236038320725143553,2020-03-06 21:17:54,RT @Brewers: The best fans in baseball... that’s you. 😏 #ThisIsMyCrew https://t.co/ufs7vmBE7n
1236014867338928128,2020-03-06 19:44:43,We cannot delay in providing critical support to Wisconsin farmers. They've had our back for generations and it's time to have theirs. I look forward to the Senate taking up the bills on agriculture this month. #FarmFriday https://t.co/sAWLLHlYlA
1235979855331840006,2020-03-06 17:25:35,"Teachers play an enormous role in our kids' lives. They help kids navigate their most formative years, often at the expense of their own time, money, and emotional bandwidth. To quote @KristinKarnitz, ""Teachers are not just educators."" https://t.co/Mwa4tvbxoc"
1235941484203069440,2020-03-06 14:53:07,"RT @JodiRep: The best way to prevent exposure to COIVD-19, or any virus, is by maintaining good hygiene habits. This includes frequent hand…"
1235731520415059969,2020-03-06 00:58:47,"Today, I signed AB 470 in Wausau creating 12 new branches of the Wisconsin Circuit Court. The circuit court hasn’t seen an increase in branches since 2010 and this bill takes another step in ensuring that our justice system is best serving our communities. https://t.co/rY8phbYQnE"
1235689215540768770,2020-03-05 22:10:41,"Today is the Wisconsin National Guard’s birthday! And what better way to celebrate than with a swearing in ceremony of the new adjutant general?

It was an honor to preside over Major General Knapp's promotion today and I look forward to his leadership at this critical time. https://t.co/Jbf4PfRPab"
1235589628796768256,2020-03-05 15:34:58,RT @SenShilling: It’s great to see Governor Evers is ensuring these grants are being invested right here in western Wisconsin where back-to…
1235320849357471744,2020-03-04 21:46:56,"Good luck to all the Wisconsin producers competing in Madison this week at the World Championship @cheesecontest! Folks come from all over the world to compete, so let’s show them what America’s Dairyland has to offer and bring home some wins. #CheeseContest https://t.co/FxuKugjvSM"
1235286850115428354,2020-03-04 19:31:50,"This $75 million investment is going directly to our local communities' most high need projects, improving safety and traffic congestion. Learn more about the program here: https://t.co/flto0Zz4Wp"
1235286848806752257,2020-03-04 19:31:49,"No matter where you go in Wisconsin, folks can all agree that we need to fix our crumbling roads. Today I joined @WisconsinDOT Secretary-designee Thompson in announcing funding for 152 local road projects across the state in nearly all of Wisconsin's 72 counties. https://t.co/GDUHzqfPEJ"
1235227601528029185,2020-03-04 15:36:24,"RT @SenSchachtner: ""I know what it feels like to see your cows auctioned off &amp; I would not wish it on anybody... My colleagues from both si…"
1235213454929252354,2020-03-04 14:40:11,Congratulations to @WDNR Secretary Preston Cole for his induction to the Milwaukee Business Journal’s 40 Under 40 Hall of Fame! Thank you for your hard work at the DNR and all you do to serve the people of Wisconsin. https://t.co/fPXqJ2RDDX
1234913247578525706,2020-03-03 18:47:16,"The People's Maps Commission is about ensuring Wisconsinites are empowered to have a voice in the redistricting process, something has has been severely lacking in the past. I look forward to seeing the good, nonpartisan work of this commission.

https://t.co/pYB2tdecYO"
1233817640877072387,2020-02-29 18:13:43,"I stopped by the 54665 Podcast to talk about economic development in Wisconsin's rural communities with @viroqua_chamber and @wiscochef! Listen here:  

https://t.co/ty3cL5znW3"
1233431370350891008,2020-02-28 16:38:49,"RT @DHSWI: Clean hands are essential to avoid catching and spreading viruses, like the flu and COVID-19. Download &amp; print this poster &amp; put…"
1233168705976197120,2020-02-27 23:15:05,"RT @repjocasta: Clinicians are available to offer support, guidance, &amp; connect anyone who needs assistance to available resources. 

MKE Co…"
1233110451891904512,2020-02-27 19:23:36,"Good news, folks. Under my education plan we can do both. https://t.co/DiXtBHFXky"
1232821691417595906,2020-02-27 00:16:10,"Our hearts go out to the families of those whose lives were senselessly taken, all of the folks and workers at Molson Coors, and the Milwaukee community as we grapple with yet another act of gun violence that will have long-lasting consequences for this community and our state."
1232821690649976837,2020-02-27 00:16:10,"We are still learning more details about what happened at Molson Coors earlier today. What we do know, though, is that more lives were lost in a mass shooting in Wisconsin."
1232821689286905858,2020-02-27 00:16:10,I want to say thank you to the folks at Molson Coors and our first responders who acted quickly to contain the situation and get folks and students in the nearby areas to safety.
1232346371354742784,2020-02-25 16:47:25,"It's the last week of #BlackHistoryMonth , but there are still plenty of ways to celebrate with the Legislative Black Caucus. Find an event here: https://t.co/vdPGSNNlPt"
1232336732613423105,2020-02-25 16:09:07,"RT @JodiRep: Strong public schools build the knowledge
and skills young people need to succeed.
Pledge your support to your local public
sc…"
1232319093338001410,2020-02-25 14:59:01,"From prescription drug prices to suicide prevention, to supporting Wisconsin farmers, thank you for your tireless advocacy in the Assembly over the last 8 years, Rep. Deb Kolste. I wish you and your family the best. 

https://t.co/SoLZfhhbtm"
1232079224527376385,2020-02-24 23:05:52,"Frankly, nothing is ""dead."" The Wisconsin State Legislature is a full-time legislature and these folks are elected to serve until the end of the year. There are issues that I know both parties want to get to work on, so let's get to work. There's no rest for the elected. https://t.co/iHwfkrrTJU"
1232076482157203458,2020-02-24 22:54:58,"RT @RepDanielRiemer: Every child, regardless of zip code, deserves a quality education. That's why I supported @GovEvers special session on…"
1232061292061614080,2020-02-24 21:54:37,RT @SenSchachtner: I'm #PublicSchoolProud! It's We Love Our Public Schools week so share all the reasons you love your public schools and s…
1232023076726071303,2020-02-24 19:22:46,"It's We Love Our Public Schools week! Some of the most meaningful moments in my life have happened in a public classroom, from meeting my wife in kindergarten to my first teaching job in Baraboo, to the schools I visit today as governor. I am #PublicSchoolProud. https://t.co/ExQuH0qw82"
1231983148625465344,2020-02-24 16:44:06,"RT @OutagamieExec: Last Friday, @GovEvers signed AB611 at @ATWairport supporting @GulfstreamAero &amp; other aero cos, putting Wis in line with…"
1231962349969473536,2020-02-24 15:21:27,My administration is working diligently to continue to expand inclusivity and diversity in state government. That includes a paid internship opportunity for students over the age of 18 to explore careers in state government. Learn more here: https://t.co/Hgfq8oVUcQ
1231609372108886018,2020-02-23 15:58:51,"From determining how our next electoral maps will be drawn to how much federal funding we receive for our schools, roads, and healthcare, the 2020 Census will set the stage for our state for the next decade. Learn more about getting involved here: 

https://t.co/hdr2Ab09km"
1231233184823758848,2020-02-22 15:04:01,"Our state has survived on the resiliency of Wisconsin farmers, but we know times are tough. Stop by a free workshop hosted by @widatcp to discuss stress management techniques and resources available to you and your family. https://t.co/2piLu6BnHL"
1230968658337443841,2020-02-21 21:32:53,"It’s National Caregivers Day, Wisconsin! Our Task Force on Caregiving is working to find ways to strengthen our direct care workforce and better support those in the field. Thank you, caregivers, for all your hard work. https://t.co/lPmwGpC2e5"
1230911032492777473,2020-02-21 17:43:54,"These days broadband isn't a luxury, but a necessity. It is critical to expanding access to education, ensuring business growth, and connecting our communities. We made the largest state investment in broadband in our state's history so let's get to work to get folks connected. https://t.co/3Jz012jzPY"
1230875584290607104,2020-02-21 15:23:02,"There's some pretty interesting characters on our #Census2020 Complete Count Committee, including Captain Census from @WisVoices and he's got a message for you: https://t.co/0ZjYr4xkVP"
1230511805040119808,2020-02-20 15:17:30,"In my administration we believe in second chances and I had the pleasure of pardoning 7 more folks who have been working to better themselves and their communities. 

Learn more about the pardon application process here: https://t.co/oh1s7Syp9f

https://t.co/35WMAgPQsy"
1230325891756175364,2020-02-20 02:58:45,I know there are Republicans concerned about the high price tag of their own unsustainable tax bill that shortchanges our rainy day fund. My plan invests in our kids and property tax relief. There’s still time to do the right thing.
1230191558051483650,2020-02-19 18:04:57,"Folks, this isn't sustainable for our schools, for our kids, or for the future of our state. We cannot allow our school districts to continue to rely on referenda to find funding. Under my proposal, school districts like Nekoosa would get the bump in funding they greatly need. https://t.co/4i8I7o3Mti"
1230175388816617473,2020-02-19 17:00:42,RT @SenShilling: .@GovEvers special session on education makes critical investments in Wisconsin classrooms while providing $130 million in…
1230153794689937414,2020-02-19 15:34:54,".@LGMandelaBarnes and I had a great time volunteering at the @KCCorp, @Huggies, @UnitedWayGMWC, @UnitedFoxCities, and @DiaperNetwork's diaper repack event last week. Thanks for your hard work everyone and thank you for having us! https://t.co/V7IJiJjQWv"
1229931792351801344,2020-02-19 00:52:44,"Great speech from Forest County Potawatomi Chairman Ned Daniels. From housing to mental health, to economic development and supporting tribal youth, I look forward to working with Wisconsin's First Nations and @tribalcounci on enhancing the quality of life for all Native People. https://t.co/XrQ8Ga0yXP"
1229840289847750657,2020-02-18 18:49:09,Great to see @rep89 and Sen. Hansen’s bipartisan bills on PFAS contamination made it out of committee today. I hope Republicans schedule these bills for a clean vote in the Legislature this week. It’s time for us to get to work addressing PFAS in our communities.
1229822717807013892,2020-02-18 17:39:19,"You can find your polling place at: https://t.co/b5TjxJE67j. 

Polls are open until 8 pm tonight—if you’re in line by 8 pm, make sure you stay in line to vote!"
1229822717173600256,2020-02-18 17:39:19,"Kathy and I stopped by our polling place this morning to vote. Wisconsinites, what’s your plan to vote today? Reply below ⬇️"
1229792602775531522,2020-02-18 15:39:39,Looking forward to Forest County Potawatomi Chairman Ned Daniels' State of the Tribes speech here at the State Capitol this afternoon. The speech starts at 1 pm. Watch live here: https://t.co/UygbubHqxM
1229499821133901824,2020-02-17 20:16:15,"Our schools and our taxpayers--especially in rural communities--need this support and they need it now. Let's put people above politics and get this done. 

https://t.co/zkVJSiGJuQ"
1229458891534163970,2020-02-17 17:33:36,Thank you to @aarpwi for awarding @WITreasurer Godlewski and I with the 2020 AARP Super Saver Awards. https://t.co/QvOjLElVRu
1229445511037325315,2020-02-17 16:40:26,"RT @DHSWI: When it comes to fighting #flu and other viruses, we're all in it together. Get a #Flushot and practice simple habits to keep yo…"
1229421847533543425,2020-02-17 15:06:24,The spring primary is tomorrow and it is important to make sure your registration information is up to date. Make sure you're registered by visiting https://t.co/kQlhd7g1U4 or by calling your municipal clerk’s office. Remember: you can register when you go to the polls tomorrow! https://t.co/5xKVTF9Rbs
1229112991972495361,2020-02-16 18:39:07,"Our state has a rich history of opening its doors to people of all backgrounds, experiences, and walks of life. The Hmong community is an integral part of the fabric of our state, and we will stand with and support our Hmong neighbors. https://t.co/wLJzzQEvLT"
1228685883328602113,2020-02-15 14:21:57,"Today is #NationalWisconsinDay! Do a polka, serve up some kringle, and celebrate America's Dairyland. #OnWisconsin https://t.co/2VRXvVKPCy"
1228417807332904962,2020-02-14 20:36:42,"Thank you, WPEN and all the students and teachers who crafted these great valentines! I look forward to celebrating We Love Our Public Schools week with all of you Feb. 24-28. #PublicSchoolProud https://t.co/Dn7ouZGd7V"
1228409840395051010,2020-02-14 20:05:03,"The Wisconsin Rural School Alliance is right-- my proposal is a win-win for students and for taxpayers. Let's get this done to bolster our rural communities and support our students. 

https://t.co/9JY918Gzps"
1228339728648458243,2020-02-14 15:26:27,"Holy Mackerel! You're a catch! 🎣

To my favorite euchre partner, pickleball champion, and partner-in-mischief, Happy Valentine's Day, Kathy. https://t.co/ih8bWGRpzY"
