id,created_at,text
1247249776547999745,2020-04-06 19:48:14,RT @DHSWI: #COVID19_WI #SaferAtHome https://t.co/D5sFSFLb7a
1247231199556202496,2020-04-06 18:34:25,All ballots already cast in the 2020 Spring election will remain valid and will be tallied in conjunction with the new in-person voting date.
1247231198230806528,2020-04-06 18:34:24,"The order also calls the Legislature to meet in special session tomorrow, giving them another opportunity to address the in-person election date. If they fail to act, in-person voting will occur on June 9, 2020."
1247231196955697152,2020-04-06 18:34:24,"The bottom line is that I have an obligation to keep people safe, and that’s why I signed this order today. More here: https://t.co/lPjYAeUD1k"
1247231195860983810,2020-04-06 18:34:24,"I had hoped that the Legislature work do its part—just as the rest of us are—to help keep people health and safe, but as municipalities are consolidating polling locations, I cannot in good conscience stand by and do nothing."
1247231194720133123,2020-04-06 18:34:23,"In the absence of legislative action, today I signed Executive order #74 suspending in-person voting for the April 7 spring election until June 9, 2020."
1247230675314302978,2020-04-06 18:32:20,Please join us for our 1:30 pm live media briefing. Tune in below: https://t.co/SHws6fv6Rm
1247177497726210049,2020-04-06 15:01:01,"RT @DHSWI: Join us for today's media briefing, live at 1:30. @GovEvers, #DHSWI Secretary-designee Andrea Palm, and Chief Medical Officer Dr…"
1247157576287924224,2020-04-06 13:41:51,"RT @WisconsinDOT: We’re all in this together. By practicing safe hygiene and safe driving habits, for essential trips only, we can help ens…"
1246933789080612865,2020-04-05 22:52:36,"Ensuring first responders and healthcare professionals have the personal protective equipment they need is critical for their health and safety. We are continuing to pursue every option, including donations. If you have #PPE you can donate, visit: https://t.co/xtCfO50R30. https://t.co/MrrMjAivMV"
1246891258938658816,2020-04-05 20:03:36,RT @DHSWI: Good tips to remember and follow. Together we can #StopTheSpread of #COVID19_WI. Learn more: https://t.co/WUDvQGawXb https://t.c…
1246825563055992833,2020-04-05 15:42:33,"Following my request earlier this week, Wisconsin has been granted a federal major disaster declaration that is going to enable us to access critical resources for all 72 Wisconsin counties and for our tribal communities. 

More here ⬇️
https://t.co/QjCliq1qIX"
1246580769511714817,2020-04-04 23:29:50,"This, however, is an easy decision. It's time for every Republican legislator to do their jobs and take a vote on this commonsense proposal to extend the election date so everyone can vote safely from home. I urge every Wisconsinite to contact their legislators and demand a vote."
1246580768400240640,2020-04-04 23:29:50,"Being a good leader means listening to the experts, being willing to adjust our course based on the science, and making the tough decisions necessary to protect the people of our state."
1246580767234244608,2020-04-04 23:29:49,Republicans in the Legislature are playing politics with public safety and ignoring the urgency of this public health crisis. It’s wrong. No one should have to choose between their health and their right to vote.
1246532435128418304,2020-04-04 20:17:46,"Getting outside is good for your mental and physical health, but remember to stay close to home and six feet away from others. 

Also, keep your in-person interactions to your immediate household. Now is not a time to go fishing or hiking with friends. #COVID19 #SaferAtHome https://t.co/cISm2aDlkD"
1246530394507210755,2020-04-04 20:09:40,RT @DHSWI: We're all in this together. And @GovEvers is asking us to come together to help those on the frontlines in communities that need…
1246452334411964422,2020-04-04 14:59:29,"What we are doing is working, Wisconsin. Thank you for staying home and keeping your social circles small. We will get through this together… from afar. #StayHome #SaferAtHome https://t.co/Hpc28phG9F"
1246188873031376898,2020-04-03 21:32:35,RT @DHSWI: A big thank you to first responders &amp; health professionals on the frontlines of #COVID19_WI. And a message from @GovEvers: it’s…
1246168485102673920,2020-04-03 20:11:34,RT @WisDCF: Are you a healthcare worker or essential employee who needs child care during the #COVID19 pandemic? Get connected to safe and…
1246141143940648960,2020-04-03 18:22:55,"That’s why I’m calling the Legislature into a Special Session. They need to do their part—just as all of us are—to help keep our neighbors, our families, and our communities safe."
1246141142346813442,2020-04-03 18:22:55,"Well here’s the bottom line folks: if, as elected officials, we’re going to expect the people of our state to make sacrifices to keep all of us safe, then, by golly, we better be willing do our part, too."
1246141141092683776,2020-04-03 18:22:54,"Over the past few weeks, I’ve asked folks like you for your help—you’ve practiced social distancing, you’ve made sacrifices when it comes to your jobs, your schooling, and your day-to-day activities are what we need to flatten the curve to protect the people of our state."
1246141139863760898,2020-04-03 18:22:54,"I’m asking the Legislature to take up legislation allowing an all-mail election, to send a ballot to every registered voter who has not already requested one by May 19, and to extend the time for those ballots to be received to May 26."
1246141138580303873,2020-04-03 18:22:54,"Folks, today I’m announcing that I signed an Executive Order calling the Legislature to meet in Special Session tomorrow, Saturday, April 4th at 4:00 p.m. to take up changes to the upcoming spring election. 

https://t.co/8m5HpvsRDz"
1246128043074019328,2020-04-03 17:30:52,"RT @LGMandelaBarnes: Stay home, stay safe, and stay strong Wisconsin ❤️ https://t.co/UkJxrsc2gl"
1246118944932384768,2020-04-03 16:54:42,"RT @DHSWI: Another media briefing today at 1:30. @GovEvers will be joined by #DHSWI Secretary-designee Andrea Palm, our Chief Medical Offic…"
1246099894244216838,2020-04-03 15:39:00,"The severity of this disease in the African American community is a crisis within a crisis. That’s why the state added further resources and support to help communities, raise awareness, and ensure access to care. 

https://t.co/QSz9AE9dC6"
1245876196174266368,2020-04-03 00:50:07,"Understanding the #SaferAtHome order is important. Do your part to help #FlattenTheCurve and #StayHome by reviewing our updated FAQ document, available here:  https://t.co/95rOGamFdH"
1245835505096200192,2020-04-02 22:08:25,"I continue to encourage every Wisconsinite to request their absentee ballot and vote safely from home. 
Request your ballot at https://t.co/kQlhd6Yqvu. 3/3"
1245835504026701825,2020-04-02 22:08:25,It’s great news that Wisconsinites will have more time to request and submit a ballot and that clerks will have more time to count ballots. 2/3
1245835503024267264,2020-04-02 22:08:25,"In the absence of the Legislature doing its part to ensure a fair and safe election, I appreciate that the court chose to implement some of the common-sense solutions that I’ve been advocating for. 1/3"
1245807608272834560,2020-04-02 20:17:34,"RT @DHSWI: Updated numbers. Also, a new website that will connect you w/the Wisconsin #COVID19 Nurse Triage Line. If you are concerned that…"
1245790725414895617,2020-04-02 19:10:29,"RT @WisconsinDOT: Delivery drivers, truckers, postal workers and others are doing important work, transporting food, goods and mail to many…"
1245761903650979847,2020-04-02 17:15:57,The sad reality is that some scammers will take advantage of the #COVID19 crisis to take advantage of folks looking for help. Protect yourselves and your family by following these tips to prevent fraud: https://t.co/19wecXVMMr
1245720895244488708,2020-04-02 14:33:00,"Protecting the health and safety of Wisconsinites is going to take not only aggressive federal action, but state action as well. Let’s get this done. #COVID19  

https://t.co/hMzclOfzix"
1245503950649987072,2020-04-02 00:10:56,"I’ve asked the legislature to do its part to ensure a fair, safe election and I hope we can get some clarity as soon as possible. The bottom line is that we have to keep folks safe and we have to make sure everyone who wants to vote has the opportunity to make their voice heard."
1245503949232193536,2020-04-02 00:10:56,"We have three branches of government to ensure a system of checks and balances, and questions about our elections typically rely on all three playing a role. If I could have changed the election on my own I would have but I can’t without violating state law."
1245485272587857920,2020-04-01 22:56:43,Our top priority is the health and safety of Wisconsinites. Our #SaferAtHome order is a critical step in doing that. So thank you for staying home and keeping Wisconsin safe. #StayHome #FlattenTheCurve https://t.co/JMsD117QOQ
1245447090378948610,2020-04-01 20:25:00,"We need to take aggressive legislative steps here in Wisconsin for not only the health and safety of our families and workers, but for our state’s economy."
1245447089053552640,2020-04-01 20:24:59,I’m calling on the Legislature to convene without any further delay. I look forward to working with legislators to find bipartisan solutions and to hearing any proposals they may have to address the impacts of #COVID19 on the health and well-being of Wisconsinites.
1245447087749132288,2020-04-01 20:24:59,"The second package ensures workers receive back payment for any lost unemployment benefits due to the one-week waiting period, increases funds for healthcare providers, and provides housing and utility protections, among many other things. https://t.co/atHDxeh4mF"
1245447086465671168,2020-04-01 20:24:59,"The first package provides additional funding and flexibility for our healthcare workers and public health professionals, repeals the one-week waiting period for unemployment insurance, expands access to telehealth services, and much more. More here: https://t.co/CDgXYCNyZM"
1245447085245132805,2020-04-01 20:24:59,"These packages provide much needed support and relief for our healthcare providers, essential workers, small businesses, and families across our state."
1245447084083310593,2020-04-01 20:24:58,"We need to do everything we can to support those who need it during these challenging times, and we need comprehensive legislative solutions here at the state level. That’s why I proposed two legislative packages for the Legislature to take up."
1245447082984390656,2020-04-01 20:24:58,"THREAD: Addressing this public health emergency is going to take aggressive action not only from the federal government, but from the state. What’s happened on the national level is a great first step, but it doesn’t go far enough for Wisconsin workers, families, and businesses."
1245399358972907520,2020-04-01 17:15:20,RT @DHSWI: If you're experiencing a loss of income due to #COVID19_WI WIC is here to help.  Find out if you're eligible at https://t.co/aAJ…
1245389415649689600,2020-04-01 16:35:49,"It's on all of us to help keep our families and our communities safe. Do your part by staying home, staying six feet away from others, and staying up-to-date by following @DHSWI. 

Wisconsin is tough and we will get through this together. #FlattenTheCurve #StayHome #SaferAtHome https://t.co/L5storLr1j"
1245366119034056704,2020-04-01 15:03:15,"RT @DHSWI: ""What we're doing is working."" #SaferAtHome https://t.co/h6WXRC8cms"
1245351249051975680,2020-04-01 14:04:09,"With the #COVID19 public health emergency filling our timelines, I want to make sure to remind you of an important task you can complete right from home—the 2020 Census! The census isn’t just a headcount—it’s about visibility, voice, and value.  

Visit: https://t.co/2BvotIiKmH https://t.co/EpATHRuEF1"
1245091116279427072,2020-03-31 20:50:29,"The #COVID19 outbreak has caused a lot of anxiety and many Wisconsinites are feeling overwhelmed. You are not alone. We’re all in this together. There are free, confidential resources available.

Text TalkWithUs to 66746 or call the disaster distress hotline at 1-800-985-5990. https://t.co/A94hYgf97d"
1245054673599352832,2020-03-31 18:25:40,"RT @DHSWI: Great visual from our partners at @PublicHealthMDC. We want you to be able to get outside, but we also want you to be safe. Reme…"
1245046540151828481,2020-03-31 17:53:21,Read more here: https://t.co/C2SIAXAwE8
1245043163154153473,2020-03-31 17:39:56,RT @WEDCNews: Important news from @SBA_Wisconsin - You can get assistance now while your disaster loan application is still pending. https:…
1245041310739783680,2020-03-31 17:32:34,"We are hopeful this declaration will allow the state to access critical programs that are needed to deal with the pandemic now, and with the recovery that will be taking place down the road."
1245041309473067009,2020-03-31 17:32:34,Today I asked the president to issue a major disaster declaration for the entire state of Wisconsin. The response to #COVID19 has required tremendous action from the state and all of its communities that far exceeds the resources currently available to us.
1245024098750582784,2020-03-31 16:24:11,RT @DHSWI: ICYMI: @GovEvers joined the #DHSWI team to update our response to #COVID19_WI. He says #SaferAtHome is effective &amp; supplies are…
1245023145980915713,2020-03-31 16:20:24,RT @DHSWI: #COVID19_WI https://t.co/RMTNp0VqzB
1244790149604503552,2020-03-31 00:54:33,RT @WisDCF: Are you an essential workforce family in need of #childcare during #COVID19? Find child care near you with @WisDCF new interact…
1244758918531702784,2020-03-30 22:50:27,Residents who are seeking a COVID-19 test are still required to receive an order from a doctor. These labs are not testing sites. 8/8
1244758917378269184,2020-03-30 22:50:27,"I also want to thank the Wisconsin State Lab of Hygiene, Milwaukee Public Health Lab, Wisconsin Clinical Lab Network, Wisconsin Diagnostic Lab at @Froedtert, Children’s Hospital of Wisconsin, @gundersenhealth, and @Aurora_Health for their continued leadership. 7/8"
1244758916220649472,2020-03-30 22:50:26,"Wisconsin is extremely fortunate to have these industry leaders in our own backyard, and I want to thank them for stepping up with innovation, cutting down superficial barriers, and doing all they can to keep our communities healthy. 6/8"
1244758915008458753,2020-03-30 22:50:26,"With testing supplies limited nationwide and worldwide, we are working diligently day and night to obtain these testing materials from the federal government and through the private market. 5/8"
1244758913825693696,2020-03-30 22:50:26,"These critical partnerships will important to not only increasing our testing capacity, but fighting this outbreak in Wisconsin by getting folks their results as quickly as possible so we can get them isolated and cared for. 4/8"
1244758912596717569,2020-03-30 22:50:25,"This new partnership now includes laboratory support from @ExactSciences, @mfldclinic, @Promega, and @UWHealth. These organizations, along with the Wisconsin Clinical Lab Network, will now share knowledge, resources, and technology to bolster Wisconsin’s testing capacity. 3/8"
1244758911338418176,2020-03-30 22:50:25,"The Wisconsin Clinical Lab Network labs have been averaging completion of 1,500-2,000 COVID-19 tests per day. The expanded capacity from the state’s new partnership is expected to double that capacity initially and continue to expand. 2/8"
1244758910117920768,2020-03-30 22:50:25,THREAD: Expanding Wisconsin’s testing capacity is a critical step in ensuring the health and safety of Wisconsinites. That’s why today we announced a new public-private partnership to increase Wisconsin's laboratory testing capacity for COVID-19. 1/8
1244736718227394560,2020-03-30 21:22:14,"It’s #NationalDoctorsDay! Take a moment to celebrate by sending a thank you note and word of encouragement to a doctor at @UWHealth. #ThankYouDoctors #COVID19  

https://t.co/GOe3sKWeaR"
1244722421300523008,2020-03-30 20:25:25,"RT @WisconsinDOT: An important message from Wisconsin State Patrol Superintendent Tony Burrell, who outlines the facts of the #SaferAtHome…"
1244711606728060928,2020-03-30 19:42:27,RT @WDNR: Wisconsinites are lifting each other up and providing support across the state to one another in unique ways. How are you helping…
1244711455632453633,2020-03-30 19:41:51,RT @DHSWI: Updated numbers for you. And the number of people with negative test results for #COVID19_WI now reflects Wisconsin residents on…
1244689770539671557,2020-03-30 18:15:41,Join us at 1:30pm for the Monday media briefing with @DHSWI for updates on #COVID19. Live stream link below⬇️ https://t.co/kIjesPEWwO
1244670965264474112,2020-03-30 17:00:57,RT @SenatorBaldwin: I have led the Wisconsin Congressional delegation in supporting @GovEvers requests to @FEMA for additional testing supp…
1244634847647133697,2020-03-30 14:37:26,"It’s important to know the facts about #COVID19 and to get the most up-to-date, accurate information, so I urge you to follow @DHSWI for the latest public health information, visit https://t.co/GdjqABEnjd, and stay connected with trusted Wisconsin news sources. #SaferAtHome"
1244432613827170304,2020-03-30 01:13:50,RT @DHSWI: https://t.co/EXdViZv2AR #SaferAtHome https://t.co/XEAnWPC5xj
1244432498571894784,2020-03-30 01:13:22,"RT @DHSWI: We now have more than 1,100 cases of #COVID19 in Wisconsin. Please stay #SaferAtHome to help #StopTheSpread. More: https://t.co/…"
1244350742661664773,2020-03-29 19:48:30,"We can and should learn lessons from other communities—listen to the science, be prepared, act swiftly, and save lives."
1244350741537599489,2020-03-29 19:48:30,"Even still, I sure as heck hope we’re all wrong. But the responsible thing to do is plan for the worst and hope for the best, so that’s what we’re doing."
1244350740476329985,2020-03-29 19:48:30,"Now, I trust the science, our public health experts, our emergency management professionals, and our military leaders when they say these plans are necessary."
1244350739293655041,2020-03-29 19:48:29,We’re also working with the Army Corps of Engineers to ensure that field hospitals and facilities will be ready when the surge of acute cases begins to hit our healthcare systems in the coming weeks.
1244350736651206658,2020-03-29 19:48:29,Our leadership team at the State Emergency Operations Center has been preparing to support our hospitals and our local and tribal health partners to assist them in setting up voluntary isolation centers.
1244350735762042880,2020-03-29 19:48:28,"We’re headed into the worst of this, folks, and the need is only going to get greater."
1244350734608580614,2020-03-29 19:48:28,"But the bad news is that it isn't enough--we need more. We need PPE and our requested lab supplies in order to increase our capacity to test tens of thousands of Wisconsinites, isolate those who are infected, and do our best to contain the spread of the disease."
1244350733576736769,2020-03-29 19:48:28,"The good news is that, due to the generosity of hundreds of Wisconsin businesses, non-profits, and even individuals, we’ve been able to start distributing donated PPE into our local communities."
1244350732452663297,2020-03-29 19:48:28,"Wisconsinites can now go to https://t.co/xtCfO5isrA to either donate or sell large quantities of PPE to the state of Wisconsin, such as masks, gloves, and gowns."
1244350729734717440,2020-03-29 19:48:27,"So in addition to working with the federal government to get our share and working to make large purchases in partnership with our neighbors in the Midwest, last week we also launched a PPE Donation and Buyback program."
1244350728531070976,2020-03-29 19:48:27,Wisconsin is competing not just with other states and the federal government but with the entire world to get these supplies—this is a global crisis.
1244350727369228288,2020-03-29 19:48:26,"At the same time, we have continued to work at the state and regional level to purchase supplies and equipment, including PPE, testing supplies, and ventilators."
1244350726228160513,2020-03-29 19:48:26,"In addition to our SNS shipments, we have also requested PPE from FEMA which is critically necessary to protect our first responders and health care workers who are on the front lines of the COVID-19 battle."
1244350724970078208,2020-03-29 19:48:26,"As of today, we have received about half of these items and have been working this weekend to start distributing this PPE to local communities."
1244350723841761283,2020-03-29 19:48:26,"Two weeks ago I submitted a request to get Wisconsin’s share of supplies from the Strategic National Stockpile (SNS). That includes ⬇️
-N95 Respirators: 54,709  
-Surgical Masks: 130,326  
-Face Shields: 24,816  
-Surgical Gowns: 20,233  
-Coveralls: 104  
-Gloves: 72,044"
1244350721828544517,2020-03-29 19:48:25,THREAD: I wanted to provide some updates on Wisconsin's 24/7 whole-of-government response to the #COVID19 crisis. I am incredibly grateful to have the leadership and support of @WI_Guard and @ReadyWisconsin as we work around the clock to keep our communities safe.
1244331521927827456,2020-03-29 18:32:08,"RT @WIS_DFI: Today @GovEvers alongside @WIS_DFI, @FDICgov, and @TheNCUA reminded Wisconsinites the safest place to keep their money is in F…"
1244282973924413440,2020-03-29 15:19:13,"RT @DHSWI: We know you have questions. We have guidance on what #SaferAtHome means for #child care. Take a look, then log on: https://t.co/…"
1244059986130374656,2020-03-29 00:33:08,RT @DHSWI: Stay #SaferAtHome. And get information about #COVID19_WI by logging on to https://t.co/WUDvQGawXb or calling 211. https://t.co/U…
1244024071379017730,2020-03-28 22:10:26,"I can't say it enough-- thank you to all the healthcare professionals who are working tirelessly to care for and protect our communities through #COVID19.

We can help them continue to do their important work by helping to #FlattenTheCurve by staying home. #SaferAtHome https://t.co/fog7ElLS7n"
1243983322365247488,2020-03-28 19:28:30,"RT @DHSWI: While we want you to stay #SaferAtHome, #healthcare services are essential, so facilities remain open, although they are postpon…"
1243983166714580993,2020-03-28 19:27:53,"RT @DHSWI: #COVID19_WI test results are coming in all the time and the number of positive cases continues to rise. Please, stay #SaferAtHom…"
1243938878274203649,2020-03-28 16:31:54,"This is a great idea to connect communities while following the #SaferAtHome order. We are in this together, Wisconsin. #StayHome #FlattenTheCurve 

https://t.co/GTtIf52rp8"
1243682929206636544,2020-03-27 23:34:51,"Looking for ways to help out your neighbors while following the #SaferAtHome order this weekend? @WI_UnitedWays and @ServeWisconsin have volunteer opportunities you can do from home. 

Find an opportunity that fits your abilities here: https://t.co/IGWSCWOEDA."
1243671934082015232,2020-03-27 22:51:10,RT @LGMandelaBarnes: Staying at home means saving lives. #SaferAtHome https://t.co/3NzqVAhvBK
1243662101962317824,2020-03-27 22:12:05,RT @WI_Guard: The #WisconsinNationalGuard continues to support the state’s response to COVID-19. Here’s an update on our current missions.…
1243645945738231808,2020-03-27 21:07:53,"While many people love the beauty and character our state has to offer, we ask that you do not travel to your seasonal homes or rental cabins for the safety and well-being of our rural counties and tribal communities. #SaferAtHome #FlattenTheCurve

https://t.co/8C0HD5S05i"
1243604040363069445,2020-03-27 18:21:22,Tune in for our 1:30 pm media briefing for the latest updates on #COVID19. ⬇️ https://t.co/QKJlwb3PAw
1243591399578038272,2020-03-27 17:31:09,"This is not a Republican issue or a Democratic issue—this is an issue of democracy. I don’t care who gets the credit, I just want to make sure that everyone has the chance to vote this April. We don’t have time for politics—we have to get this done, folks."
1243591398391046144,2020-03-27 17:31:08,"I understand that Republican leadership has expressed their support for not delaying the upcoming election, I am hopeful that all of us can agree that everyone should be able to exercise their right to vote."
1243591395484372992,2020-03-27 17:31:08,My focus has been and will continue to be ensuring everyone has the opportunity to cast their ballot in the upcoming election. That’s why today I am calling on the Legislature to act to send an absentee ballot to every registered voter in Wisconsin. https://t.co/39rXpZVmfK
1243552824908058624,2020-03-27 14:57:52,"RT @WisconsinDPI: Check it out! Beginning 3/30, @PBSWI will have a schedule of programs with digital resources to support at-home learning.…"
1243531601851461632,2020-03-27 13:33:32,RT @DHSWI: There are things you can do each day to help #StopTheSpread of #COVID19_WI. Let's all work to be #SaferAtHome: https://t.co/WUDv…
1243357758339993601,2020-03-27 02:02:44,"Thank you for banding together and staying home, Wisconsinites. A “B” isn’t bad, but I know we can do better. Let’s do this together. https://t.co/pOXukCl1gr"
1243311649630457856,2020-03-26 22:59:31,"I am proud but not surprised by the outpouring of offers to help. That's what Wisconsin is all about-- neighbors helping neighbors in times of need.

Visit https://t.co/xtCfO50R30 if you are able to donate any #PPE for workers on the frontlines, such as gowns, gloves, and masks. https://t.co/CA2eulc5E7"
1243284171155329026,2020-03-26 21:10:20,RT @DHSWI: #COVID19_WI #SaferAtHome https://t.co/WfXsnIITMP https://t.co/x0ertP8XJE
