id,created_at,text
1217120931367325699,2020-01-14 16:26:57,"In 2019, we took bold steps to expand educational opportunities, protect our environment and natural resources, reform health care, invest in infrastructure and bolster public safety – all while reducing taxes and adding to our budget reserves."
1217120023988330497,2020-01-14 16:23:21,It brings me great satisfaction to report on the promising prospects of our public affairs and to commend the members of the House and Senate for your efforts to make Florida successful.
1216861127751225350,2020-01-13 23:14:35,"Tomorrow I will deliver the State of the State address to a joint session of the Florida Legislature &amp; Floridians everywhere. I look forward to a successful legislative session &amp; working to ensure a brighter, better future for all. 

Watch my address live on the @floridachannel. https://t.co/1GJniKFwgO"
1216812565935857664,2020-01-13 20:01:37,RT @FLCaseyDeSantis: Thank you @Jaxhealth for hosting me this morning! So many are impacted by the opioid crisis that has taken hold in our…
1216801568974086144,2020-01-13 19:17:55,I’m pleased to hear @DollarTree will be opening a new distribution center in Marion County. This center is projected to create 600 jobs with a capital investment that is estimated to surpass $200 million: a big win for both Marion County and Florida.
1216750765303267330,2020-01-13 15:56:03,I thank Chairman John Rood and the @FloridaPrepaid College Board for their work and leadership. This price reduction is great news for hardworking Florida families looking to invest in their children’s future.
1216750763462008832,2020-01-13 15:56:02,"Today I announced that @FloridaPrepaid will lower Prepaid Plan prices by $1.3 billion, a reduction benefitting 224,000 current customers. See details here – https://t.co/poWUtR9nAr https://t.co/8BmMGb93kK"
1216017961737162754,2020-01-11 15:24:09,"As severe weather approaches our state today, every resident in NW FL should be prepared for heavy rain, strong winds, and be ready to seek shelter if a tornado warning is issued. Follow @FLSERT and local media for updates."
1215742125620547584,2020-01-10 21:08:04,We are closely monitoring a strong cold front with @FLSERT that is expected to bring severe weather to Northwest Florida tomorrow. This system is capable of producing tornadoes &amp; strong winds of more than 60mph. Make sure you have a plan &amp; take any watches &amp; warnings seriously. https://t.co/vMtMZ5MQVQ
1215731047150882817,2020-01-10 20:24:03,I am hopeful the Python Bowl brings much needed public awareness and engagement on this critical issue: pythons are severely disrupting natural food chains and continue to threaten endangered species.
1215731046244921345,2020-01-10 20:24:03,"Today kicks off the 2020 #PythonBowl, where participants will head into the Everglades to remove invasive Burmese pythons. More info here - https://t.co/rVWGoGzB2t"
1215706627833241600,2020-01-10 18:47:01,Hurricane Michael left devastating impacts throughout NW FL and communities are still trying to rebuild. Today I announced over $5 million through @FLDEO's Rural Infrastructure Fund to help these communities recover. Details here - https://t.co/WIinPNG7J3
1215699120075264000,2020-01-10 18:17:11,"While I’m proud of our progress so far, I look forward to working with the Legislature this upcoming legislative session to deliver more wins for Florida’s environment; the fight to protect and preserve our state’s natural resources is far from over."
1215699119127306241,2020-01-10 18:17:11,One year ago today I signed Executive Order 19-12 to implement major environmental reforms. See the EO here - https://t.co/Z6pQG4iBhD
1215374532455862278,2020-01-09 20:47:23,"We are forever indebted to the men and women who answer the call of duty and put their lives on the line by running into harm’s way. Today, we recognize the sacrifice you and your families make every day to keep us safe. #LawEnforcementAppreciationDay https://t.co/UyJvaX0zGv"
1215369935611944962,2020-01-09 20:29:07,"One year ago, I named Barbara Lagoa to @FLCourts – the first Cuban-American woman to serve on FL’s highest bench. Today, she serves on the @USCourts 11th Circuit where she continues to uphold the rule of law through principle-based decisions. Her replacement will do the same. https://t.co/h3W6fHoOXl"
1215359386257887233,2020-01-09 19:47:12,".@SpiritAirlines is a major job creator for our state, &amp; we are excited that they have chosen to expand their FL footprint with a new corporate campus. Today’s groundbreaking is just another indication that Florida remains the best state in the nation to start or grow a business. https://t.co/QHsGfQ0tiE"
1215323928165539840,2020-01-09 17:26:18,".@FLCaseyDeSantis and I send our sincerest condolences to @JimmyPatronis and @katiepatronis for the passing of Jimmy’s father, Jimmy Patronis, Sr. You and your family are in our thoughts and prayers during this difficult time. https://t.co/lrUlYmSYPh"
1215262516651155457,2020-01-09 13:22:17,"Great news for Florida’s education system – the graduation rate continued to increase last year, climbing to 86.9%, &amp; has risen over 27% since 2003-04. I applaud FL's students, parents &amp; educators for their hard work that lead to these positive results. https://t.co/ekLS0EuLJR"
1214987516929024001,2020-01-08 19:09:32,"One year ago today, I took the oath of office to become Governor of this great state. It’s an honor to work every day on behalf of Floridians and I look forward to our continued efforts to create a bolder, brighter, better future for all. https://t.co/9f7inMDdNa"
1214668425383104513,2020-01-07 22:01:34,"I look forward to working closely with the @POTUS @realDonaldTrump administration including @HUDgov, @US_EDA and @USTreasury on this initiative which will bring more high wage jobs and opportunities for Floridians. More info here – https://t.co/8TN7rv7b8w"
1214668423554306048,2020-01-07 22:01:34,It was great to be joined by @SpaceFlorida President Frank DiBello as well as @EnterpriseFL President @JamalSowell to confirm my administration’s commitment to promoting opportunity zones in the Melbourne area.
1214616651393568769,2020-01-07 18:35:50,Enjoyed the great opportunity to speak at the @FloridaChiefs 2020 Mid-Winter Training Conference in Orlando. @FLCaseyDeSantis and I stand with and extend our highest gratitude to the men and women in blue for their efforts to keep Florida safe day in and day out. https://t.co/xTxIHCUovN
1214312433252220929,2020-01-06 22:26:59,FL’s Complete Count Committee will coordinate with the @uscensusbureau to help facilitate a complete and accurate count of FL residents. I have appointed @LtGovNunez to lead a group of diverse committee members to fulfill this important duty. More info - https://t.co/TNVJ2m1JUL
1214312431985537030,2020-01-06 22:26:59,"The U.S. Constitution mandates a national census count be conducted every 10 years and Florida will do its part to support the federal government’s efforts. Therefore, today I announced the designation of Florida's 2020 Census Statewide Complete Count Committee."
1213201699218886657,2020-01-03 20:53:19,"My administration, along with @elderaffairs Secretary Richard Prudom and @HealthyFLa Surgeon General Scott Rivkees are committed in the fight to end Alzheimer’s. #ENDALZ @alzassociation @AlzAdvocacyFL"
1213201697104941056,2020-01-03 20:53:19,"I'd like to thank Caylor Branham, an extraordinary young man, as well as his mother @Mbranham27, for designing and creating these signs to spread awareness for Floridians living with dementia and their caregivers. #ENDALZ https://t.co/TtgKdx0pxe"
1213186794134614016,2020-01-03 19:54:06,"In the first week of this new year alone, @FLSERT has awarded nearly $29M in hurricane recovery dollars. In 2019, we awarded more than $1.4B in hurricane recovery dollars &amp; we remain steadfast in our commitment to hurricane recovery in 2020. Info - https://t.co/AHZL1gaF8l"
1212804943394091008,2020-01-02 18:36:45,I am pleased to announce more than $5.2M is being awarded to small and rural FL communities to improve infrastructure. We will continue to invest in our state's infrastructure to help attract new businesses and create opportunities for residents. Info - https://t.co/GQjQYRo3Bp
1212382413638291456,2020-01-01 14:37:47,The DeSantis family would like to extend a Happy New Year to all. I am proud of what we were able to accomplish this past year and look forward to an even more successful year in 2020. Wishing everyone a safe and Happy New Year!
