id,created_at,text
1247291780485218308,2020-04-06 22:35:08,"Had a very productive #COVID19 response roundtable this morning with @FLDEO Director Ken Lawson, @FloridaDMS Secretary Jonathan Satter and @FloridaRevenue Director Jim Zingale to ensure Floridians receive their assistance quicky. https://t.co/oYCF5oLerh"
1247281223464103941,2020-04-06 21:53:11,"I appreciate @FedEx’s willingness to help Floridians in a time of need. Starting today, over 100 @FedEx storefronts throughout the state are providing free printing and mailing of reemployment assistance applications."
1247215658712150016,2020-04-06 17:32:39,Today I issued Executive Order 20-95. Read it here - https://t.co/qbeLaKhOX6 https://t.co/GFhbKFwfJF
1247152496763719681,2020-04-06 13:21:40,Today’s #COVID19 news briefing will be at 10:30 AM. Watch it on the @floridachannel. https://t.co/ug1Qj109b3 https://t.co/oqbMdOE09L
1246818450561019905,2020-04-05 15:14:18,https://t.co/CU6vKoQPyM
1246525167679025152,2020-04-04 19:48:53,"As of 11 am today, we’ve tested 102K people for #COVID19 – making Florida second in the nation for testing. I appreciate the efforts of @FLSERT, @HealthyFla, @FLGuard and all of the health care workers and first responders on the front lines of this fight."
1245487830043852800,2020-04-01 23:06:53,I appreciated the time with @TeamCavuto today to discuss the challenges facing Florida ports with passengers on ships that carry COVID-19. https://t.co/7gtiijGXTG
1245348131144900609,2020-04-01 13:51:46,"As we continue to fight the spread of #COVID19, I encourage every Floridian to utilize the resources available below. My administration is focused on providing as much help as possible to the people of Florida. We will get through this together. https://t.co/MEBEqXL0O6"
1244774918123859969,2020-03-30 23:54:01,"On #NationalDoctorsDay we thank the selfless men and women who work every day to improve the health and lives of those they serve.

We are forever grateful for your efforts and are proud to stand with you in this fight against #COVID19."
1244601913733255169,2020-03-30 12:26:34,Counting our blessings. Casey and the kids are doing great. https://t.co/3Thlfr543S
1242939663515635712,2020-03-25 22:21:23,"Thank you, President @realDonaldTrump for approving Florida’s Disaster Declaration which will provide federal funds to help communities recover from the effects of #COVID19. We are prepared for the fight ahead and will come out stronger than ever before. https://t.co/PJXdL687G2"
1242927808843788288,2020-03-25 21:34:16,"Dr. Birx and Dr. Fauci agree; there is too high a risk that travelers from the NY Tri-State Area have been exposed to #COVID19. I appreciate their support for my executive order requiring such individuals flying into FL to self-quarantine for 14 days.

https://t.co/dL3JIQ02DH"
1241142576830431239,2020-03-20 23:20:24,"Floridians are resilient. This is not going to be easy, but we will get through it together. https://t.co/Qti6QV3gBU"
1240971405296128000,2020-03-20 12:00:13,"I want to thank those in the private sector who are helping Florida residents during this crisis, such as @Publix, which is designating senior shopping hours next week for customers 65 and older for their safety and wellbeing."
1240416347231866880,2020-03-18 23:14:37,Thank you @SBAgov for approving Florida’s declaration for disaster loan assistance. Florida businesses interested in learning more should visit: https://t.co/MF2XvinsnA
1240309864594919431,2020-03-18 16:11:30,"Si siente síntomas de COVID-19, comuníquese con la línea directa 24/7 de COVID-19 al: 1(866) 779-6121 Para obtener la última actualización visite: https://t.co/LPJmolUtyy https://t.co/spJX6zKuXb"
1240309757711396864,2020-03-18 16:11:04,El CDC no le recomienda que las personas sanas usen mascaras. Para obtener la última actualización visite: https://t.co/LPJmolUtyy https://t.co/3cdIT8To11
1240309620498989059,2020-03-18 16:10:32,"Si siente síntomas de COVID-19, comuníquese con la línea directa 24/7 de COVID-19 al: 1(866) 779-6121 Para obtener la última actualización visite: https://t.co/LPJmolUtyy https://t.co/shrPwSNqTZ"
1239647506734161922,2020-03-16 20:19:31,"The CDC does not recommend healthy individuals to wear masks. The best way to prevent the spread of COVID-19 is by washing your hands, covering your cough or sneeze, and staying home if you are ill. For more information visit: https://t.co/S3J03iZWQO https://t.co/Iaz8yM1evx"
1239646724727209985,2020-03-16 20:16:25,"If you believe you have been exposed to COVID-19, please contact the COVID-19 Hotline: 1(866)779-6121 before visiting your healthcare provider to prevent the spread of COVID-19. https://t.co/htLGkm7NL6"
1239646129740005383,2020-03-16 20:14:03,If you are experiencing the symptoms of COVID-19 please contact the COVID-19 Hotline: 1(866)779-6121 before visiting your healthcare provider to prevent the spread of this virus. https://t.co/dzjZpg38KE
1238927854802518017,2020-03-14 20:39:53,"Yesterday I sent a letter to @HHSGov Assistant Secretary Robert Kadlec requesting the release of 61 Florida residents from Georgia, many of whom are elderly, who were previously aboard the Grand Princess voyage outside of California. It is time to bring these Floridians home. https://t.co/KUe5iVatVu"
1238254590111473665,2020-03-13 00:04:34,All 67 Florida counties are currently offering early voting. @FLSecofState is in constant communication with Supervisors of Elections regarding readiness for elections and @CDCgov recommendations for polling locations related to #COVID19. More: https://t.co/ES5HTfSZlm
1238254589050327042,2020-03-13 00:04:34,"Voters may consider picking up a vote-by-mail ballot for the March 17th election, which can also be picked up by a designee (form required) &amp; returned by 7pm on Election Day. Designee ""affidavit"" forms are available in English and Spanish. More: https://t.co/7uz4ql0Nt4 #COVID19"
1237155927410737158,2020-03-09 23:18:52,"I have issued an Executive Order declaring a State of Emergency to establish a unified command structure and direct funds as necessary in response to #COVID19. 

EO: https://t.co/EsWPGgMKWT"
1236319360475705349,2020-03-07 15:54:39,I have directed @FLSERT to activate to Level II to ensure Florida has all the necessary resources engaged as we respond to #COVID19. It is critical that we proactively coordinate all state resources to mitigate and contain #COVID19.
1235686201836752896,2020-03-05 21:58:43,"Today, we awarded $2.2 million to Gadsden County through the Hurricane Michael State Recovery Grant Program. This funding, administered by @FLSERT, will help repair two important bridges for Gadsden residents. More here - https://t.co/5w9huNHJG5 https://t.co/o0488kOEPS"
1235269552545705984,2020-03-04 18:23:06,Happy to honor an American legend with this proclamation as a tribute to his many contributions to Florida. https://t.co/8L0CaiS8lT
1234912500786892800,2020-03-03 18:44:18,"This morning, we recognized the @FLGuard in celebration of National Guard Day at the Capitol. To those who are currently serving or have served in the National Guard, our state and nation are sincerely grateful for your selfless service and sacrifice. https://t.co/sIgGLMUyG1"
1234906913382465537,2020-03-03 18:22:06,"Here is a useful overview of what we know regarding #COVID19, courtesy of Doctors Fauci, Lane and Redfield: https://t.co/fWxiIVyRwq"
1234886672640282625,2020-03-03 17:01:40,"On March 3rd, 1845, Florida officially became the 27th state of the United States of America. 175 years later, our state remains a leader in healthcare, low taxes, and endless sunshine. It is a privilege to work for fellow Floridians every day. #Florida175 https://t.co/VaO0B6fSY6"
1234308437338722305,2020-03-02 02:43:58,Tomorrow I will be in Tampa and Miami with Surgeon General Rivkees and other officials to discuss our continued statewide response on #COVID19. https://t.co/sMrWkQlyoi
1233529860108189697,2020-02-28 23:10:11,"Today I had the opportunity to discuss Coronavirus preparedness in Florida with @VP Pence. I requested the Vice President help provide local testing kits, additional medical supplies &amp; federal supplementation for those that may be held in isolation for an extended period of time. https://t.co/rW5fj2t9HT"
1233134131732713472,2020-02-27 20:57:42,"Today I signed HB 1087 removing the Florida Coalition Against Domestic Violence from statute. Floridians deserve greater accountability from their government, especially survivors. I commend Pres. @BillGalvano and Speaker @RepJoseOliva for taking swift action on this legislation. https://t.co/QQ0B40yZDE"
1230947733457887232,2020-02-21 20:09:44,"By pardoning the Groveland Four, the State of Florida recognized the miscarriage of justice that occurred in that case. By unveiling this monument, Lake County is pledging to remember this history and to pledge itself to stand for justice for all of its citizens. https://t.co/qacbWxlbzo"
1230639697703194624,2020-02-20 23:45:42,"I was pleased to award the City of Green Cove Springs in Clay County with $250,000 through the Job Growth Grant Fund today. Details here - https://t.co/d0s9QXNhlw"
1230256715616137216,2020-02-19 22:23:52,"Today, @MyFWC approved a 45-day Gulf Red #Snapper Season from June 11th-25th for Gulf state and federal waters. Gulf red snapper season is an exciting time for anglers and is just another reason why Florida remains the Fishing Capital of the World."
1230240641088708615,2020-02-19 21:20:00,We look forward to the positive impacts this program will have on the lives of our veterans and the communities in which they live. https://t.co/f7XmO6DUWi
1230240639092170752,2020-02-19 21:19:59,I’m excited to share my administration’s newest veteran-focused initiative: the “Salute Our Soldiers” Military Housing Loan Program for veterans and active duty military personnel throughout the state. Details here – https://t.co/rN87dlbDUT https://t.co/e7jNbek5Ya
1230233221339721734,2020-02-19 20:50:31,"Today, it was my pleasure to announce that my administration is awarding the @cityofpensacola $4.8 million through the Florida Job Growth Grant Fund for infrastructure enhancements to @flypensacola. More here – https://t.co/1IPEnMHUlI https://t.co/5VwUnU1p9Y"
1229850807991963649,2020-02-18 19:30:56,"Enjoyed celebrating #GatorDay at the Florida Capitol today with @GatorsFB Head Coach @CoachDanMullen. On top of an excellent football program, @UF is also the 7th ranked public university in the nation. The best is yet to come for the Florida Gators! https://t.co/FQeKKEziaH"
1228424914132226049,2020-02-14 21:04:57,"Thank you to @SecElaineChao for coming to Miami to make this major announcement for our state’s infrastructure. These grants will allow for critical expansion projects that are vital to the economic success of @PortMiami, @PortCanaveral and Florida overall. https://t.co/NgnWlGgPeG"
1228344780775665664,2020-02-14 15:46:31,"Our state and nation continue to mourn the innocent lives that were taken two years ago in a senseless act of violence at @MSDHighSchool. In memory of those lives lost, the Florida State Capitol has been lit all week in the MSD school colors. https://t.co/9eRK8503b3"
1227666893030526977,2020-02-12 18:52:50,This innovative collaboration to provide new FinTech-related training and certifications will help equip Floridians with skills in demand by Northeast Florida’s growing FinTech industry.
1227666891612794885,2020-02-12 18:52:50,I’m pleased to launch the Northeast Florida FinTech Initiative in conjunction with Florida State College at Jacksonville and St. John’s River State College. More info here – https://t.co/uoYudxBVs9
1225901715720896513,2020-02-07 21:58:39,"The tax credit scholarship program provides educational opportunities to more than 100,000 low-income families in Florida. I support these families and am glad to see @FifthThird continue to do so as well. Thanks for empowering parents and students!"
1225444552292622337,2020-02-06 15:42:03,We are closely monitoring a strong cold front moving through North Florida. A tornado watch has already been issued this morning &amp; more watches &amp; warnings are expected throughout the day. Make sure to follow @FLSERT and local media for updates. https://t.co/TxJVPfYGoh
1225186042963210241,2020-02-05 22:34:50,".@FLCaseyDeSantis and I mourn the death of FHP Trooper Joseph Bullock of Troop L - Fort Pierce who was killed today in the line of duty. We are keeping the Bullock family, Troop L and our @FLHSMV family in our prayers. https://t.co/0AKI9WnYmo"
1224748895072346112,2020-02-04 17:37:45,"Today, the Florida Cabinet and I approved two Florida Forever land acquisitions and agreed to acquire a conservation easement that will protect Florida’s fragile natural environments in Manatee, Sarasota and Columbia counties. Info here – https://t.co/tz9SD6Zq3z"
1223310195096543235,2020-01-31 18:20:53,"Under the current circumstances, I believe moving the case under State Attorney King’s jurisdiction provides the best chance for the Montalvo family to receive the justice they deserve."
1223310193707978753,2020-01-31 18:20:52,"After review by my office and consultation with the Montalvo family, today I am issuing an executive reassignment of the Nicole Montalvo murder case to State Attorney Brad King of the Fifth Judicial Circuit. See Executive Order here – https://t.co/NKJAbhGArE"
1222998171422543872,2020-01-30 21:41:00,We have worked tirelessly to get recovery dollars to all areas impacted by Hurricane Irma and will continue to do so as quickly and efficiently as possible. https://t.co/XhLUcoomPe
1222998162228621315,2020-01-30 21:40:58,"Today, @FLDEO awarded more than $84 million to 21 communities impacted by Hurricane Irma through their Rebuild Florida Infrastructure Repair Program, which helps fund infrastructure restoration and improvements. See more here – https://t.co/PnIc4zfv8m https://t.co/OdHQtVrM9D"
1222991194797625347,2020-01-30 21:13:17,"Thank you @FLDEPNews Secretary @NoahValenstein and @MyFWC Executive Director Eric Sutton for your hard work and environmental stewardship. By protecting and restoring Florida’s coral reef, we are protecting a state treasure. See details here – https://t.co/OodpaDGl8N"
1222991193157644297,2020-01-30 21:13:17,"Today, I’m excited to help kickoff 100 Yards of Hope, a project by the veterans of @forceblueteam to plant 100 yards of coral while honoring the @NFL’s 100th season. I’m also proud to announce a new initiative to promote awareness and protection of Florida’s Coral Reef ecosystem. https://t.co/03K9acoDU4"
1222641770342895621,2020-01-29 22:04:48,I’m honored to be named a 2019 Rx Price Fighter by @AARP today on Florida Senior Day. I will continue to work to identify innovative ways to reduce health care costs for Floridians. https://t.co/yQBgR5C2YX
1222633543999873024,2020-01-29 21:32:06,"I was proud to share with them that in January alone, @FLSERT paid out more than $100 million for hurricane recovery and more than $1.5 billion since I took office. Helping communities recover remains a priority for my administration."
1222633541017665539,2020-01-29 21:32:06,.@FLCaseyDeSantis and I enjoyed taking time today to celebrate all the Emergency Management Directors throughout Florida at the first-ever Emergency Management Day at the Capitol. https://t.co/jNwvlcRBqC
1222528356610203648,2020-01-29 14:34:08,"With this new strategy, Florida is the first state in the nation to have a statewide behavioral threat assessment and management program."
1222528355284766721,2020-01-29 14:34:08,"One month after taking office, I asked @fdlepio to develop &amp; implement a threat assessment strategy to help prevent acts of targeted violence in FL – https://t.co/oPC74nRMTO. Today, I’m pleased to announce that FDLE &amp; the statewide steering committee have completed that request. https://t.co/AaCA8Y8GT1"
1222310820534784002,2020-01-29 00:09:43,"Honored to be at the @WhiteHouse with President @realDonaldTrump and @IsraeliPM Netanyahu for today's announcement of a strong, pro-Israel peace plan. https://t.co/7M8tHM0cHq"
1221918364290945024,2020-01-27 22:10:14,"I hope that this initiative will have a strong impact on classrooms and school campuses across our state as we look to build a bolder, brighter, and better education system in Florida."
1221918362181218304,2020-01-27 22:10:14,"Today, I’m pleased to announce my support for the Florida Civics and Debate Initiative with The Marcus Foundation to provide opportunities for Florida students to debate issues related to American civics. Info here – https://t.co/eJCJ1O43ee https://t.co/teTjX8XGq5"
1221824836894412802,2020-01-27 15:58:36,"On International #HolocaustRemembranceDay, we remember and honor the memory of the 6 million Jews whose lives were horrifically taken. Today and every day, we stand in solidarity with our Jewish communities in Florida and around the world."
1220816591333388288,2020-01-24 21:12:11,"I’m proud to share that in December 2019, Florida’s unemployment rate dropped to 3% - the lowest in our history. Florida remains the best state in the nation to find a job and start or grow a business. Details here – https://t.co/mzCvvKGG77"
1220459172803895301,2020-01-23 21:31:56,The crisis in Venezuela is a great concern to many Floridians and impacts the security of the United States. @SecPompeo was kind enough to visit us in Miami and listen to concerns from the Venezuelan exile community. https://t.co/61flYOPepv
1219300239812845568,2020-01-20 16:46:45,Great to visit community leaders and celebrate #MLKDay in Gretna this morning. Thank you to Mayor Jeff McNealy and @GadsdenSheriff Morris Young for having me. https://t.co/3iOlXClkNW
1218245090352816128,2020-01-17 18:53:58,My administration remains committed to supporting Florida’s growing aerospace industry and maintaining an economic climate that allows companies like Made In Space to prosper. See more here – https://t.co/Ge8UZxcVya
1218245088914083840,2020-01-17 18:53:57,"I'm proud to announce that @MadeInSpace has decided to relocate their corporate headquarters from the highly-taxed, highly-regulated state of California, to the business friendly environment of Florida. https://t.co/5y3dbw45ua"
1217924194161319937,2020-01-16 21:38:50,RT @FLCaseyDeSantis: This morning I dropped by to thank our hard-working Agency Chiefs of Staff for their tireless efforts and service to F…
1217899387239772160,2020-01-16 20:00:16,"RT @FLCaseyDeSantis: This morning, I joined @FlChamber to discuss the important role businesses play in Florida’s success. Government is on…"
1217890081643618305,2020-01-16 19:23:17,This study demonstrates that maintaining and protecting military bases and industry in Florida is vital to the economic success of our state.
1217890080637030400,2020-01-16 19:23:17,"The results of @EnterpriseFL’s 2020 Florida Military and Defense Economic Impact Study are in: Florida’s military and defense industry has a $95 billion economic impact, a $10 billion increase from the 2017 study. More info here – https://t.co/paugnf5nSE"
1217877353042452483,2020-01-16 18:32:42,I enjoyed touring @PortTampaBay with the facility’s President and CEO Paul Anderson. Port Tampa Bay is Florida’s largest port and is a pillar of our state’s economy. The future is bright for the Tampa Bay area! https://t.co/UZeJuWHdfd
1217867897906913282,2020-01-16 17:55:08,"I am pleased that @FLCourts confirms that Amendment 4 requires fines, fees &amp; restitution be paid to victims before their voting rights may be restored. Voting is a privilege that should not be taken lightly, and I am obligated to faithfully implement Amendment 4 as it is defined."
1217808387427196931,2020-01-16 13:58:40,"Yesterday, @FLCaseyDeSantis and I were honored to host @NASCAR leadership at the Governor’s Mansion. NASCAR is a part of Florida’s sporting DNA and a major economic engine generating thousands of jobs and injecting more than $1.6 billion annually into our economy. https://t.co/rfHgs8Zn7O"
1217577059758809090,2020-01-15 22:39:27,RT @FLCaseyDeSantis: It was such a privilege to host legislative spouses today at the Governor’s Mansion. As partners of those who serve in…
1217558111550103552,2020-01-15 21:24:09,"Enjoyed speaking at @FlChamber’s #FCCFlyIn20 today to discuss Florida’s low taxes, reasonable regulatory climate and positive disposition toward business. Our state continues to thrive, and our business leaders continue to pave the way for Florida’s success. https://t.co/HWqnbsyTrg"
1217500468571754496,2020-01-15 17:35:06,".@FLCaseyDeSantis and I are keeping Officer Paul Dunn of Lakeland and his family in our prayers today. I have ordered flags to be flown at half-staff to honor his memory. A husband, a father and a veteran—Officer Dunn will always be remembered as a hero. https://t.co/A3BjGiiA9p"
1217489361882755072,2020-01-15 16:50:58,This purchase would be the largest wetland acquisition in a decade and will permanently save the land from oil drilling. See more here – https://t.co/GBgc13ZiEd
1217489360511283203,2020-01-15 16:50:58,"I’m pleased to announce that @FLDEPNews has reached an agreement with Kanter Real Estate that will allow for the purchase of 20,000 acres of critical wetlands in the Everglades. https://t.co/5EofibCFHp"
1217128286918250497,2020-01-14 16:56:11,"In this season of opportunity, we can say there is more out there to achieve for our state – and there is no reason why we can’t seize this moment and deliver for the people of Florida."
1217128285190094848,2020-01-14 16:56:10,"For everything there is a season, and this is Florida’s season of opportunity – we have the chance to build on a strong foundation, the chance to face the challenges before us and the chance to leave a legacy of success that will benefit our people now and in the future."
1217127868955877376,2020-01-14 16:54:31,"The Legislature approved a $25 million Hurricane Michael grant program for assisting with the recovery in NW Florida. 

Michael was a catastrophic storm and while great progress has been made, this is a long-term effort. I ask that you re-up this grant program for another year."
1217127865948479490,2020-01-14 16:54:31,"Hurricane recovery has been a priority for my administration. In January of 2019, I asked @FLSERT to expedite reimbursements to affected areas &amp; the agency has distributed more than $1.4 billion to communities impacted by hurricanes Michael, Irma, Matthew and Hermine. https://t.co/Wcg9Z2OwcY"
1217126812087660545,2020-01-14 16:50:19,This can only be done with federal approval and I’m happy to report that the Trump administration is moving forward with the applicable regulations.
1217126810288377857,2020-01-14 16:50:19,"One major initiative was to provide access to cheaper prescription drugs by bringing in safe, name-brand drugs from foreign markets such as Canada. Same drug, just a much lower price."
1217126434747097088,2020-01-14 16:48:49,"With the Speaker and President leading the way, the 2019 Legislative session witnessed major reforms in the area of health care – from expanding access to telehealth to repealing antiquated regulations."
1217125571261542401,2020-01-14 16:45:23,"Results matter and accountability is needed. But the Common Core framework was clearly flawed.

I can reveal that one key to our replacement of Common Core will be a renewed emphasis on American civics and the US Constitution. https://t.co/vmhyOip3Tj"
1217124810419048448,2020-01-14 16:42:22,"All Florida parents, regardless of income or zip code, should have the ability to choose the best school for their children."
1217124808850386945,2020-01-14 16:42:22,"Last year, we had nearly 13,000 low-income families on the waiting list for a tax credit scholarship. Thanks to the enactment of the new Family Empowerment scholarship, these families have been liberated from the waiting list."
1217123893325987848,2020-01-14 16:38:43,"Our approach to K-12 education rests on (1) recruiting and retaining great teachers, (2) promoting educational choice so parents, particularly low-income parents, can place their child in a good school, and (3) measuring results through accountability. https://t.co/zJqcENmOMM"
1217122690974322689,2020-01-14 16:33:57,"Low taxes and a healthy business climate are important in attracting investment in Florida, but so too is our ability to produce top-flight talent – through our colleges and universities, through workforce education opportunities and through strong K-12 schools."
1217122561303240707,2020-01-14 16:33:26,"We have strong momentum and need to keep it going. We have a chance to take bold action to make a lasting positive impact upon Florida’s environment.  

Let’s seize this opportunity."
1217121740100448256,2020-01-14 16:30:10,"This vision required a commitment from the Legislature, and you delivered – to the tune of more than $625 million for water resources and Everglades projects."
1217121739026718722,2020-01-14 16:30:10,"When I took office, I issued a sweeping executive order outlining a bold approach to protecting our natural resources, improving water quality and restoring the Everglades."
1217121491676016640,2020-01-14 16:29:11,"Florida must remain steadfast in its commitment to low taxes and fiscal responsibility. Maintaining fiscal health will provide the type of durable foundation required for the expansion of our economic base, which means more opportunities for the people of Florida."
1217121246846078976,2020-01-14 16:28:12,"While we should look with favor on these bold beginnings, we have much more to do."
