id,created_at,text
1247280198149496834,2020-04-06 21:49:07,"Today @FEMA, @OregonOEM &amp; @OregonGuard shipped 140 of our ventilators to New York. 

To all in New York, Oregon is keeping you in our hearts. We're all in this together. https://t.co/YgFKOIDanM"
1246825232465137664,2020-04-05 15:41:14,"Arlene Schnitzer’s creative contributions changed Oregon’s cultural landscape, bringing the work of women to the forefront. She will be missed, but her impact is forever woven into the fabric of our state. https://t.co/ITKeORXQfa"
1246458356975276033,2020-04-04 15:23:25,Oregon doesn't have everything we need to fight COVID-19 — we need more PPE and testing — but we can help today with ventilators. We are all in this together.
1246458356312576001,2020-04-04 15:23:24,"New York needs more ventilators, and we are answering their call for help.

We'll be sending 140 ventilators to help NY because Oregon is in a better position right now. We must do all that we can to help those on the front lines of this response."
1246214049622179840,2020-04-03 23:12:37,"Reminder: All Oregon State Parks are closed, and all trails and rec areas are closed on both the OR and WA sides of the Columbia River Gorge National Scenic Area. This weekend, #stayhomesavelives."
1245889585151795202,2020-04-03 01:43:19,The Resource Navigator will help small business owners connect to the financial support and information they need to stay in business through the COVID-19 crisis: https://t.co/uGqazjGRYT
1245889584312905728,2020-04-03 01:43:19,"Today I'm launching a statewide initiative, the Small Business Resource Navigator, to connect Oregon's small businesses with federal, state &amp; local resources. https://t.co/OITjspjhD8"
1245754442219048960,2020-04-02 16:46:18,"COVID-19 is making paying rent difficult for many Oregonians. Yesterday, I strengthened my moratorium on residential evictions. Now, tenants can't be charged late fees for nonpayment. 
https://t.co/GI7zd5jBwd"
1245495568169762817,2020-04-01 23:37:38,"Sending happy birthday wishes to Bill on his 104th birthday! He's one of Oregon's honored veterans and has just recovered from COVID-19. 

You can wish him a happy birthday, and brighten the day of other residents at the Lebanon veterans home. Learn more: https://t.co/NZL2vrrvE9 https://t.co/W3q44FSugr"
1245470881746280448,2020-04-01 21:59:32,"These are difficult times. This order will help Oregon's restaurants and businesses stay in their locations without threat of eviction.
https://t.co/67LnXT6Ko2"
1245397140991397888,2020-04-01 17:06:31,"Today is #CensusDay! Take a few minutes to make sure you are counted at https://t.co/aDpumr2nTX. You can fill out the census by web, phone, or mail. Taking action today will help our communities get essential funding for healthcare, schools, roads, bridges, and more. #2020Census"
1245374626462490624,2020-04-01 15:37:03,"The creativity and dedication of our @ORStateParks rangers means Oregonians can whale watch at Depoe Bay – from home. Thanks for helping us continue to enjoy the magic and beauty of Oregon, while staying safe.
https://t.co/lo7mCjke6Y"
1245128769653731328,2020-03-31 23:20:06,I love how Oregonians get creative and show up for each other in tough times. Coos Bay resident John is (very enthusiastically) reading a book a day to kids on his YouTube channel as he stays at home to save lives: https://t.co/4sb5UCRo4l
1245074957190586369,2020-03-31 19:46:16,"It's the Oregon way to help support each other; proud to see so many come together for our children in foster care &amp; their foster families with groceries, diapers, learning materials, and more through #MyNeighbOR and @ORContingent:
https://t.co/NjzcStarE0"
1245012572576702464,2020-03-31 15:38:23,"Necessity is the mother of invention, and we need innovative solutions more than ever now. Kyle Kirsch of Silverton, OR, donated 40 masks he 3D printed in just one night. Remember that you can donate new PPE here: https://t.co/xGJHYHgYnz"
1245008432429555713,2020-03-31 15:21:56,"In these difficult times, it's nice to appreciate the little things that make us smile – like the first peeps of this newest member of the @OregonZoo.
https://t.co/kf1XmIpVAD"
1244812609024487426,2020-03-31 02:23:48,"One of the things I admire most in Oregonians is that when hard times hit, we always respond with ""How can I help?"" 
My team has compiled 10 great ways you can volunteer, donate, and show up for each other right now. 
https://t.co/l9yZR8waEA"
1244767989510991872,2020-03-30 23:26:30,"Even as the nation faces an unprecedented COVID-19 crisis, the Trump Administration finds a way to roll back auto standards that will increase air pollution by billions of tons. Stunning, but sadly unsurprising.
https://t.co/PrZaNebbqd"
1244762652665991169,2020-03-30 23:05:17,"Important update: Oregon just added 140 ventilators to our state supply to help with our COVID-19 response, via @HHSGov &amp; @fema. 

They will save lives, but we will need more. I'm going to continue to fight for the critical equipment we need to keep Oregonians safe. https://t.co/kgyJJ8m2Db"
1244738476211204096,2020-03-30 21:29:13,"This is a difficult time for anyone who worries about how to care for their loved ones—which means it's difficult for everyone. But modeling shows if people stay home, together we can all flatten the curve. Keep it up, Oregon. #stayhomesavelives https://t.co/fmXtbW4tIU"
1244722000473362432,2020-03-30 20:23:45,"Today, I was proud to (virtually) stand alongside Oregonian workers &amp; hear their stories from the front lines of the coronavirus crisis. You have my commitment: we will continue to fight too, for the protective equipment you need. @SEIU @SenJeffMerkley @RepBonamici https://t.co/sDpHJHKARR"
1244683526789672960,2020-03-30 17:50:52,"In this time of rapid change, we need to make sure everyone has the support they need. If your income has changed and you are pregnant or have a child under 5, you may now qualify for grocery benefits through WIC. Check your eligibility here: https://t.co/yO1TdecabW"
1244639315822403584,2020-03-30 14:55:11,Hardworking Oregonians deserve every chance possible to access the health coverage they need now more than ever. I've asked the federal government to allow us to re-open the enrollment period for https://t.co/c5KgwmIN3T. https://t.co/lkBZV21qNL
1244467069623496710,2020-03-30 03:30:45,More and more businesses are getting creative to meet community needs in this difficult time; Oregon SNAP recipients can now order groceries online @Walmart and @Amazon. https://t.co/mDTtngnhkP
1244453829485056000,2020-03-30 02:38:08,"The coronavirus pandemic is a global and local issue; @Intel, one of Oregon's global companies, is making contributions to relief efforts on both fronts.
https://t.co/cWPmH3Azh1"
1244434277938253825,2020-03-30 01:20:26,"During this unprecedented crisis, I'm thankful to Oregonians who need to keep working for all of us, and for the Oregonians who are staying home to protect them. https://t.co/tCvzls5Ojv"
1244423685651357696,2020-03-30 00:38:21,Oregon is focused on procuring as much PPE as possible for our frontline workers. Donations from groups like @ORdentists truly reflect the Oregon way––coming together in difficult times for the good of Oregonians most in need. https://t.co/6tQXVSEIZm
1244411319891030016,2020-03-29 23:49:13,"This disaster declaration is an important first step toward unlocking all available resources for COVID-19 response, but more federal action is needed. I will continue to fight for access to every tool available to keep Oregonians safe. https://t.co/uIeHUtV3dR"
1244321847207854081,2020-03-29 17:53:41,"The list goes on of hardworking Oregonians on the front line that I'm grateful for: police and firefighters, devoted medical professionals, and those who work in group homes, long-term care facilities &amp; at-home care professionals. We know the hours are long and we appreciate you."
1244058201055563776,2020-03-29 00:26:03,"My top priority is to keep Oregonians safe and healthy as we focus on stopping the spread of COVID-19 –– whether they are living sheltered or unsheltered. 

Read on for further guidance on EO 20-12 as it relates to Oregonians experiencing homelessness.
https://t.co/hF1c4I3KhX"
1244009105406095365,2020-03-28 21:10:57,Sharing an update on Oregon's COVID-19 response efforts. Tune in. https://t.co/Zk4sfNxjo6
1243967173426438144,2020-03-28 18:24:20,"We are facing an unprecedented crisis — and the single most important thing each of us can do to protect our community right now is stay home. 

I want to thank @WiedenKennedy for providing their services to the state during this important time. https://t.co/LpLvxqiq43"
1243703063136763904,2020-03-28 00:54:51,"The CARES act has the potential to help many Oregonians and Oregon businesses suffering due to the COVID-19 pandemic. We will use these funds to help people stay healthy, stay in their homes, keep their businesses and feed their families. https://t.co/81hOjjMgbw"
1243601058997231616,2020-03-27 18:09:32,This is hopeful for our small businesses and workers as we navigate the difficult impacts of COVID-19 on our economy and way of life. I expect President Trump to sign this and get funds out as quickly as possible — Oregonians need it! https://t.co/p3UZUBHdsp
1243560676066381829,2020-03-27 15:29:04,"It's still safe, and allowed, under my #StayHomeSaveLives executive order to donate blood — in fact, I encourage it. Sign up to donate with @RedCrossCasc today: https://t.co/YWTibjAObe"
1243378469284614145,2020-03-27 03:25:02,"When I closed Oregon's schools, I asked all school districts to keep feeding our most vulnerable students. I'm proud of all the creative ways districts across our state are stepping up: https://t.co/IBaVljqMDV"
1243358475662413824,2020-03-27 02:05:35,The last thing we need to do during this crisis is turn out more Oregonians struggling to make ends meet from their homes and onto the streets. I've placed a temporary moratorium on residential evictions — this is both a moral and a public health imperative.
1243314448971923456,2020-03-26 23:10:38,".@ORemployment has doubled the number of employees working on unemployment claims to reduce wait times, and have enacted temporary rules to help more Oregonians affected by COVID-19 business closures. Learn more here: https://t.co/UQBDTf9QxT"
1243304170532114432,2020-03-26 22:29:48,"@ORemployment has doubled the number of employees working on unemployment claims to reduce wait times, and have enacted temporary rules to help more Oregonians affected by COVID-19 business closures. Learn more here: https://t.co/6UheVBJ3Gm"
1243282634219769856,2020-03-26 21:04:13,"We owe a huge debt of gratitude to the Oregonians still hard at work, helping us all: grocery store employees, truck drivers, farmers, ranchers, workers in food processing facilities, port employees unloading shipments, utility operators and many more. 

Thank you, Thank you."
1243275145524871168,2020-03-26 20:34:28,I know how hard it is to telework while also taking care of your children. Thanks to bosses for understanding that parents now NEED to do double duty – they're ensuring that the limited available child care is reserved for people who must work in essential roles outside the home.
1243192206262853632,2020-03-26 15:04:54,"If you ever doubt that your individual actions matter in slowing the spread of COVID-19, check out this graphic by microbiologist @SiouxsieW: https://t.co/w7RXbZu348"
1242995841998061573,2020-03-26 02:04:37,"In Oregon, construction work is allowed to continue IF certain safety guidelines can be followed. Read on for rules and resources for contractors: https://t.co/ih6RZ2g6pH"
1242995840920113152,2020-03-26 02:04:36,I'm hearing that there's some confusion from businesses that aren't sure whether they can remain open. Take this simple three question quiz on our website to find out: https://t.co/Xgqb3oMI5A
1242943639656919041,2020-03-25 22:37:11,"Coronavirus doesn't discriminate and can infect anyone –  any age, any race, any level of health. That's why it's so important to stay home to reduce the spread and #flattenthecurveOR https://t.co/V53jOrxSRy"
1242908140955262976,2020-03-25 20:16:07,"My #StayHomeSaveLives executive order is designed to keep all Oregonians — and workers — safe.

If your employer is staying open and not enforcing 6 feet of social distancing, you can report them to Oregon’s Occupational Safety and Health (OSHA) division: https://t.co/ze2f55xxcN"
1242895709088518144,2020-03-25 19:26:43,I encourage all Oregonians to spread the word about COVID-19 and how we can keep each other safe. We've launched a public awareness campaign to coincide with the #StayHomeSaveLives executive order — help us share these messages. You can find content here: https://t.co/9JMY8rlKRw
1242844662668222464,2020-03-25 16:03:53,Want more info on COVID-19? You can sign up to receive text or email updates about coronavirus from @OHAOregon here ▶️ https://t.co/KoObyw1sxb
1242602765584486401,2020-03-25 00:02:40,"I know this unprecedented pandemic and its effects can trigger stress, anxiety, depression, and feelings of isolation. Here's a few smart tips from @afspnational on how to take care of your mental health as we all face a new way of living with coronavirus. https://t.co/L6yGlp6jys"
1242564848975663105,2020-03-24 21:32:00,"Feeling sick and not sure if you may have COVID-19? 

Follow these instructions if you start feeling symptoms of possible coronavirus. And please remember to stay home. https://t.co/BipKoeKZxj"
1242551210005000192,2020-03-24 20:37:48,"Oregonians are known for our friendly, community-centered lifestyle, so staying home might feel strange or unhelpful. I want to remind you: staying home is the #1 way to serve your community right now."
1242500462630191105,2020-03-24 17:16:09,"#StayHomeSaveLives instructions en #Español. Also available in #Arabic, #Chinese, #Somali, #Russian, #Vietnamese &amp; #Marshallese at https://t.co/VyjhaqtE82 https://t.co/2PC8LMXCA1"
1242156679904411648,2020-03-23 18:30:05,"These social distancing measures are designed to stop the spread of COVID-19 and be more sustainable over time, preserving scarce hospital space and allowing more Oregonians to keep their jobs when their work does not add to the growth of COVID-19 in Oregon."
1242156594407731200,2020-03-23 18:29:44,"I want to make it perfectly clear what's allowed and what's not under my new Executive Order. If you're still not sure about an activity, skip it. Staying home will save lives. https://t.co/Fi8i1oxv4C"
1242155872249204738,2020-03-23 18:26:52,"Today, I am issuing a new statewide order: stay home to the maximum extent possible. Failure to comply with the order will be considered an immediate danger to public health.
https://t.co/NBi2f4Ttox"
1241868154776641536,2020-03-22 23:23:35,"So many of us love to get out into nature to de-stress. But these are not normal circumstances, and our trails and beaches were packed this weekend, making social distancing impossible. I urge you again: stay home. https://t.co/BQXsgSky69"
1241864865263661059,2020-03-22 23:10:31,"I'm also asking mortgage lenders, banks, and credit unions to do all they can to ease burdens on property owners and renters, like waiving fees, extending grace periods, postponing collections actions and foreclosures, and more. https://t.co/pORwutWpic"
1241864228786409472,2020-03-22 23:07:59,Making sure families don't lose their homes during this health crisis is the right thing for Oregon families and for preventing spread of COVID-19. That's why I have ordered protections against residential evictions for the next 90 days. https://t.co/5vLvnf73D1
1241777432513769472,2020-03-22 17:23:05,"But, these actions are necessary to save lives. Please stay at home. It’s a matter of life or death."
1241777431763021825,2020-03-22 17:23:05,"I know this is difficult for everyone. 

It’s not easy for those who can’t visit their loved ones in nursing homes. 
It’s not easy for those trying to balance work at home with their kids out of school. 
It’s not easy for Oregonians with employers that have closed their doors."
1241777431020625926,2020-03-22 17:23:05,That’s why I have put aggressive social distancing orders in place. But it takes each and everyone of you to comply with them to stop the spread of COVID-19.
1241777430253068288,2020-03-22 17:23:05,"I am urging all Oregonians to stay home. We just have to look to Washington, California, and New York to see the storm that is coming. But we still have time to change its course."
1241777429380620288,2020-03-22 17:23:04,"On Friday night, I asked all Oregonians, on the eve of spring break, to stay home and stay healthy. Unfortunately, our trails and beaches were packed this weekend. I want to be absolutely clear, you are endangering all Oregonians when not following social distancing orders."
1241573048458686469,2020-03-22 03:50:56,"What does COVID-19 ""social distancing"" look like?

✅ Stay home unless absolutely necessary
✅ Keep 6 feet away from everyone 
✅ Don’t forget to wash your hands often

Thank you to all the Oregonians responsibly following these measures."
1241566080708907010,2020-03-22 03:23:15,"Spring Break is here. 

Please remember: every action we take has impact in this new reality of living with COVID-19. Social distancing done well, and done early can save lives. I ask you to follow these measures and protect yourself and our neighbors. #StayHomeStaySafe"
1241181729517219840,2020-03-21 01:55:59,Watch live: tonight I'm speaking with Chair of the Board of Commissioners in Multnomah County @dkafoury and Mayor @tedwheeler. https://t.co/jtOHU9KSS6
1241122393902288896,2020-03-20 22:00:12,Healthy people are needed now to donate to help patients counting on lifesaving blood. The Red Cross is of course practicing all sanitizing and social distancing policies to ensure you're safe while donating. Make an appointment today at https://t.co/R12x7U1twf
1241122392971169792,2020-03-20 22:00:12,"The @RedCrossCasc faces a severe blood shortage due to an unprecedented number of blood drive cancellations–73 so far in Oregon, resulting in 2,024 fewer units of blood collected. Since each unit can be used to help 3 people, that will affect at least 6,000 potential recipients.)"
1241112686764519424,2020-03-20 21:21:37,"The U.S. Small Business Administration has approved Oregon for low-interest disaster loans to businesses of all sizes, private non-profits, homeowners, and renters. More info here: https://t.co/KBPnkyFiNJ"
1241112246752653312,2020-03-20 21:19:53,"Social distancing is the best tool to flatten the curve, a crucial way to reduce the strain on our healthcare system and save lives. #FlattentheCurveOR https://t.co/Xgtem08tIG"
1240741567486283776,2020-03-19 20:46:56,"Social distancing, whether indoors or out, is the best tool we have to slow the spread of COVID-19. https://t.co/U467ul0txs"
1240691834210279424,2020-03-19 17:29:18,"If you or your business have stores of gloves, masks, or gowns, please consider donating your surplus items to the state cache for COVID-19 preparedness. You can mail them in or drop them off. Learn how here: https://t.co/xGJHYHgYnz"
1240688142002212865,2020-03-19 17:14:38,"This virus has nothing to do with nationality, race, or ethnicity—it is a global problem. Xenophobia, hate crimes, and perpetuating stigma against Asian-Americans is appalling. This is a time to look out for our neighbors, and to unite against COVID-19."
1240673592443977728,2020-03-19 16:16:49,"The business closures from COVID-19 are unprecedented–so we're enacting new unemployment insurance provisions to cover more affected workers. Learn more here:
https://t.co/7o8nC4nG1p"
1240670268512600064,2020-03-19 16:03:37,It is critical that we preserve personal protective equipment in Oregon so that our health care workers can keep themselves safe while treating COVID-19 patients https://t.co/ryVk5JeCJE
1240476851778105344,2020-03-19 03:15:03,"I know our students have worked hard this school year, and we’re doing everything we can to help them safely finish their learning. 

But we’re also learning more about COVID-19 every day, and social distancing is key to keeping Oregonians safe. https://t.co/rHt6VSsDUn"
1240434692832157696,2020-03-19 00:27:31,"Thank you @newseasons @safeway @albertsons for stepping up to care for the most vulnerable in our communities. Oregonians always rise to the challenge in times of crisis, and I'm proud we are coming together to help each other out.
https://t.co/uvkuTXOgOx"
1240394380084523008,2020-03-18 21:47:20,"Take a look inside the COVID-19 Response Team’s operations center to see how they’re working tirelessly keep Oregonians healthy and safe.
https://t.co/aGesvTeXBn"
1240332866350809088,2020-03-18 17:42:54,"Extending the closure of Oregon’s K-12 schools through April 28 keeps critical social distancing measures in place for students, parents, and teachers, slowing the spread of coronavirus and reducing the demands on our healthcare system. https://t.co/lgCAx8lA3x"
1240031723468935168,2020-03-17 21:46:16,"My team and I have compiled a new website for Oregonians with information and resources about coronavirus. Learn more about it here:
https://t.co/WZ7MYU8NkL"
1240009480407932928,2020-03-17 20:17:53,"RT @OregonDHS: 155,000 Oregonians work in restaurants and bars. Thousands of others work in stores and businesses that are temporarily clos…"
1239696516698091520,2020-03-16 23:34:16,Read more about the steps we’re taking here: https://t.co/1Iw5T3UjtW
1239678842618298369,2020-03-16 22:24:02,"We all know that as a community, we hold each other together in times of need. Working together, we are stronger together. Even if it’s in ways we never thought possible. Thank you. [6/6]"
1239678841016074240,2020-03-16 22:24:02,"I am also urging all other businesses to evaluate your practices to accommodate social distancing measures. As a biz owner, can your business can do the equivalent of restaurant take-out? If you cannot, I strongly urge you to close your doors to customers temporarily. [5/6]"
1239678839371911168,2020-03-16 22:24:02,"Restaurants, bars, and other establishments that offer food or beverages for sale are restricted to carry-out and delivery only, with no on-site consumption permitted. (Food service at hospitals, workplaces and other essential facilities will continue.) [4/6]"
1239678837979373569,2020-03-16 22:24:01,"Statewide cancelation of all events and gatherings larger than 25 people—exempting essential locations like workplaces, grocery stores, pharmacies, and retail stores. I urge Oregonians to avoid any gatherings of 10 people or more. [3/6]"
1239678836846907397,2020-03-16 22:24:01,Effective March 17 for at least 4 weeks: [2/6]
1239678835529900032,2020-03-16 22:24:01,"I am putting in place new social distancing measures for Oregon. My goals are to decrease the rate of coronavirus transmission in Oregon, preserve hospital capacity for those who need it most, &amp; decrease economic impacts on Oregonians. [THREAD, 1/6]"
1239665478907224064,2020-03-16 21:30:56,"In a global pandemic, days are like weeks, and every hour counts. Tune in to hear the actions we’re taking today to save lives.
 
https://t.co/PVGqXxLD0a"
1239287114799255552,2020-03-15 20:27:27,"While Oregon’s K-12 schools are closed, I've asked each district to with continue nutrition services. It’s wonderful to see our schools step up and take care of students in need by providing grab &amp; go meals.
https://t.co/xi1M0lCpgu"
1239031565725782016,2020-03-15 03:32:00,"Although we knew this day would come, it does not make it any easier to learn of the first Oregonian to pass away from COVID-19. He was an honored veteran who served his country to protect the freedoms we all hold dear. Our thoughts are with his family and friends."
1238861875535736832,2020-03-14 16:17:42,"A sweet story and great advice from a kind Oregonian, @rebecca_mehra: ""Offer to help anyone you can. Not everyone has people to turn to.”
https://t.co/GXRDoNXqVr"
1238628037198897152,2020-03-14 00:48:31,America faces critical blood shortages during this public health crisis. Help hospitalized Oregonians by donating blood; go to https://t.co/LnZwIrI9cA or call 1-800-REDCROSS (@redcross is following social distancing &amp; sanitizing rules to prevent exposing donors to coronavirus)
1238623656537808896,2020-03-14 00:31:06,"With Oregonians working and learning remotely, internet access is more important than ever. During these unprecedented times, I'm thankful to @comcast and @GetSpectrum for offering free internet service to students and low-income families.
https://t.co/J2DYFeUPOl"
1238607715120775168,2020-03-13 23:27:46,Oregon has been increasing our support for families for exactly times like these. Don’t forget these resources that are available to you: https://t.co/yoMhQ1xs76 https://t.co/pl2jF8wj64
1238539605265149954,2020-03-13 18:57:07,STARTING AT 12:00PM. Thank you for your patience. https://t.co/jCUCNaFA3S
1238536212584869888,2020-03-13 18:43:38,"@BenBotkin1 @HollyDillemuth If you could kindly stay on, we are working through technical difficulties and will share more info as soon as possible."
1238536091390472194,2020-03-13 18:43:09,"@DickHughes If you could kindly stay on, we are working through technical difficulties and will share more info as soon as possible."
1238535314496352257,2020-03-13 18:40:04,"@DickHughes Hi @DickHughes - we will be sending revised press availability details shortly via email, as well as posting here on Twitter. Please standby and thank you for your patience."
