id,created_at,text
1238529406538141696,2020-03-13 18:16:35,"For all trying to access today's teleconference, we believe there is a network overload. Please standby. We will let you know how to access this conference momentarily. https://t.co/qu5Wr0IwqU"
1238528141351518208,2020-03-13 18:11:34,"HAPPENING NOW, INFO for the press teleconference on school closure: 

Toll-Free: 877-226-8143
 Access Code: 7032200"
1238342218932346881,2020-03-13 05:52:46,This is a trying time for our community and I am reluctant to increase the burden on families who are already struggling during this crisis. I want to thank all of the teachers and school employees who have worked hard to keep our schools open until now. https://t.co/7l4l5BwDDY
1238246966225711107,2020-03-12 23:34:16,"In this unprecedented time, I appreciate businesses caring for our community in different ways. @portlandgeneral @PacificPower_OR &amp; @nwnatural are suspending late fees and disconnections during the coronavirus emergency, ensuring Oregonians have one less thing to worry about."
1238236926408187904,2020-03-12 22:54:23,"The 2020 Census starts today! Counting each and every Oregonian matters more than ever: $19 billion in federal funds &amp; a 6th Congressional seat are at stake. Fill it out online, by phone or by mail. Oregon is *counting* on you!
https://t.co/0lrmpLpa82"
1238176613671424003,2020-03-12 18:54:43,"We are now in an unprecedented public health crisis, a rapidly-evolving global pandemic. What is clear is that we must take immediate action to stem the spread of the COVID-19 coronavirus, and act now to protect those who are most vulnerable. https://t.co/SlU00gpox3"
1238129319982948352,2020-03-12 15:46:47,"I will be discussing these new steps to stem the spread of coronavirus in Oregon this morning at 9am — joined by @OHAOregon, @dkafoury, @tedwheeler, Tri-County health officials, and other state and local officials. 

LIVE STREAM: https://t.co/V42npMPJaY https://t.co/jFtVD7gQhD"
1238126955045634049,2020-03-12 15:37:24,"I have announced urgent new rules to slow the spread of COVID-19 coronavirus in Oregon — measures based on the recommendations of @CDCgov, Oregon public health experts, epidemiologists, and health professionals. https://t.co/sFONSG56wy"
1237833935947628544,2020-03-11 20:13:02,"I’m proud to be leading the charge of states taking action on climate change. This is crucial and urgent to protect the Oregon we know and love for generations to come.
https://t.co/8HbXlzMEBR"
1237828479741128704,2020-03-11 19:51:21,"Young people around the state have made it clear they need today’s leaders to take bold, decisive action now – before our planet runs out of time. My executive order directs state agencies to take every step possible to reduce greenhouse gas emissions.
https://t.co/O9Q7U6ul1S"
1237824855426228224,2020-03-11 19:36:57,RT @nature_oregon: We applaud @OregonGovBrown for taking bold executive action on climate. This is a great step forward to reducing greenho…
1237824737947963393,2020-03-11 19:36:29,RT @tedwheeler: I commend @OregonGovBrown for her leadership in moving forward with an executive order directing state agencies to take act…
1237507678739415040,2020-03-10 22:36:37,"Thanks, @CJMcCollum, for the assist. It's a team effort to guard against the coronavirus. https://t.co/hfOjharfSQ"
1237465027491147777,2020-03-10 19:47:08,"Charlie, a sophomore at Cleveland High, has been coming to the Capitol since 6th grade to testify for climate action. That’s 5 sessions of waiting for adults to do something. I’m proud that today, with Charlie &amp; other students, we put an end to that count.
https://t.co/m31CeEf78L"
1237443700382257152,2020-03-10 18:22:23,"It's time we put Oregon on a path our children can be proud of. Today I issued an executive order setting new science-based climate goals, and directing state agencies to take urgent action to lower greenhouse gas emissions and address climate change. https://t.co/AnDSpsHeaN"
1237430206316437504,2020-03-10 17:28:46,"Climate change is the issue of our time. I’m about to make a big announcement on climate action, watch live here: https://t.co/1JFYzvTjAH"
1237430112250822657,2020-03-10 17:28:23,"I couldn’t agree more. Go Women’s Ducks! 🏀 “I’d challenge anyone to watch Ionescu and these Ducks and not wonder if we’re watching the greatest team to ever suit up on behalf of our state.”
https://t.co/Ivaxt4l3mL"
1236738172056244224,2020-03-08 19:38:52,"I have declared a state of emergency, in consultation with @OHAOregon, to ensure that we are able to swiftly and fully deploy the personnel and resources necessary to address coronavirus in Oregon. https://t.co/tS37psLkIH"
1236378840521273344,2020-03-07 19:51:01,"This weekend is the 55th anniversary of the Bloody Sunday marches in Selma, where civil rights organizers fought for the right to vote. It's a reminder of how precious that right to vote is and the work still ahead to ensure every eligible voter has access to the ballot."
1236340652163514368,2020-03-07 17:19:16,RT @OHAOregon: State and local health officials are moving quickly to contact people who may have been in close contact with the individual…
1236340640159387649,2020-03-07 17:19:13,"RT @OHAOregon: Today we’re announcing 4 new presumptive case of #COVID19 in among residents in Jackson, Klamath and Washington counties. #O…"
1236124683193307137,2020-03-07 03:01:05,"Thanks to infectious disease professor at @OHSUDoernbecher &amp; @OHSUNews Dr. Dawn Nolt for sharing the 3 simple hand washing tricks we need to be doing to protect ourselves and our families from COVID-19 coronavirus.
https://t.co/286WS2BLdp"
1236086938395762689,2020-03-07 00:31:06,"I also applaud self-insured Oregon companies that are waiving cost-sharing for their employees for COVID-19 testing, including A-Dec and Daimler, and hope more will follow as a way to keep employees healthy and safe."
1236086937682718720,2020-03-07 00:31:05,COVID-19 testing won’t have any out-of-pocket costs for people covered by the Oregon Health Plan.
1236086936759988224,2020-03-07 00:31:05,"Insurers who have agreed to waive COVID-19 costs in-network include: Aetna, BridgeSpan Health Company, Health Net Health Plan of Oregon, Kaiser Permanente, Moda, OEBB, PacificSource, PEBB, Providence, Regence Blue Cross Blue Shield, and Samaritan."
1236086935728164864,2020-03-07 00:31:05,"Fearing  medical bills shouldn’t prevent anyone who needs a COVID-19 test from getting it. I’m proud to partner with the following Oregon health insurers to announce that there won’t be charges to patients for COVID-19 tests if you go in-network: (THREAD)

https://t.co/K2enHHS67H"
1235658313066414080,2020-03-05 20:07:53,"When it comes to protecting the health and safety of Oregonians, you put aside your differences and stand united. I spoke with VP @Mike_Pence about how we can work together to get Oregon the critical supplies and funding we need.
 
https://t.co/fP4ArEUbp0"
1235643654888239104,2020-03-05 19:09:39,"Thanks to @calimapnerd and the  @RedCrossCasc team for providing medical treatment, housing &amp; supplies to folks who lost everything in Pendleton. I declared March Red Cross Month to honor their amazing work year-round in Oregon for disaster preparedness, relief, and recovery. https://t.co/PqAM8TWmbT"
1235418719582470145,2020-03-05 04:15:50,"I know Oregonians have questions about Coronavirus, and my goal is to get you information as quickly as possible. Today I sat down with @OHAOregon Director Pat Allen and epidemiologist Dr. Dean Sidelinger for a Q&amp;A. https://t.co/HSsURMIMkS"
1235325659645431816,2020-03-04 22:06:03,"At a time when the fundamental right to access reproductive health care is being challenged in states across the nation, I hope the SCOTUS will uphold precedent and protect women's right to choose. https://t.co/OuvOcNJtfP"
1235279910836428801,2020-03-04 19:04:15,"No eligible voter should have to wait in line for 7 hours to exercise their right to vote. Here in Oregon, we continue to lead the way with vote by mail and automatic voter registration. It should be easy, and without barriers, for eligible voters to make their voices heard. https://t.co/fG3HevhAuX"
1235078467722436608,2020-03-04 05:43:48,"RT @OHAOregon: Join us tomorrow, March 4 at 12:15-12:45 p.m. for a novel coronavirus (COVID-19) Facebook live event with Governor Kate Brow…"
1235054620306575360,2020-03-04 04:09:02,"From jumping slugs to hissing owls to very adorable Humbolt martens, Oregon is home to many weird, wonderful creatures. For #WorldWildlifeDay, learn more about our native animals and how we can keep them safe for years to come.

https://t.co/fxVgLJ2owQ"
1235004816176234496,2020-03-04 00:51:08,"An update on the coronavirus situation in Oregon.

https://t.co/ltxSTEUC0u"
1234948407761895425,2020-03-03 21:06:59,The whole country is watching the national public health response to the coronavirus. I sat down with @npratc (hosted by Oregon native @arishapiro) to share what we know so far and the key steps we’re taking here at home to keep Oregonians safe &amp; healthy. https://t.co/JD6U5tgFUm
1234651838894329856,2020-03-03 01:28:31,"I'll be sharing updates regularly about the COVID-19 Coronavirus in Oregon to get information to you as quickly as possible. You can watch my first one now.

https://t.co/coESOIMXrb"
1234340363671752705,2020-03-02 04:50:50,RT @ORDeptEd: We are committed to providing up-to-date information on coronavirus and its impact on schools in Oregon. Please review the CO…
1234333662826524673,2020-03-02 04:24:12,"Oregonians have a history of bringing out the best in each other in uncertain times. The same simple things that protect us during cold &amp; flu season –– washing hands, properly covering coughs &amp; sneezes, staying home if feeling sick –– can help keep ourselves and loved ones safe."
1234333661773742081,2020-03-02 04:24:12,"State and local health professionals are working around the clock to identify, treat, and contain each case of this disease. My commitment to Oregonians is that our state agencies will be as accurate, transparent, and swift as possible in conveying the info we have to the public."
1234333660863614976,2020-03-02 04:24:12,"My thoughts are with the Oregonians who have contracted this virus, as well as their families. The developments of the last 48 hours in Oregon and across the globe are concerning, and we are taking this extremely seriously. https://t.co/frd7CratS1"
1234236359260299264,2020-03-01 21:57:33,"I want all Oregonians to know that we are taking the coronavirus situation very seriously, and that our state agencies will share new developments as quickly as possible. To learn more about COVID-19, follow @OHAOregon and check out their website: https://t.co/sDFEt32Zbv."
1233608680517451776,2020-02-29 04:23:23,"I understand this news is concerning, and I want Oregonians to know we are taking this very seriously.  

Our health officials are professionally trained to handle this situation and are responding quickly. https://t.co/fle4XEkno3"
1233517479256903681,2020-02-28 22:20:59,"Let’s be clear: we can’t pass budgets when Republicans are not in the building. Beginning of story, middle of story, end of story. https://t.co/ujg9HEYzJJ"
1233461167214825472,2020-02-28 18:37:13,"I've convened the Coronavirus Response Team to ensure we are taking every precaution necessary, in coordination with local health authorities, hospitals, community health partners &amp; school districts — and to make sure that Oregonians know how they can keep their families safe."
1233461166179078144,2020-02-28 18:37:13,"There are zero confirmed cases of coronavirus in Oregon and the risk to Oregonians of contracting it remains low. However, in an escalating global health crisis, we must make sure we are as ready and informed as we can be. https://t.co/CtzzYQTYK2"
1233260702762029056,2020-02-28 05:20:39,"These talented students stopped by the State Capitol today — the robotics team from Bend's Summit High School. Their team is called Chaos Theory, because they believe in the 'butterfly effect' (that little changes scale up and can matter more than we ever know.) https://t.co/bAQhtLZh4O"
1233142016076156929,2020-02-27 21:29:01,"When the Republicans walk away from their jobs, deny quorum and shut down government, it puts critical state funding in jeopardy — for wildfires, for foster care, for Pendleton flooding recovery... https://t.co/f93b18tofO"
1232888554637819905,2020-02-27 04:41:52,"I have been clear since the flooding happened that I am dedicated to making sure the people of the Umatilla Basin receive recovery support from the state. That commitment doesn't change with Republican lawmakers' decision to walk away from their jobs.
https://t.co/UlPSOTKoK7"
1232815893530345472,2020-02-26 23:53:08,"We will keep fighting the Trump Administration’s attempts to deprive Oregon women access to the family planning, reproductive, and preventative health care services they need to make critical decisions about their own health.
 https://t.co/2Y1aviDiOp"
1232763082830532608,2020-02-26 20:23:17,"I'm in our State Capitol, ready to work — ready and waiting for the Republicans to show up and do their jobs. #orpol #orleg https://t.co/0Z54y6S72i"
1232537524670623744,2020-02-26 05:26:59,"I’m disappointed that Republicans in both the House and Senate have walked off the job. 

Good lawmaking comes from consensus and compromise.  If you don’t like a bill, then show up and work to make it better.  Or show up and cast your vote against it. 
https://t.co/sHuZ3NgbIc"
1232161789602754560,2020-02-25 04:33:57,"I am disappointed that the Republicans have chosen to shut down government. We were elected by the voters to represent our communities and be their voices in our Capitol. It's clear the Republicans who walked out are not against climate policy, but against the democratic process."
1231798149737377792,2020-02-24 04:28:59,"Assemble a welcome basket. Renovate a DHS office. Babysit so foster parents can catch a movie. Show up... 

Every Child believes the child-welfare system is only as strong as the community that comes alongside it. They are doing incredible work. https://t.co/q5Oe8Kywxv"
1231613410422312961,2020-02-23 16:14:53,"I am committed to making sure that Oregonians impacted by the flooding have what they need to stay in place, reopen their businesses and rebuild their lives. This $11.65 million proposal includes relief for businesses, homeowners and for levee repairs.  https://t.co/DCWTUPwUNC"
1230963681602588672,2020-02-21 21:13:06,"Happy 80th birthday to voting rights champion, @RepJohnLewis. Thank you for leading the way, and inspiring us all to have the courage to stand up against injustice. #GoodTrouble"
1230715791110131712,2020-02-21 04:48:04,"Much of our health is determined by how and where we live, work and play. So it's no surprise that doctors are connecting the dots between climate change and its impacts on public health — calling it ""the biggest public health crisis we’ve ever faced."" https://t.co/lP1Cey9jAW"
1230276387451228161,2020-02-19 23:42:02,"On the heels of today's voter access victory in FL, I got together with my friend @SenJeffMerkley to chat about how we can continue expanding voting access in our great state.
https://t.co/OM0wsrXn5e"
1230194352476942336,2020-02-19 18:16:04,A momentous victory today for voting rights in Florida. https://t.co/mlGB0WcdHR
1229860518849986560,2020-02-18 20:09:32,"This morning, I hosted the American Foundation for Suicide Prevention's Advocacy Day to hear survivor and advocate stories firsthand. Today and every day, please remember that you matter. If you’re struggling, reach out anytime for help at 800-273-TALK or text “273TALK” to 839863 https://t.co/c6aZ7JsxzN"
1229515071467900928,2020-02-17 21:16:50,"On this #PresidentsDay, I’m thinking of Jimmy Carter, our oldest living U.S. president. A Nobel Peace Prize recipient, he continues to inspire me through his 30+ years working with Habitat for Humanity and his continued dedication to “waging peace” around the world. https://t.co/tE8qNXqIlH"
1229439710390444032,2020-02-17 16:17:23,"A quick update on the 2020 Legislative Session: 
https://t.co/DctPItOJJz"
1229118095437877249,2020-02-16 18:59:24,"Life has been completely turned upside down for Oregonians affected by the floods. Damage has impacted infrastructure, housing... I'm confident we can get these communities the resources they need, but it's so important we work together on solutions. https://t.co/gH8gsKzuXN"
1228902332038955009,2020-02-16 04:42:02,"I'm committed to helping change the future trajectory of wildfire in Oregon — thank you @forestservice for joining us in that commitment. And thank you, Chief Christiansen, for the federal partnership around forest management in our state. https://t.co/91KmFmsOKL"
1228795649920925697,2020-02-15 21:38:07,"I was able to see the flooded areas of Eastern Oregon firsthand, and the damage is extensive. Please keep these Oregonians in your thoughts as we all work together on recovery efforts. https://t.co/IK3rcjKbuq"
1228466621863170049,2020-02-14 23:50:41,"Today I surveyed the devastating flood damage in Pendleton. I'm proud of how Oregonians are coming together to help: @TeamRubicon doing veteran-led disaster response, Tracy Curtis of @WellsFargo donating $100k in aid, and the heroic @OregonGuard for rescuing 54 people. https://t.co/q4iddrcO4q"
1228417645860409344,2020-02-14 20:36:04,It’s no wonder Oregon’s birthday (161 years old today!) falls on Valentine’s Day; it’s easy to fall in love with this amazing place. 💕 https://t.co/5Lm8IyKWL9
1228000472004382720,2020-02-13 16:58:22,"Black history is Oregon history. This is a great 30-minute @OPB documentary about the contributions of Oregon’s Black pioneers from the mid-1800s. #BlackHistoryMonth

https://t.co/TGvJZeKiRK"
1227712572524290054,2020-02-12 21:54:21,"Protecting the rights of LGBTQ+ children takes us one step closer to a more inclusive and welcoming Oregon.

https://t.co/yrLKsPkmoS"
1227462893379235840,2020-02-12 05:22:13,"Antarctica is one of the fastest warming places on Earth, and many of its glaciers are melting due to global warming. 
Stop and think: when temps in one of the coldest places are nearly the same as those in Southern California, doesn't that mean something?
https://t.co/4q5tZTNmb0"
1227393497243639808,2020-02-12 00:46:28,"I've met so many bright, young #WomenInScience here in Oregon — students who are passionate about learning engineering, math, robotics, coding... they tell me ""science is cool."" I agree! And I'm so happy that hands-on learning and #STEAM classes inspire them."
1227085519030382594,2020-02-11 04:22:40,"We all know that if we work together, we can make Oregon a better place for everyone. And that’s exactly what happened here. https://t.co/lrKVsn9Pie"
1227000486529646592,2020-02-10 22:44:47,"This pact proves that when we work together with a willingness to compromise, we can create a better future in Oregon. Oregonians want healthy forests &amp; fish, a vibrant forest sector and prosperous rural communities. These are not mutually exclusive goals. https://t.co/q4ngYmERZW"
1226276909387935744,2020-02-08 22:49:32,"Thank you, @OregonGuard — and all the first responders, state agencies, and volunteers working around the clock to help Oregonians in need right now. https://t.co/titICPbXrS"
1225923443255758848,2020-02-07 23:25:00,"This emergency declaration ensures state resources, emergency response personnel, and equipment can be activated to complement critical local resources. @OregonOEM will continue to provide regular updates."
1225923441800306688,2020-02-07 23:24:59,I am grateful for all of our first responders for their efforts to keep everyone safe since the waters began rising.
1225923440172920833,2020-02-07 23:24:59,"I have declared a state of emergency in Umatilla, Union, and Wallowa Counties due to severe flooding. From the early hours of this situation, @OregonDOT, @ORStatePolice, @OregonGuard and @OregonOEM have been collaborating with local officials to keep people safe."
1225923438952337408,2020-02-07 23:24:59,Please join me in keeping the families of the Confederated Tribes of the Umatilla Indian Reservation and all those displaced by flooding in Eastern Oregon in your thoughts today.
1225630898223083522,2020-02-07 04:02:31,Thrilled to celebrate our wonderful @trailblazers! #RipCity https://t.co/R9T7ZzIwFw
1225272724081168389,2020-02-06 04:19:16,"150 years since the 15th amendment, yet states like Texas &amp; Florida are still making it difficult for people of color to access the ballot box through voter suppression tactics. We must keep fighting to ensure every single eligible voter's voice is heard. https://t.co/ddOHcHHlaD"
1225218850209189889,2020-02-06 00:45:12,"These health care leaders' policy recommendations include meeting and strengthening Oregon’s greenhouse gas emissions reduction goals.

In their words: climate change is the “greatest public health challenge of the 21st century."" https://t.co/gba5SNHJDR"
1225201060639207425,2020-02-05 23:34:30,"For our communities to continue to thrive, Oregon must be resilient and ready to recover from natural disasters, including an eventual Cascadia event — also known as ‘The Big One.’ We must be prepared and we have to prioritize action as a state. https://t.co/1Xojip7TaW"
1224922177897582592,2020-02-05 05:06:19,"The President brought up the marchers of Selma and Martin Luther King Jr. tonight — people who put everything on the line to fight for voter access. We must honor their legacy by restoring the right to vote in this country. 

Let's pass HR1 and protect voting rights.

#SOTU"
1224909773830668288,2020-02-05 04:17:02,"If the President really wants to help Americans with pre-existing conditions, he could stop backing lawsuits that states like Oregon are fighting that could cost 130 million Americans (including 1.6 million Oregonians) their health coverage. #SOTU"
1224814664032243712,2020-02-04 21:59:06,"Oregon is one of the most modern, secure and efficient voting systems in the country. We've made safeguarding the sanctity of our elections a priority. Vote-by-mail is one tool we use to ensure every eligible voter has access to the ballot box — it works. https://t.co/sLqdCU61gZ"
1224547328419172352,2020-02-04 04:16:48,"To Kira: I hear you, and I promise you that I too am concerned about your future if we don't take meaningful action on climate change now. 

Oregon may be small, but I know we can make a huge impact on this crisis by taking urgent action. https://t.co/vT6c9F2EhW"
1224466995652878336,2020-02-03 22:57:35,"Almost every fire season since I became Governor has been a historic fire season. Today I called on the legislature to fund wildfire readiness, response, and recovery — we have a real chance to make a difference ahead of the 2020 fire season, and doing nothing is not an option. https://t.co/t0EuKGFrVm"
1224105454093029376,2020-02-02 23:00:57,"Legislative session kicks off tomorrow, and I believe it's critically important that we come together for Oregon's future. 

Our children have made it very clear: we can't wait to take action on climate change. https://t.co/Hwu2MIMEFd"
1223711993443405824,2020-02-01 20:57:29,"This travel ban goes against American values, and does not represent what our country stands for. In Oregon, immigrants strengthen the very fabric of our communities — and will always be welcome. https://t.co/22nJE0J2Ry"
1223460428551901185,2020-02-01 04:17:51,"Climate change is the most pressing issue of our time. In Oregon, we already feel the impacts from voracious wildfires to the diminishing shellfish populations due to ocean acidification — and it’s only going to get more challenging. We must act now. https://t.co/HZssKCsLEy"
1223364137155055616,2020-01-31 21:55:13,"While the FDA falls short regulating vape products, our youth are getting hooked in alarming numbers. Oregon's vaping work group will look for ways to keep our kids healthy and safe. https://t.co/dux4ao0UM1"
1223294100813729797,2020-01-31 17:16:55,"When it comes to earthquakes, a matter of seconds can mean the difference between Oregonians reaching safety or facing tragedy. ShakeAlert provides that crucial early warning — and is part of my proposed $12.7 investment to make Oregon more resilient. https://t.co/HYlR4FM4Ow"
1223118799630553089,2020-01-31 05:40:20,"From more dollars for our schools and hospitals to ensuring our roads are safe and well kept, the census has a significant impact in the everyday lives of all Oregonians.

Mailings from the Census Bureau will begin arriving in March. Mark your calendar! https://t.co/FXSYPFfW9i"
1223026418705022976,2020-01-30 23:33:15,"Our oceans absorbs as much as 25% of human-made carbon dioxide.

And now those greenhouse gas emissions are causing ocean acidification, threatening Oregon’s most commercially valuable shellfish: the Dungeness crab.
https://t.co/aFVkhI4dFH"
1222940430783803392,2020-01-30 17:51:34,"In Oregon, we’re working hard to contain the growth of health care costs. Taking health coverage away from our friends, our neighbors, and the Oregonians who need it most is not the solution.
https://t.co/jENSKSSs5y"
1222615261850693633,2020-01-29 20:19:28,"If a major Cascadia earthquake were to strike again, we anticipate that Oregonians would be without essential services for weeks — and possibly months. 

We absolutely must be prepared. https://t.co/Bx3TPuHQBX"
