id,created_at,text
1222362576069087234,2020-01-29 03:35:23,"Our democracy's strength relies on representation, and the 2020 Census is integral to making sure that Oregonians receive their fair share of federal resources and congressional representation over the next decade. https://t.co/6kSBydV0gp"
1222289128185708544,2020-01-28 22:43:31,"The effects of global warming are being felt across the globe — and definitely right here at home. 

Climate change is the issue of our time. We need to tackle it now, and preserve a future for our children, and for the generations to come.
https://t.co/t6Hct9rKPZ"
1222216325189128192,2020-01-28 17:54:14,"We can craft climate policy that protects our environment and grows our economy. Capping and pricing carbon pollution provides a way for Oregon to meet our climate goals and create new, good-paying jobs all over the state. 
https://t.co/7EZlPaF5ju"
1222004506017202178,2020-01-28 03:52:32,"Thank you, for all that you do for Oregon. https://t.co/A0xAXga7Ns"
1221878148943335424,2020-01-27 19:30:26,"This rule is wrong, and we will not stand for intolerance in America. It was designed by the Trump administration to intimidate working immigrants who live here lawfully, simply for trying to provide for their children. https://t.co/YOv87EfL8U"
1221557338630262785,2020-01-26 22:15:39,"Thanks to the persistence of our students and their families, and an ongoing commitment of our educators to expand opportunities, Oregon has reached a new milestone: for the first time, 8 of 10 Oregon students graduated high school in four years. https://t.co/ohfqEYaxOW"
1221489225654132737,2020-01-26 17:45:00,"When the next large-scale Cascadia earthquake strikes the PNW, Oregon will face the greatest challenge of our lifetimes. Today marks the anniversary of the last Cascadia earth quake — a good reminder for us all to think about how we can best be prepared. https://t.co/A1awvc99bV"
1220848283062456320,2020-01-24 23:18:07,"""Participation in this process is an opportunity to participate in democracy the way it is supposed to be,"" says Esperanza Tervalon-Garrett. 

She's leading the We Count Oregon team, working to ensure a full and accurate 2020 Census count in Oregon. https://t.co/dqQt8se19z"
1220762411742793730,2020-01-24 17:36:54,"We must do something meaningful, and soon, about climate change — this is the issue of our time. https://t.co/7vYLtsZjp1"
1220576421564669952,2020-01-24 05:17:50,"Salem-Keizer School District administrators credit Dwight Roberson with bumping the district's graduation rate for black students to the highest it’s been in at least a decade. 

He's an incredible role model, working so hard to help our students succeed.
https://t.co/jeShVDhwva"
1220504753098018817,2020-01-24 00:33:03,"Spent the day in Bend previewing my priorities for the upcoming legislative session, including addressing climate change and wildfire response. This is so important — left unchecked, climate change will have devastating effects on all that we hold dear.
https://t.co/MIBkO7g7Cf"
1220418309298040832,2020-01-23 18:49:33,Every student in Oregon deserves to graduate prepared for lifelong success and with a plan for their future. The historic reinvestment in education made possible by the Student Success Act will further empower our schools to reach new levels of learning. https://t.co/2RCxUUEPpo
1220409923693154306,2020-01-23 18:16:14,"RT @ORDeptED_Colt: Students, educators, and families worked hard to achieve these graduation rates. A consistent focus on equity in educati…"
1220109668548132865,2020-01-22 22:23:08,"Building a welcoming environment at school by creating sports teams made up of students with disabilities and without disabilities playing together. Great work happening at South Salem High, where teachers say this inclusivity is decreasing bullying. https://t.co/tPfHwtT2tT"
1220048156630454272,2020-01-22 18:18:42,"The Supreme Court's landmark ruling in Roe v. Wade affirmed the right to safe and legal abortion. 47 years later, this fundamental right is being challenged across the nation. I'm proud Oregon protects a women's right to choose; let's keep fighting to make sure it stays that way."
1219839904332468224,2020-01-22 04:31:11,"The past decade was the hottest ever recorded — caused in large part by carbon dioxide emissions.

""What happens in the future is really up to us,"" says one scientist. https://t.co/nTaxQILKlm"
1219733267399593984,2020-01-21 21:27:27,"Our democracy’s strength relies on representation, and the 2020 Census is integral to making sure that Oregonians receive their fair share of federal resources and congressional representation over the next decade.  https://t.co/1UCCBX4ST2"
1219708808777228289,2020-01-21 19:50:15,"The 2020 Census officially kicks off today in a remote fishing village in Alaska. Oregon and other states' count won't roll out until March, but the frozen ground in Alaska now makes it easier to reach remote communities — and everyone needs to be counted. https://t.co/gMmU8E0wSh"
1219331611306520576,2020-01-20 18:51:24,"I keep a rock engraved with these words from #MLK, “Our lives begin to end when we are silent about the things that matter.”

I believe in the power of speaking up: for a world where the best of humanity prevails, and where every person has the right to life, liberty and justice."
1218402008169713664,2020-01-18 05:17:30,"Kicking off the weekend with a beautiful interfaith community gathering in celebration of Martin Luther King, Jr. — Thank you Congregation Beth Israel for hosting this special Shabbat service. https://t.co/Mewu0giRG2"
1218244087507144704,2020-01-17 18:49:58,"""Voting is a privilege""? No Governor, you're wrong. It's a right.

Let's call this out for what it is: voter suppression. https://t.co/T3SpFS2xfV"
1218028218965352448,2020-01-17 04:32:11,"Amazing game! Was lucky to catch this one in person, and witness @sabrina_i20 score a career-high 37 points. Congratulations, @OregonWBB. #GoDucks https://t.co/S392Q1Fc1e"
1217925548988461056,2020-01-16 21:44:13,"Expanding access to clean, renewable energy for Oregonians who may not otherwise be able to afford the investment in solar is the focus of @ODOEnergy's new solar + energy storage rebate program. https://t.co/NqiUf5lnil"
1217877523435941888,2020-01-16 18:33:23,"An estimated 70% of people will fill out the 2020 Census this year — the remaining are “hard-to-count” as they may not participate, for one reason or another. Local leaders across the state are getting the word out about the importance of participation. https://t.co/cHybcjWU5A"
1217533018396475392,2020-01-15 19:44:26,"A step in the right direction: a federal judge has blocked Trump’s executive order giving states and local governments the power to reject resettling refugees. 

Oregon is, and will continue to be, a sanctuary for refugees. #RefugeesWelcome https://t.co/qFQwL51S7l"
1217302691371552769,2020-01-15 04:29:12,"Congratulations to The Dalles community on snagging a  top five spot on the TV show, @smbizrevolution! If enough people vote, they could win a small business ""makeover"" —what an incredible opportunity. https://t.co/NTJmmQs7cL"
1217193050364973056,2020-01-14 21:13:32,"On this day, 100 years ago: Oregon ratified the 19th amendment. While we celebrate this milestone, we still have so much work to do. We must keep up the fight to ensure that every eligible voter can have their voice heard. https://t.co/uVOrxPPEdZ"
1216862726212837376,2020-01-13 23:20:56,"""... research has shown that automatic vote registration is proven to significantly increase the number of unregistered people who get registered."" 

Yes. We have seen this firsthand in Oregon.

https://t.co/prHQHLL5E5"
1216527280090025984,2020-01-13 01:08:00,"I'm a bit speechless reading Craig's story. This former @BeaverFootball star has summited the highest mountain peak on each of the 7 continents — something only ~500 people in history have done! 

And he climbed 4 of those peaks after an ALS diagnosis. https://t.co/lvT8m3qkgR"
1216413027643412481,2020-01-12 17:34:00,"From improving recycling in multifamily housing in Multnomah County to investing in a farm-to-school program in Jackson County, @OregonDEQ is helping 17 organizations across the state boost projects that benefit our environment. https://t.co/uSDiE92mtU"
1216216890986549248,2020-01-12 04:34:37,The Oregon Army National Guard is blessed with truly remarkable people — and Task Force Jungleer is no exception. These volunteers will be leaving their jobs in order to serve on a peacekeeping mission in Kosovo. You make Oregon proud. #AmazingOregonians https://t.co/IpGN2dOPkU
1216065235729039365,2020-01-11 18:32:00,"Working with local tribal leaders and the National Park Service, @OregonDOT restored the Chief Joseph memorial along Highway 351 in eastern Oregon — a tribute to preserving the past, and ensuring future generations can continue to honor and learn. https://t.co/JjdmNfJfmR"
1215786257122332672,2020-01-11 00:03:26,"A preview of inaction on climate change: as the planet warms (mostly due to increased levels of carbon in the atmosphere) the kinds of things we experience every now and then will happen more frequently — like this weekend's massive tides on the coast.
https://t.co/q36vfy8Bo4"
1215754441325867008,2020-01-10 21:57:01,Oregon’s CCO system is a national model for community-based health solutions — great to see them working with @OHAOregon to ensure patient care for the Oregon Health Plan’s nearly one million members continues uninterrupted during the CCO 2.0 transition. https://t.co/SZktF8174s
1215401761839562754,2020-01-09 22:35:35,"Voting is a fundamental right of being a citizen, and people across the country should have the ability to access this fundamental right without barriers like registration. 

Automatic Voter Registration works. Well done, New York. https://t.co/L9iroOsLnQ"
1215366639102783488,2020-01-09 20:16:01,"In Ben's words:

""As a rural natural-resource based business owner, I realize climate legislation may very well impact my bottom line. There is no magical, free solution to this problem. But the cost of inaction will hurt my bottom line much more."" 

https://t.co/EudWZUMojw"
1215044236791300096,2020-01-08 22:54:55,Free public transportation is helping students in Clatsop County get to school and extracurricular activities — an initiative that launches as communities across Oregon are working together to address barriers that students face in getting to school. https://t.co/ns2QUSdFn4
1214693985307873280,2020-01-07 23:43:08,"Hard to see the devastating wildfires in Australia, and reckon with the fact that climate change is making them worse. We join the world in wishing for the safety of all Australians.

Good luck to the Oregon firefighters deploying to help. https://t.co/QSURA6ApcJ"
1214638776326094849,2020-01-07 20:03:45,"Excited to follow the work of Oregon's new Teacher of the Year, Mercedes Muñoz. She has a powerful message to share — in her own words: “Special education students are general education students first — they belong to all of us.” https://t.co/aTRtVdsw5J"
1214286807455522816,2020-01-06 20:45:09,"Huge congratulations to Oregon's @LAIKAStudios for winning the #GoldenGlobes Award for Best Animated Feature Film! ""Missing Link"" looks fantastic — about a 19th Century explorer who comes across Bigfoot in the PNW. https://t.co/UTWeqZHTzS"
1213574832090017792,2020-01-04 21:36:01,"If you haven’t yet seen a frozen waterfall on a winter hike, try and catch one! It’s pretty remarkable. Dan and I enjoy Silver Falls, the Gorge hikes are great too. https://t.co/18KBQfJ3Jw"
1213242200966025224,2020-01-03 23:34:16,"The facts are clear: Oregon saw youth e-cigarette use jump by nearly 80% between 2017-2019. By failing to ban all flavored vaping products, the FDA’s latest decision falls short of protecting our youth from vaping-related illnesses and a lifetime of nicotine addiction. https://t.co/0huJOs0PyS"
1213189782844538880,2020-01-03 20:05:58,"Scientists agree that sea levels are rising due to climate change, putting Oregon's coastal communities at risk. 

Best-case scenario: if we stop emitting greenhouse gases today, sea levels rise by a foot by the end of the century. Worst-case: 3 feet. https://t.co/GIW174xQok"
1213155276377018370,2020-01-03 17:48:51,Yet another attempt to interfere with a woman's right to choose. The government has no place in the conversations between women and their doctors. How is this still happening in 2020? https://t.co/nkmItWj52I
1212911622248792069,2020-01-03 01:40:40,"Nick Fish was a devoted public servant, and a true leader who cared so deeply about serving the people of Portland. An advocate for our environment, and a champion for the homeless. I will always remember his kindness. Dan and my thoughts are with his family."
1212879605129834496,2020-01-02 23:33:26,"Thanks to a four step treatment process, Washington County’s recycled water can now be used by breweries and distilleries to make beer, whiskey and other adult beverages. https://t.co/4SQiU5hJMj"
1212798310685106178,2020-01-02 18:10:24,"RT @OregonDEQ: Need an easier NY’s resolution than running a marathon?

How about committing to becoming a better recycler? It just takes m…"
1212798021026500613,2020-01-02 18:09:15,"RT @OHAOregon: #Flu season is in full swing, but it’s not too late to get a flu shot! You can find more information on flu clinics near you…"
1212553578214150145,2020-01-02 01:57:55,"What a game. What a season. Congratulations, Ducks! #RoseBowl #GoDucks https://t.co/MFzKQXdg5V"
1212471672038662144,2020-01-01 20:32:27,"Wishing everyone a great start to 2020! There is so much I’m looking forward to this year, and topping that list is continuing to work every day to make sure Oregon is a welcoming place to all who call it home, and one where every Oregonian is given the opportunity to thrive."
